corpus	sentence
itwac	Gli sposini Alex e Sonia Del Piero in campo Video : mare e lune di miele per l' estate Insomma il " [SEP] passerotto [SEP] " della Juve è riuscito ad evitare qualunque pubblicità , ma allo stesso tempo ha scatenato la curiosità degli esperti del pettegolezzo .
itwac	Dai 2 anni Domenica 8,15,22,29 maggio 2005 Parchi cittadini Il Gruppo Libero Teatro Come il lombrico mangia il [SEP] passerotto [SEP] Strane presenze nel parco - spettacolo per i parchi su biodiversità e sviluppo sostenibile per un pubblico di tutte le età Attraverso la rappresentazione Come il lombrico mangia il passerotto , gli spettatori vengono invitati ad " esplorare " i parchi con modalità inconsuete .
itwac	Amelio [SEP] Passerotti [SEP] , quale legale rappresentante della predetta società , era indagato , in concorso con illegale rappresentante della spa Porto Petroli di Genova , Italo Righi , con illegale rappresentante della sri Co.A.A.L. , Costante Rocco , e con altri , per i reati continuati p. e p. dall' art. 51 , comma 1 , lett. b ) , D.L.vo 22/1977 ( trasporto di rifiuti speciali pericolosi in assenza della prescritta iscrizione all' albo speciale gestori rifiuti ) e dall' art. 52 , comma 3 , D.L.vo 22/1977 in relazione all' art. 483 c.p. ( trasporto di rifiuti pericolosi senza iI prescritto formulario identificativo ) .
itwac	Maria non si dispiace per nulla della fuga precipitosa del [SEP] passerotto [SEP] anzi ride , ride e continua a battere le manine felice ed emozionata .
itwac	parlava , il Tar toscano si pronuncia contro le deroghe sulla caccia e salva 750.000 [SEP] passerotti [SEP] .
itwac	Giunta la sera , il motociclista va a dormire , sperando che il [SEP] passerotto [SEP] si riprenda .
itwac	" Tranquillo , [SEP] passerotto [SEP] , è tutto finito .
itwac	quando la macchina è pulita e ci caga sopra qualche [SEP] passerotto [SEP] .
itwac	È interessante segnalare come abbiano aderito alla mostra due tra le più importanti pinacoteche europee come la Gemaldegalerie di Berlino con un' opera di Bartolomeo [SEP] Passerotti [SEP] e il Kunsthistorisches Museum di Vienna con uno stupendo ritratto di Monsignor Giuliano della Rovere di Federico Barocci .
itwac	Per sentire il canto dei [SEP] passerotti [SEP] basta chiudere gli occhi e stare in silenzio ...
itwac	[SEP] passerotto [SEP] non andare via ...
itwac	Forse si vergognano , o temono che non si possa dare da mangiare agli uccellini , ma questi sono [SEP] passerotti [SEP] , chi mai potrebbe vietare loro qualche briciola sicura ?
itwac	I [SEP] Passerotti [SEP] ...
itwac	A sinistra , bel " Ritratto di giovane musico " del bolognese Bartolomeo [SEP] Passerotti [SEP] , databile circa al 1560 - 65 .
itwac	Se n' è accorta ieri una signora residente in via Goldoni che ha notato dal suo terrazzo una famigliola di [SEP] passerotti [SEP] appena nati alle prese con afa e siccità e in pericolo di vita per il sole che batteva senza sosta sui corpicini degli animali .
itwac	Dai rami degli alberi che circondano la casa il cinguettìo dei [SEP] passerotti [SEP] preannuncia l' alba .
itwac	Ma , tornando al pronunciamento del Tar a favore dei [SEP] passerotti [SEP] , il Panda , ripercorrendo brevemente le tappe di questa disputa tra mondo ambientalista e mondo venatorio , ricorda che con il Decreto Regionale n. 170 del 17 settembre 2001 , la Toscana aveva permesso di cacciare le due specie di passeri dal 17 settembre al 31 gennaio 2002 .
itwac	Lesbia , sicuramente lusingata dall' attenzione di Catullo , visse la vicenda come un' avventura , una delle tante , mentre Catullo , perdutamente innamorato , diede tutto se stesso alla donna amata ; anche nelle piccole cose , per consolarla di un leggero dolore , come in occasione della morte del suo [SEP] passerotto [SEP] ( CARME 3 ) L' amore , così come la poesia , in questo momento felice è per Catullo lusus puro , naturale , spontaneo ; il poeta , pur nell' ebbrezza della felicità , non può scordare il fatto ineluttabile che la vita , così come il piacere , è destinata a durare poco .
itwac	;) Diamond Phoenix [SEP] Passerotti [SEP] , credo che stiate leggermente divagando .
itwac	- Un giorno nuovo sembra entrare dalla mia finestra col suo fascio di luce e di colori sento il canto acuto dei [SEP] passerotti [SEP] soprastare il rombo ovattato delle automobili .
itwac	Bandito Iscritto dal : 6/8/2003 Messaggi : 396 Da : Cernusco - Milano Un [SEP] passerotto [SEP] si lancia dal nido e , con i pochi rudimenti ricevuti dai genitori , comincia ad esplorare il mondo .
itwac	Gli argomenti delle sue commedie sono legati agli ambienti e al repertorio partenopeo , e prendono spunto dalla cronaca e da temi sociali : l' handicap in [SEP] Passerotti [SEP] e pipistrelli ?
itwac	Così dall' imponente aquila ' catturata ' dall' agenzia Abrinicio per far salire in vetta alle vendite intere cassette di Acqua Prata , si passa al timido ma pervicace [SEP] passerotto [SEP] che , spot dopo spot , accompagna Alessandro Del Piero in progressive bevute di acqua Uliveto .
itwac	E' tempo che tu accolga le rondini in arrivo e ne riassetti il nido in fretta abbandonato , è ora che tu svegli ricci e tartarughe per invitarli a uscire al tepore e alla luce ; non perderti il colore del mare che diventa più azzurro , il profumo dei fondali di posidonia in fiore e il chiasso dei gabbiani eccitati dal sole ; guarda fra poco l' esultanza di peschi ed albicocchi e i merli e i [SEP] passerotti [SEP] che indugiano sicuri tra primule e narcisi ; il ronzio degli insetti è più deciso , le lucertole riposano sul solatìo dei muri : c' è voglia d' aria nuova e pulsare di vita intorno a te ...
itwac	E forse quei [SEP] passerotti [SEP] , anche loro , ripetevano al vecchio albero le solite frasi , gli inutili consigli , i vani ammonimenti , che si sogliono dare ai caduti , a gli sconsolati : « Fatti coraggio !
itwac	Continua il testo : Infatti , anche il [SEP] passerotto [SEP] s' è trovato una casa e la tortora un nido , ove collocare i suoi piccoli .
itwac	che un piccolo [SEP] passerotto [SEP] quando prova a volare , se viene investito da una folata troppo forte di vento , non solo cadrà dal ramo , ma non troverà il coraggio di rialzarsi e riprovare a volare .
itwac	SOLISTA : C' è dentro un [SEP] passerotto [SEP] col fiocco tutto rosso e i gatti bianchi e neri e chicchi di caffè !
itwac	" Due [SEP] Passerotti [SEP] Due passerotti se ne stavano beatamente a prendere il fresco sulla stessa pianta , che era un salice .
itwac	La nuova serie di esperimenti è avvenuta ieri pomeriggio , tra le 18 e le 19 e ha visto protagonisti il maratoneta Gorilla Eucalipto , a sorpresa l' immancabile [SEP] Passerotto [SEP] Olmo e Merlo Papavero , presenti Antilope Verbena per i controlli sanitari e Sirena Ninfea con il suo " gruppo rock " oracolare .
itwac	Tua madre ora si sente come un [SEP] passerotto [SEP] spaurito che deve lasciare il nido , scoprire ciò che di meglio la vita può darmi come Tu mi hai insegnato , imparare a volare da sola qundo ci provo ...
itwac	Voglio lavorare ma nessuno mi caga se non per fare il disegnatore ( Me 10 AutoCad et similia ) o peggio come mi é capitato disegnare tutto il giorno scatole con Pro / E ( della serie andiamo a caccia di [SEP] passerotti [SEP] con un bazzuka ) e aggiornare distinta base ...
itwac	Uno stimato giurista sosteneva l' inammissibilità del referendum poiché ad esempio un cittadino può essere d' accordo a non cacciare il [SEP] passerotto [SEP] , ma potrebbe essere d' accordo sulla caccia al fagiano .
itwac	Sua è anche l' idea del nome d' arte di quell' artista piccola , minuta , dagli occhi grandi e dalla voce possente e drammatica : " Piaf " , che nell' argot parigino vuol dire " [SEP] Passerotto [SEP] " .
itwac	La soddisfazione del WWF che aveva fatto ricorso e , proprio il giorno prima , scritto una lettera al Papa nella quale , con molto humor , si faceva mettere in evidenza allo stesso Poverello di Assisi la scarsa attenzione che l' Italia ha per gli animali " In seguito al ricorso presentato dal WWF e dalla Lipu Toscana , il Tar della Toscana ha bloccato per il secondo anno consecutivo la possibilità di cacciare la Passera d' Italia Passer italiae ( il comune [SEP] passerotto [SEP] ) e la Passera mattugia Passer montanus , in attesa di valutare nel merito la questione della deroga alla caccia per le specie in questione " .
itwac	[SEP] Passerotto [SEP] non più rannicchiato sotto l' albero a cercare la verità nella Poesia l' amore tra gli uomini che non sanno amare .
itwac	[SEP] passerotto [SEP] non andare via , senza i tuoi capricci che faro' ...
itwac	Vedevo degli uccelli molto piccoli forse erano dei [SEP] passerotti [SEP] , svolazzavano tranquilli ...
itwac	Uno di loro vedendolo disse che era così brutto il [SEP] passerotto [SEP] che non valeva la pena di raccoglierlo , ma l' altro , il più piccolo , disse che lo avrebbe raccolto lui e che lo avrebbe fatto vedere alla sua mamma sperando di poterlo pulire .
itwac	PASSEROTTO NON ANDARE VIA , il [SEP] passerotto [SEP] dov' è andato , nella ?
itwac	) 2 ) qualche anno fa avevo in casa l' unico [SEP] passerotto [SEP] ( oltre a quello di Del Piero ) dotato di personalità : non mi poteva vedere ( eppure non lo calcolavo minimamente ) e se solo mi avvicinavo alla gabbia ( per fare i cavoli miei ) si gonfiava , alzava le penne , allargava le ali e apriva il becco facendo un verso che poteva essere assimilato al ringhiare di un cane ...
itwac	Quelle parole così immanenti afflosciarono la voce di Edith che di colpo si spezzò e il " [SEP] passerotto [SEP] " della canzone cadde a terra svenuta .
itwac	Cavalli , cani , scarafaggi , mucche , [SEP] passerotti [SEP] , zebre , squali , bisce , coccinelle , cornacchie , tigri , conigli , giraffe ...
itwac	- Quel che la Principessa vorrà ; [SEP] passerotto [SEP] o pettirosso .
itwac	Un giorno come l' altro antiche case di mattoni di borghi silenziosi dove a sprazzi giunge il sole chiacchiericci di donne due gatti si rincorrono lento il passare del tempo semplici le storie come già vissute prima un nuovo nato fra noi un altro se n' è andato un [SEP] passerotto [SEP] su una grondaia guarda la torre vicina in silenzio il tempo scorre quasi con pudore tace la meridiana sulla piazza dove si posa il sole
itwac	Le panchine vuote emanavano tristezza , la stradina polverosa si stava scurendo , i [SEP] passerotti [SEP] si erano giudiziosamente ritirati , solo le formiche continuavano il loro lavoro , e io cominciavo a sperare .
itwac	Gesù , designando il mistero divino col termine « Padre » , rivela che la presenza attiva e fecondatrice di Dio è operante nella sua persona e , per partecipazione , essendo Cristo colui che riporta tutte le creature al loro centro originario , nelle manifestazioni particolari di ogni essere creato , È il Padre che riveste di bellezza i gigli del campo , che vigila amoroso sui [SEP] passerotti [SEP] , che non permette la caduta di un solo capello senza il suo volere .
itwac	Il progetto perseguito dalla contessa Cavazza di un recupero degli antichi modelli ( a cui si affiancavano disegni originali spesso basati su schizzi di Rubbiani ) , attraverso cui fondare un miglioramento del gusto ed un rilancio dell' artigianato di qualità , trova forse il suo esempio più significativo nella realizzazione a merletto da parte delle lavoranti Aemilia Ars del cinquecentesco libro dei lauorieri di Aurelio [SEP] Passerotti [SEP] , di proprietà della famiglia Malvezzi .
itwac	Foglie staccate dal ramo e partite ormai senza vite , ma tenere e dolci volate e rapite da quel [SEP] passerotto [SEP] che porta nel nido il cantico rotto del fresco che avanza .
itwac	( Ridono tutti ) Marcello - E chi è il [SEP] passerotto [SEP] ?
itwac	Giunta la sera , il motociclista va a dormire , sperando che il [SEP] passerotto [SEP] si riprenda .
itwac	La relatrice ha presentato diverse opere , tra cui un' incisione di Tibaldi , su invenzione di [SEP] Passerotti [SEP] , in cui il pontefice è seduto e ha in mano un mappamondo .
itwac	Ed ecco che Pasolini ci pone l' esempio dei due frati francescani ( non a caso Totò e Ninetto Davoli ) che cercano di convertire prima i [SEP] passerotti [SEP] ( gli uccelli più deboli ) , e poi i falchi ( gli uccelli più preportenti ) : entrambi amano un Dio , ma tra di loro esisterà per sempre un divario enorme , una guerra perenne che sarà sempre vinta dalla classe più forte !
itwac	Un [SEP] passerotto [SEP] , sì , che si posa sul selciato davanti a me , e si guarda intorno per controllare la situazione .
itwac	Un attore ( Frask Cirrisckj ) e un' attrice ( Florinda Petalin ) , attraverso due percorsi esplorativi : il percorso della Terra e il percorso dell' Aria , raccontano i principi dell' ecologia e le regole del ciclo della vita ( attraverso le quali , appunto , il lombrico arriva a sua volta a cibarsi del [SEP] passerotto [SEP] ) .
itwac	Lanza o nun Lanza , se ti battan sotto , ' Ni devi di' che a loro ' n der celvello ' Ni c' è andat ' a covare un [SEP] passerotto [SEP] .
itwac	L' aria che respiriamo Siamo come due [SEP] passerotti [SEP] sul ciglio della strada che beccheggiamo umidi vermi pilucchiamo gocce di rugiada sfidando le ruote dei tir Ci illudiamo che l' agilità sia più grande della forza e intanto l' aria che respiriamo ci uccide lentamente .
itwac	john Flanaghan Senior Member Ostia 546 Posts Posted - 06/04/2005 : 12:38:14 Un [SEP] passerotto [SEP] si lancia dal nido e , con i pochi rudimenti ricevuti dai genitori , comincia ad esplorare il mondo .
itwac	Ero bambino , cinque anni , un muratore al mare mi regalò un [SEP] passerotto [SEP] .
itwac	Si meravigliavano di fronte al fascino della danza , dell' istinto , del volo del [SEP] passerotto [SEP] triste .
itwac	piantala di fare il bauscia , archetti , e guarda i [SEP] passerotti [SEP] Il commento di giovanni arezzo 3 marzo 2005 caro marco , mi chiamo Giovanni Arezzo , ho vent' anni , sono nato a Ragusa ma vivo a Roma , dove frequento il secondo anno dell' Accademia Nazionale d' Arte Drammatica " SILVIO D' AMICO " .
itwac	Su i rami di un albero simile ad un grande abete vi erano addormentate coppie diverse di uccelli : fringuelli dal dorso bruno e dal petto rossiccio , merli con il loro becco giallo , aquile dall' enormi ali e teneri [SEP] passerotti [SEP] .
itwac	" E il [SEP] passerotto [SEP] : " Ma vaffanculo ...
itwac	CENERENTOLA - Segui il cinguettio dei [SEP] passerotti [SEP] che vengono a beccare le briciole che metto sul davanzale , o lo scoiattolo marrone che ha fatto la sua casina sulla quercia grande .
itwac	La morte di questo [SEP] passerotto [SEP] è stata quasi un atto di ribellione a quegli stupidi stereotipi , anche se più vicina a un atto di cinismo , perché premeditata " .
itwac	adoro quel [SEP] passerotto [SEP] !
itwac	Sentiremo le cicale frinire , i [SEP] passerotti [SEP] cinguettare , i tigrotti miagolare .
itwac	e penso : voglio fare come questo [SEP] passerotto [SEP] , lasciarmi trasportare e tenere le energie per quando ci saranno ostacoli da superare 3 ) l' alta quota mi fa decisamente bene .
itwac	Vola il cigno , vola il [SEP] passerotto [SEP] , La cicogna , vola l' aquilotto , Vola ...
itwac	Com' incanto la - sciato perir da inumano dolore e al solitario giunco poggiato stanco a ' cor de lo novello piovo fa festa il [SEP] passerotto [SEP] , d' inesperto principio che per andar di tempo in sul calar del sole di un fiore sfiorisce , e candidamente fugge negli orizzonti dolci d' adorata cantilena .
itwac	Sicché passavo gran parte del giorno scorrazzando per il viale e i giardini pubblici , e fu Cordeiro , lo spazzino che raccoglieva immondizia e foglie secche , a darmi quel soprannome : " Sembri un [SEP] passerotto [SEP] " .
itwac	Il [SEP] passerotto [SEP] , pensate , è quello che compare nel duetto con Mary Poppins .
itwac	Un' improvvisa intossicazione povero [SEP] passerotto [SEP] !
itwac	BARONE : Quando mi conoscerà un po' meglio , diventerò sicuramente il suo [SEP] passerotto [SEP] innamorato .
itwac	Un attore ( Frask Cirrisckj ) e un' attrice ( Florinda Petalin ) , attraverso due percorsi esplorativi : il percorso della Terra e il percorso dell' Aria , raccontano i principi dell' ecologia e le regole del ciclo della vita ( attraverso le quali , appunto , il lombrico arriva a sua volta a cibarsi del [SEP] passerotto [SEP] ) .
itwac	E mia mamma , impietosa , strappò alla mia panterona il sudato bottino : un [SEP] passerotto [SEP] o giù di lì ...
itwac	AManca Scritto Da - ninomanca on 20 Febbraio 2004 23:40:44 ventura 1 questo filone stava languendo come un implume [SEP] passerotto [SEP] caduto dal nido , condannato a perire perchè le alucce appena accennate non sono ancora pronte al volo , mentre la madre svolazza nervosa attorno fino al tramonto eppoi ...
itwac	Io avevo passato quei primi dieci giorni a guardare la finestrella e lo spicchio di cielo che , oltre essa , si vedeva ; a spargerci sopra le briciole di pane , e a contare i [SEP] passerotti [SEP] che venivano a beccarle .
itwac	FF 8 : litigi tra Zell e Seifer FF 9 : scena dei Tantarus iniziale " sarò il tuo [SEP] passerotto [SEP] " , tutta la scena della lettere " mancata " da Eiko per Gidan , molte scene di Quina ed Er Cina ...
itwac	Ne arriva un altro e poi un altro : miriadi di [SEP] passerotti [SEP] a comporre qualcosa .
itwac	Non cade un [SEP] passerotto [SEP] senza il Padre ; nel senso che non succede nulla all' insaputa del Padre .
itwac	Ha scritto e interpretato : " Sogni , bisogni , incubi e risvegli " ( 1990 ) , " A chi figli e a chi figliastri " ( 1991 ) , " Lo strano caso di Felice C. " ( 1992 ) , " [SEP] Passerotti [SEP] o pipistrelli ?
itwac	Basta andare un po' in giro per trovarne " li rassicurò il piccolo [SEP] passerotto [SEP] .
itwac	N.B. martedì 16 novembre 2004 , 9:54 Pubblicato da : Brunell @ il 14 novembre 2004 CICALE COM' E' BELLO FAR L' AMORE DA TRIESTE IN GIU' RAMAYA GIOCA GIUE ' GELATO AL CIOCCOLATO [SEP] PASSEROTTO [SEP] NON ANDARE VIA MOI JE T' AIME MOI NON PLUS LA COLONNA SONORA DEL TEMPO DELLE MELE più tardi mi vengono in mente gli altri Che ne dici di : Rino Gaetano tutto Montagne Verdi di Marcella Bella Piccola e fragile di Drupi Donna Rosa di Pippo Baudo Donna Felicità dei Formula Tre Jesahel dei Delirium Sugli Sugli Bane Bane de Le Figlie del vento Amore grande , amore libero de Il Guardiano del Faro La canzone intelligente di Cochi e Renato Dune Buggy degli Oliver Onions Sei forte papà ' di Gianni Morandi Prisencolinesinainciusol di Adriano Celentano Pippi Calzelunghe , la sigla La freccia nera , idem ;) Brunell @ martedì 16 novembre 2004 , 9:58 d' accordo su tutto , ad eccezione di montagne verdi , su cui non posso transigere .
itwac	Si ricordano , tra gli altri : Ottavia ovvero indifferentemente ( 1985 ) , con la regia di D. Mele e la partecipazione di Angela Pagano ; Macabé ( 1987 ) , insieme a Ursula von Baechler ; Senza impegno ( 1988 ) con Franco Acampora ; Cuore ingrato ( 1989 ) ; [SEP] Passerotto [SEP] ( 1996 ) ; Sorelle , madri , spose ...
itwac	Ma il [SEP] passerotto [SEP] rispose che non aveva tempo e non voleva essere disturbato .
itwac	DM " Chierico , all' interno della recinzione vedi una voliera enorme con tante varietà di uccelli , anche rapaci " Chierico " Mmmmmh ( si guarda nella bisaccia ) , devo prendere delle penne , mi avvicino furtivamente con la tecnica del [SEP] Passerotto [SEP] con gli occhi languidi ma figlio di p ***** a dentro ( TM Aldo , Giovanni & Giacomo ) e apro la gabbia dove c' è l' Aquila addormentata , poi a tradimento la spenno col mio rasoio + 1 " DM " L' aquila urla e dietro di te appare un Orco che dice " Giangi , Franchino , addosso all' intruso " , e due simpatici tori assetati di sangue ti caricano : iniziativa !
itwac	Facilitavo quotidianamente [SEP] passerotti [SEP] e topolini , merli e ricci , viole e ciliegi , con vitto , acqua ed allentamento dei fili di ferro sinora tesi a sostegno di pesi enormi , tali da ferire la corteccia delle piante , per esempio ...
itwac	[SEP] Passerotti [SEP] .
itwac	;) Diamond Phoenix [SEP] Passerotti [SEP] , credo che stiate leggermente divagando .
itwac	Brunell @ domenica 14 novembre 2004 , 19:43 CICALE COM' E' BELLO FAR L' AMORE DA TRIESTE IN GIU' RAMAYA GIOCA GIUE ' GELATO AL CIOCCOLATO [SEP] PASSEROTTO [SEP] NON ANDARE VIA MOI JE T' AIME MOI NON PLUS LA COLONNA SONORA DEL TEMPO DELLE MELE più tardi mi vengono in mente gli altri marioRossi lunedì 15 novembre 2004 , 7:42 ed e' quasi innegabile che il vero sano rock latita da anni sul pianeta terra Infatti , è così , non c' è dubbio che la amcchinetta si è inceppata .
itwac	Poi abbiamo " adottato " un pipistrello che ha messo su casa nell' intercapedine , che non abbiamo potuto chiudere proprio perché ci siamo accorti della sua presenza , e che ogni tanto la sera esce e ci svolazza intorno , e come ospiti temporanei ci sono stati ( e ci saranno , come sempre ) vari animali selvatici trovati in condizioni pietose ( quest' anno abbiamo avuto Ottone , il passerotto coglione , Pasquale , il passerotto letale , e Achille , il [SEP] passerotto [SEP] imbecille , che si sono buttati nella bocca dei gatti al primo volo ) .
itwac	Martedi 21 Giugno 2005 Malnate - Sabato 25 e domenica 26 giugno una maratona di lettura in varie lingue del capolavoro di Carlo Collodi La notte più lunga di Pinocchio Varese - Slitta il termine ultimo per partecipare al concorso " Con - 1000 storie " lanciato da Cont@tto e riservato ai ragazzi tra i 14 e i 23 anni Prorogata al 30 luglio la scadenza per l' invio dei racconti Mercoledi 22 Giugno 2005 Samarate - Grande successo a Librando per la serata dedicata al cantautore genovese La storia d' Italia raccontata da Fabrizio De André Samarate - " Quando avete buttato nel mondo d' oggi un ragazzo senza istruzione avete buttato in cielo un [SEP] passerotto [SEP] senza ali " .
itwac	Non era un [SEP] passerotto [SEP] ; forse era una di quelle specie che devono stare in gabbia - come i canarini - , perche' la liberta' non gli garantisce il cibo e la temperatura adatti , e il loro volo e' troppo debole per fargli evitare le bocche spalancate dei gatti .
itwac	C' è un passerotto , un [SEP] passerotto [SEP] dentro l' uovo l' uovo dentro il nido il nido tra le foglie le foglie sopra i rami i rami sopra l' albero e l' albero è piantato in mezzo al prato ( 2 volte ) .
itwac	" I [SEP] passerotti [SEP] non fanno rumore .
itwac	;) Diamond Phoenix [SEP] Passerotti [SEP] , credo che stiate leggermente divagando .
itwac	BARONE : Lo vedo e creda che per lei potrò essere come un [SEP] passerotto [SEP] innamorato .
itwac	Ciao Il commento di chiara 1 giugno 2004 e la storia del [SEP] passerotto [SEP] col biscotto all' uvetta ...
itwac	Stanco per il lavoro mise il [SEP] passerotto [SEP] finto nella nuova casetta e dopo aver dato la buonanotte ai suoi genitori si addormentò .
itwac	indice I [SEP] PASSEROTTI [SEP] INNAMORATI C' erano una volta due passerotti innamorati .
itwac	Al commissariato con lei si comportarono con decenza , la palparono solo dal sergente in sù , mentre Maria si occupava di piangere i [SEP] passerotti [SEP] le si sbiadirono sotto la pioggia di lacrime .
itwac	SPOSAMI !!!!!!!!!! Otto il [SEP] passerotto [SEP] ...
itwac	( c.m. ) = = = = = = = PASSERI = = = = = = = Lago di Varese , l' invasione dei [SEP] passerotti [SEP] cinesi Un commerciante liberò quindici esemplari che nessuno voleva : adesso se ne contano migliaia http://www.corriere.it/edicola/index.jsp?path=LOMBARDIA&doc=VAR VARESE - L' invasione del made in China : conoscevamo quella dei prodotti industriali , quella dei ristoranti che servono wanton e involtini primavera ; l' elenco va ora aggiornato con il parodoxornis alphonsianus .
itwac	" Qualcosa del genere [SEP] passerotto [SEP] " .
itwac	) Segretario MSAC diocesano e membro d' équipe nazionale P.S. : chi vuole il Ballo dell' Estate o la canzone originale di Otto il [SEP] Passerotto [SEP] , la bucolica favoletta raccontata da Pierluigi e Romina a Furore , mi contatti in privato !
itwac	Un altro orientamento , che appare prevalente , sostiene invece che l' articolo 14 è vincolante per il Giudice italiano giacché la direttiva comunitaria sui rifiuti non è autoapplicativa ( self-executing ) in quanto necessita di atto di recepimento da parte dello Stato nazionale ( Sezione III , n. 4052 del 29.1.2003 , [SEP] Passerotti [SEP] , rv .
itwac	Io m & # x 92 ; immagino due schiere di [SEP] passerotti [SEP] , 40 e 40 , disposte una di fronte all & # x 92 ; altra .
itwac	Scusi guardi che qui non si può stare cip " mi ha detto un [SEP] passerotto [SEP] " oh buongiorno , mi scusi son capitato qui per caso ...
itwac	Il [SEP] passerotto [SEP] cade a terra , tramortito e piuttosto malconcio ...
itwac	NASSIRIYA - Sembra un [SEP] passerotto [SEP] infreddolito , l' onorevole Emma Bonino , in mezzo allo stato maggiore militare che la riceve al « Campo Mittica » , la nuova base dei militari italiani in Iraq intitolata alla medaglia d' oro della Seconda guerra mondiale .
itwac	I [SEP] passerotti [SEP] , che si erano svegliati alle voci mattutine , cominciarono a pigolare dietro il nido .
itwac	Bandito Iscritto dal : 16/6/2004 Messaggi : 794 Da : Trieste Un [SEP] passerotto [SEP] si lancia dal nido e , con i pochi rudimenti ricevuti dai genitori , comincia ad esplorare il mondo .
itwac	[SEP] Passerotti [SEP] e Tibaldi hanno pensato di divulgare un' immagine del papa che non trascura nessuno degli interessi del colto pontefice , appassionato di lenti , giochi ottici e cartografia .
itwac	Sarà una suggestione ma ieri mattina , in piazza della Vittoria sembrava che fossero spariti piccioni e [SEP] passerotti [SEP] .
itwac	hanno l' intento di spaventare [SEP] passerotti [SEP] e simili con cannonate parecchio rumorose regolate da un timer ...
