corpus	sentence
itwac	Ecco , stanno osservando i [SEP] passerotti [SEP] che becchettano guardinghi , poi lui prenderà il libro dalla tasca della giacca , lo fa sempre , ma non legge mai , lei non può farlo e allora lui non se la sente , ma il libro in tasca lo porta lo stesso .
itwac	Passa la notte , al mattino presto il [SEP] passerotto [SEP] , ancora un po' stordito , apre gli occhi e si guarda intorno ...
itwac	Scritto il : 29 Jul 2004 14:40:57 Messaggio : ragazze ho appena trovato nel giardino dell' ufficio un [SEP] passerotto [SEP] cucciolo che è caduto dal nido .
itwac	Durante un volo di avanscoperta in una scuola di cinciallegre Zfa e Zma avevano incontrato e chiamato Zuo , passerotto austero e solitario , desideroso di " cantare " in compagnia ; sullo stesso suo ramo intanto Zmo aveva chiamato Zaa , passerottino timido ma ben deciso a " cantare " la sua canzoncina personale e ad essi si era unito , per un po' di tempo Dea , un [SEP] passerotto [SEP] svagato e distratto appartenente ad un' altra famiglia .
itwac	Questo è il risultato pagina per pagina 1 : " Etta bimba bella , coi uccini " - immagine di Biancaneve coi [SEP] passerotti [SEP] 2 : " Etta brutta mamma " - la regina matrigna e la fine del politically correct 3 : " Bimba bella pulisce pulisce " - immagine di Biancaneve che pulisce per terra 4 : no comment - immagine della regina che parla con lo specchio 5 " Etto uomo cerca " - la regina parla col cacciatore 6 " Uffa , ancora etto uomo " - cacciatore giudicato incapace ...
itwac	Mi sento un po' un [SEP] passerotto [SEP] con le ali legate che fa fatica a volare .
itwac	( Adnkronos ) ********************************************************************************************* Corriere della Sera Il [SEP] passerotto [SEP] cinese nuovo padrone dell' oasi di Varese - 20 ott 04 La storia .
itwac	Un giorno , sotto l' albero dove stava riposando , si trovò a passare una vecchietta a cui cadde il fazzoletto ; essendo anziana e con il mal di schiena e non potendosi chinare per raccoglierlo , vedendo il bel [SEP] passerotto [SEP] sul ramo gli chiese di aiutarla .
itwac	Il cespuglio di crespino che protegge i [SEP] passerotti [SEP] dai corvi e lo screziato tappeto di sterco di uccelli ai suoi piedi sono tutti fatti d' amore .
itwac	Qua e là qualche nido vuoto e un [SEP] passerotto [SEP] attento a spiluccar vermetti .
itwac	Ci sono , poi , immagini di animali ( colomba , cane , gatto , [SEP] passerotto [SEP] , bulldog , rondine , toro , cavallo ) , o simboli grafici di marche di automobili e sigarette .
itwac	Fortunatamente , con un articolo di Giuliano Zincone , il numero di novembre della rivista " Liberal " viene a dircelo : è stata la mancata comprensione delle canzoni di Claudio Baglioni , il cantante di [SEP] Passerotto [SEP] non andare via , Questo piccolo grande amore e Strada facendo .
itwac	La notte sopraggiunge scura e solitaria , la festa finisce , il sogno ridiventa realta' e il [SEP] passerotto [SEP] curioso lascia il buio campanile , per cercare altre storie da spiare , da raccontare e ovviamente ...
itwac	Un giorno il pallone di due bambini che giocavano andò a finire proprio vicino al [SEP] passerotto [SEP] divenuto finto .
itwac	Due [SEP] passerotti [SEP] innamorati sull' albero .
itwac	Davanti al Signore incominciarono veloci a scorrere i sogni del bambino che il [SEP] passerotto [SEP] stava inviando dalla terra , mamma mia quanto è difficile questo ragazzo , però devo dire che ha le idee chiare , mi farà sudare ma alla fine sono sicuro di riuscire a fare un bel lavoretto .
itwac	2 ) un [SEP] passerotto [SEP] vola .
itwac	Ma il [SEP] passerotto [SEP] continuava a zampettare ...
itwac	2 ) un [SEP] passerotto [SEP] vola .
itwac	Sopra la sua testa , volavano tranquillamente alcuni [SEP] passerotti [SEP] , come quelli che aveva visto prima , come se fosse giorno e si divertissero giocherellando tra loro , in buffi arzigogoli .
itwac	Cioè , pensate che significa per un' intera popolazione passare da frasi tipo " [SEP] passerotto [SEP] non andare via " a " lo shivaismo tantrico di stile dionisiaco " !
itwac	Questa ipotesi venne confermata dalla presenza di un [SEP] passerotto [SEP] che ci svegliò la mattina dopo pigolando affamato .
itwac	I [SEP] passerotti [SEP] cinguettano contenti , perché tutti davano loro qualche cosa da mangiare .
itwac	Guai a chi mi chiema ' bel [SEP] passerotto [SEP] ' .
itwac	ma aimè solo in un caso il [SEP] passerotto [SEP] è riuscito a spiccare il volo ...
itwac	Eppure è così : anche fra i ragazzi , se ne trovano pur troppo di questi [SEP] passerotti [SEP] e di questi leprottini , che si prendono mille confidenze sguaiate con tutti quegli infelici , che per ragione di età e di malanni non possono più difendersi né farsi rispettare .
itwac	;) Diamond Phoenix [SEP] Passerotti [SEP] , credo che stiate leggermente divagando .
itwac	I ragazzi organizzeranno una partita di pallone e potranno fare un " vero " intervallo e , dopo il nostro rientro nelle aule , i [SEP] passerotti [SEP] , le tortore e le gazze scenderanno a cercare le briciole della loro colazione .
itwac	Ma un [SEP] passerotto [SEP] carnivoro che assale i suoi simili e li lascia agonizzare infilzati su qualche filo spinato .
itwac	Una volta , gli uccelli e le lepri , all' avvicinarsi di questo spaventoso cacciatore , sparivano come tante ombre : ora gli stessi [SEP] passerotti [SEP] , perfino i passerotti di nido , passandogli accanto , gli sbattevano per divertimento le loro ali sul naso , e le lepri e i leprottini gli ballavano fra i piedi la polca e la tarantella .
itwac	Che genere di zoofilia si nasconda dietro chi chiude in gabbie piccolissime e sporche cardellini , merli , storni , fringuelli e [SEP] passerotti [SEP] , ce lo devono ancora spiegare .
itwac	- Indicando il selciato , videro dei piccioni , dei [SEP] passerotti [SEP] infeddoliti , nascosti nei cespugli anche dei merli , troppo evidenti per via del loro becco arancione in mezzo alle fronde grigiastre e ghiacciate .
itwac	 Il difensore del [SEP] Passerotti [SEP] , avv. Boggio , ha presentato ricorso per cassazione , deducendo : a ) erronea applicazione del D.L.vo 22/1997 , non avendo le sostanze trasportate natura di rifiuto , ed erronea applicazione dell' art. 321 c.p.p. , mancando i presupposti oggettivi e soggettivi per lì sequestro preventivo ; b ) mancanza e illogicità di motivazione sulle esigenze cautelari .
itwac	GERSA : Non dicevo il tuo [SEP] passerotto [SEP] , dicevo il mio pappagallino !
itwac	fu un autentico trionfo e fece sensazione , anche perché secondo le testimonianze del tempo , l' allestimento fu sfarzoso e inusuale : si pensi che nell a scena sesta , nella lunga sinfonia introduttiva all' aria di Almirena , Augelletti , che cantate , venne liberato in sala uno stormo di [SEP] passerotti [SEP] , che svolazzando causarono non poco scompiglio , con Almirena che invitava i pennuti cinguettanti ( in realtà erano i flauti dietro le quinte che li imitavano ) e le brezze che mormoravano , a darle notizia del suo Rinaldo : Augelletti che cantate , Zeffiretti che spirate Aure dolci intorno a me , il mio ben dite dov' è ...
itwac	Uno , o è cane o è lupo " ed il cane con tanta pazienza gli spiega " mia mamma era una lupa , mio papà un cane , hanno fatto sesso e sono nato io , il cane lupo " il [SEP] passerotto [SEP] si reca perplesso presso un ruscello per bere e qui vede un pesce " e tu chi sei ?
itwac	All' età di sei anni era già una supereroina e si aggirava con una gloriosa mantella ed un cucchiaio di legno per i terrazzi di Montesacro ( sebbene ignorata praticamente da tutti tranne qualche [SEP] passerotto [SEP] di passaggio ) .
itwac	Non hanno mai odiato e mai razziato , mai minacciato , mai terrorizzato , mai torturato neppure un [SEP] passerotto [SEP] .
itwac	( 2004 - 05 - 17 13:27:07.0 ) Commenti [ 0 ] Scrivi venerdì , 14 maggio 2004 bambini in ospedale Il titolo è " Guai a chi mi chiama [SEP] passerotto [SEP] " .
itwac	Talché il poveraccio si faceva giallo e verde e di cento colori , e non sapeva che fare , perché Barbara lo teneva invischiato come un [SEP] passerotto [SEP] , con quegli occhioni neri , e gli diceva poi : - Vuol dire che a me non mi volete bene come ai vostri !
itwac	Aveva meno di dieci anni , capelli corti , minuto come un [SEP] passerotto [SEP] , portava fieramente una pistola nascosta sotto l' ascella e fermata all' altezza della cinta , gli arrivava quasi al ginocchio .
itwac	Ancora s' ode il diuturno canto d' un grigio [SEP] passerotto [SEP] che si volge alle stelle immobili nel cielo .
itwac	;) Diamond Phoenix [SEP] Passerotti [SEP] , credo che stiate leggermente divagando .
itwac	La mostra prende l' avvio dai primi ritratti psicologici in cui l' individuo si affaccia al mondo : sfilano così davanti ai nostri occhi il doppio ritratto di Giorgione , i ritratti romantici di Tiziano , i melanconici personaggi del Lotto , insieme a dipinti di Bronzino , Parmigianino , Moroni , Tintoretto e [SEP] Passerotti [SEP] .
itwac	Un attore ( Frask Cirrisckj ) e un' attrice ( Florinda Petalin ) , attraverso due percorsi esplorativi : il percorso della Terra e il percorso dell' Aria , raccontano i principi dell' ecologia e le regole del ciclo della vita ( attraverso le quali , appunto , il lombrico arriva a sua volta a cibarsi del [SEP] passerotto [SEP] ) .
itwac	Tra le testimonianze del Quattrocento , dipinti di Giovanni Bellini , Beato Angelico e Taddeo di Bartolo ; nel Cinquecento le opere di Tiziano , Lorenzo Lotto , Annibale e Agostino Carracci , Bartolomeo [SEP] Passerotti [SEP] ; nel Seicento i capolavori di Caravaggio , Artemisia Gentileschi , Jusepe de Ribera , Paolini , Domenico Fetti , Bernardo Strozzi , Giuseppe Vermiglio , Tanzio da Varallo , Salvator Rosa , Mattia Preti e la straordinaria Medusa di Rubens ; nel Settecento i dipinti di Ghezzi , Magnasco , Ricci , Gandolfi , Füssli , Bonomini , Fra ' Galgario .
itwac	" Canta come se si strappasse l' anima dal petto " Jean Cocteau La Francia la ribattezzò " [SEP] passerotto [SEP] " , e ne fece il simbolo più struggente di quell' epoca che va dalla guerra al dopoguerra , fatta di poesia e di tristezza .
itwac	Ilary Blasi Francesco Totti Cosa faranno Alex Del Piero e il suo famoso [SEP] passerotto [SEP] ?
itwac	" e il [SEP] passerotto [SEP] : " nun dimo stronzate ...
itwac	15/1/2004 18:06 Profilo utente Sito personale utente guest Guest x cip e ciop Miei cari [SEP] passerotti [SEP] di penna , io nn difendo mai chi nn conosco bene , diciamo che posso si valutare le sue idee , siamo in demo o no ?
itwac	A un certo punto , da lontano vede che un [SEP] passerotto [SEP] sta venendo contro di lui , sono proprio in rotta di collisione ...
itwac	Tornando ai [SEP] passerotti [SEP] , potrei dire che sono come il Mister Wolf di « Pulp Fiction » : risolvono problemi .
itwac	Entrarono nella grotta e , con sommo stupore il [SEP] Passerotto [SEP] vide , circondato da mucchi di ossa , l' enorme Leone con le fauci insanguinate che stava finendo i resti della sua ultima preda .
itwac	Il [SEP] passerotto [SEP] cade a terra , tramortito e piuttosto malconcio ...
itwac	Un [SEP] passerotto [SEP] è presente anche nella pubblcità con Del Piero , testimonial a nome di tutta la nazionale di calcio ( l' Acqua Uliveto ne è la fornitrice ufficiale ) .
itwac	Sbucava fuori di sotto un altare e si lanciò sul platano : Là c' era una nidiata di piccoli [SEP] passerotti [SEP] , in cima al ramo più alto , rannicchiati sotto le foglie .
itwac	[SEP] Passerotti [SEP] , Bartolomeo ( Bologna 1529 - Bologna 1592 ) Doppio ritratto di musici olio su tela , cm 73 x 59 .
itwac	Pigiama della Intimo 3 bianco con collo alto , rifiniture in nero , con stampato su mucche ( che fa tanto Otto il [SEP] Passerotto [SEP] ) , tazze di caffè fumante , luna , stelle , macchine da scrivere ( !!!!!?????? ) ...
itwac	Non l' avevo sentito avvicinarsi e pareva che nemmeno i [SEP] passerotti [SEP] che becchettavano poco lontano dalla panchina tenessero in gran conto la sua presenza .
itwac	Uscita di tutte tranne TER 1 ) SCENA N. 10 TER 1 - Un vero bazar , una gran confusione una recita disorganizzata di crocefissi , statue di santi , ritratti familiari , non ricordo bene se ci sono anch' io , no , ci sono , sono piena di rimorsi , scrupoli , non dico niente allora con le sorelline o da sola facevo del cimitero , ad esempio , un cimiterino per i [SEP] passerotti [SEP] morti , i morticini , il cimiterino lo facevo vedere al babbo , babbino , alle sorelle , sorelline .
itwac	Il [SEP] passerotto [SEP] prende il fucile e spara al falco .
itwac	A un certo punto , da lontano vede che il [SEP] passerotto [SEP] di Del Piero gli sta venendo contro , ed accorgendosi che sono proprio in rotta di collisione , comincia a rallentare sperando di evitarlo .
itwac	Il mio amico [SEP] passerotto [SEP] , devo andare a vedere se è vissuto , se è riuscito a muoversi .
itwac	Sì perisci , fugace [SEP] passerotto [SEP] , e allo sgraziato canto giammai d' allor lamenta al tenebroso .
itwac	L' animale che con amorevole cura ha raccolto , non essendo ferito , ma essendo piumato , era un [SEP] passerotto [SEP] nella fase di svezzamento .
itwac	Due [SEP] passerotti [SEP] innamorati si posarono sul davanzale della finestra e si rincorsero a lungo , cinguettando gioiosi .
itwac	un [SEP] passerotto [SEP] posato sul ramo di un albero fischietta tranquillo finchè non passa di lì un lupo , e il passerotto gli chiede : " ciao , tu che animale sei ?
itwac	lui lo vedo cosi' mingherlino , lei invece e' molto bella sembra un [SEP] passerotto [SEP] !!!
itwac	questo diminutivo mi fa pensare ai [SEP] passerotti [SEP] Inviato da : Mia il Jun 27 2005 , 11:33 PM Benvenuto !!!
itwac	qui c' è un clima primaverile stupendo , sentire le canzoncine di natale coi [SEP] passerotti [SEP] che cinguettano non è da tutti ...
itwac	Quando facciamo queste operazioni , quando tocchiamo le nostre cose " a noi care " , che per noi sono tutto , così è per l' universo giapponese , le cose care sono invece " tutte " quelle disponibili , non solo a un uomo singolo ma a tutti gli uomini ; un fiore , un albero , una montagna , un [SEP] passerotto [SEP] , una tazza di thè , il paiolo , il focolare , e oggi la moto o l' auto .
itwac	CONTE : Mi scusi , Barone , ma perché come un [SEP] passerotto [SEP] innamorato ?
itwac	Verso le 14 mi sento con Gianni , è tempo di pranzo e ci rifugiamo sul McDonald sotto il mio albergo , dove quasi veniamo divorati da numerosi piccioni e [SEP] passerotti [SEP] letteralmente affamati .
itwac	Organizzai una festa a sorpresa per i miei compagni , andai al parco per giocare con i miei amici , ma niente avvenne come speravo : alla festa non venne nessuno e , al parco , sentivo solo il cinguettare dei [SEP] passerotti [SEP] ( udivo anche questi a malapena ) e il fruscio del vento che sfiorava le foglie .
itwac	;) Diamond Phoenix [SEP] Passerotti [SEP] , credo che stiate leggermente divagando .
itwac	Pigiama della Intimo 3 bianco con collo alto , rifiniture in nero , con stampato su mucche ( che fa tanto Otto il [SEP] Passerotto [SEP] ) , tazze di caffè fumante , luna , stelle , macchine da scrivere ( !!!!!?????? ) ...
itwac	IL [SEP] PASSEROTTO [SEP] FINTO ...
itwac	Preso dal dispiacere torna indietro a controllare , e si accorge tutto preoccupato che il [SEP] passerotto [SEP] non è morto .
itwac	Un giorno , forse Più ti guardo più il buio si perde nella luce della tua immagine ch ' ammalia come un ritratto di Van Gogh pennellate brevi e sottili intorno agli occhi tuoi sagaci sono aneliti antichi s' un viso dai colori opachi dove l' amore è oasi di cielo dolcemente declina lo sguardo sulla bocca e mentre i sospiri s' intrecciano in onde d' aria poso labbra di farfalla sul mento tuo che attende aspetto il giorno alla sera per addormentare il cuore mio nel tuo come petalo sull' acqua e strizzo l' occhio alla luna che ciondola curiosa sul cielo C' incontreremo forse in altra vita tra rose e margherite indorate e sull' uscio di sogni socchiusi - anime scalze - muoveremo incontro Nessuno saprà mai le parole Mi sorprende il frullo d' ali d' un [SEP] passerotto [SEP] che audace si posa a due passi da me sui riccioli di ferro battuto è lui pure un curioso decoro , lo scruto e respiro piano per non farlo volar via .
itwac	Sta che il modo di cucinare questi bocconcini Þ lo stesso che si segue per i [SEP] passerotti [SEP] e le quaglie e tutti gli uccelletti commestibili .
itwac	Solo verso le 17 , quando ci recammo in studio , notammo con piacere ma anche con stupore che il cielo era di nuovo azzurro , anzi particolarmente bello , luminoso e ventoso ; anche le rondini e i [SEP] passerotti [SEP] svolazzavano di nuovo cinguettando .
itwac	Nello specifico delle opere , si sottolineano aggiunte di grande rilievo , con opere di : Leandro Bassano , Pier Leone Ghezzi , Augusto Mussini , Osvaldo Licini , che completano il panorama della già ricca esposizione di Tiziano ( presente col " Ritratto del Comandante Gabriele Tadino " e col " Ritratto di giovane gentiluomo " ) , Jacopino del Conte , Bartolomeo [SEP] Passerotti [SEP] , Annibale Carracci , Jusepe de Ribera , Mattia Preti , Jacob Ferdinad Voet , Mola , Fra Galgario , Francesco Solimena Solimena , il Pitocchetto , tutte allusioni alla condizione umana sino alle emblematiche vanitas , sino al '900 .
itwac	Un numero importante , che spero sia stato conservato , perché Roberto Messa aveva allestito un ricco inserto monografico di sedici pagine dedicato alla figura del compianto maestro internazionale e anche perché tutti i collaboratori ( Antonio Rosino , Pierluigi [SEP] Passerotti [SEP] e Sergio Mariotti ) , entusiasticamente , avevano portato un loro significativo contributo su questo protagonista dello scacchismo italiano della seconda metà del  900 .
itwac	Non l' avevo sentito avvicinarsi e pareva che nemmeno i [SEP] passerotti [SEP] che becchettavano poco lontano dalla panchina tenessero in gran conto la sua presenza .
itwac	;) Diamond Phoenix [SEP] Passerotti [SEP] , credo che stiate leggermente divagando .
itwac	Alessio Altichieri Corriere della Sera Così i passeri conquistarono il mondo Originari dell' Oceania , cominciarono le loro migrazioni 45 milioni di anni fa Gli antenati di [SEP] passerotti [SEP] e corvi sono nati nello stesso nido , in Oceania .
itwac	Le scaglio addosso un paio di occhiate , di quelle perforanti , mentre una parte di quel poco di materia grigia che mi è rimasta , incomincia a svolazzare come un impudico [SEP] passerotto [SEP] , quando ecco che i residui grammi di buon senso cerebrale , dopo una rapida analisi del contesto , impongono un immediato rientro nella gabbia al minuscolo volatile , ed alle insane fantasie .
itwac	non fosse altro che quel [SEP] passerotto [SEP] lo vedrei bene insieme alla polenta ...
itwac	anche se secondo me non e' l' alimentazione idonea per loro ma oggigiorno pure i [SEP] passerotti [SEP] non guardano cio' che mangiano Di solito io vengo circondata parecchio dagli animali ( di qualsiasi genere ) perche' sono molto empatica .
itwac	MARGHERITA E non chiamarmi " [SEP] passerotto [SEP] " , mi irrita !
itwac	fryskas : 30/6/2005 13:27 Io ho preso un [SEP] passerotto [SEP] sul parabrezza a poco più di 40 km / h e non è stato bello pulire tutto quel sangue ...
itwac	Quanti sono oggi i [SEP] passerotti [SEP] « con gli occhi a mandorla » che popolano la Palude Brabbia ?
itwac	I [SEP] Passerotti [SEP] ...
itwac	« È vero che sono una persona di carattere - prosegue nel suo autoritratto l' autrice che un tempo fece molto scalpore col suo romanzo erotico « Le età di Lulù , 1989 » - , mi piacciono le persone così , non mi interessano i [SEP] passerotti [SEP] , né maschi né femmine , sono decisa , ostinata , con forza di volontà , però ho un lato vulnerabile ...
itwac	Ovviamente il [SEP] passerotto [SEP] si terrorizza , prende il volo e infila immediatamente la finestra riconquistando la cima dell' albero di fronte .
itwac	Sono un gatto io , mica un topino da nulla e il mio amico è un pappagallo con due ali così , mica un [SEP] passerotto [SEP] .
itwac	Talché il poveraccio si faceva giallo e verde e di cento colori , e non sapeva che fare , perché Barbara lo teneva invischiato come un [SEP] passerotto [SEP] , con quegli occhioni neri , e gli diceva poi : Vuol dire che a me non mi volete bene come ai vostri !
itwac	Freud sputtanato , Kant deportato a Solovki , il critico letterario decapitato dal tram , il [SEP] passerotto [SEP] che danza da spogliarellista a suon di jazz e il gatto che si lamenta del tu invece del lei , e i baffi di Korov ' ev a penne di gallina e il sole frantumato e l' asfalto che restituisce afa alla notte e l' insopportabile mancanza di spazio e i biglietti di favore in prima fila , con mezza città allo spettacolo .
itwac	Pubblicazioni recenti Bartolomeo [SEP] Passerotti [SEP] pittore ( 1529 - 1592 ) , Luisè Editore , Rimini 1990 Lavinia Fontana allo specchio .
itwac	Giunta la sera , il motociclista va a dormire , sperando che il [SEP] passerotto [SEP] si riprenda .
itwac	Intanto , tutt ' intorno a me : [SEP] passerotti [SEP] rosso fuoco , ragni delle palme , gechi color verde smeraldo , fiori della passione .
itwac	[SEP] Passerotti [SEP] in volo a giugno Data : Mercoledì , 05 Maggio - 00:16 Argomento : Vacanze La famiglia si è allargata ...
itwac	;) Diamond Phoenix [SEP] Passerotti [SEP] , credo che stiate leggermente divagando .
itwac	Dai 2 anni Domenica 8,15,22,29 maggio 2005 Parchi cittadini Il Gruppo Libero Teatro Come il lombrico mangia il [SEP] passerotto [SEP] Strane presenze nel parco - spettacolo per i parchi su biodiversità e sviluppo sostenibile per un pubblico di tutte le età Attraverso la rappresentazione Come il lombrico mangia il passerotto , gli spettatori vengono invitati ad " esplorare " i parchi con modalità inconsuete .
itwac	Il gallo era molto disponibile : accolse il [SEP] passerotto [SEP] e gli permise anche di cinguettare le sue canzoncine alle sue gallinelle .
itwac	La delegazione è guidata dall' assessore Gianluca Salvatori che ha partecipato agli incontri con le autorità locali , il mondo scientifico ed accademico , ed ha inaugurato il Centro culturale di Oradea , nato su iniziativa dell' imprenditore trentino Maurizio [SEP] Passerotti [SEP] , che da anni opera nella provincia romena del Bihor .
itwac	Non era un [SEP] passerotto [SEP] ; forse era una di quelle specie che devono stare in gabbia - come i canarini - , perche' la liberta' non gli garantisce il cibo e la temperatura adatti , e il loro volo e' troppo debole per fargli evitare le bocche spalancate dei gatti .
itwac	Il manto lucido ora riveste ogni angolo del mio giardino e i [SEP] passerotti [SEP] infreddoliti lasciano la carezza di un filo d' erba volgendo le spalle alle case .
itwac	----- Simone Bonanomi Lega Abolizione Caccia - Bergamo http://www.anticaccia.it Prev by Date : Fw : Trasmissione radiofonica sulla scelta vegetariana Next by Date : Re : [SEP] passerotto [SEP] Previous by thread : Fw : Trasmissione radiofonica sulla scelta vegetariana
itwac	A parte il frequentissimo uso dei semplici nomi di battesimo ( più o meno abbreviati o storpiati ) , quando si preferisca chiamarsi con un nomignolo affettuoso credo siano molto più usati termini quali , che so : ' [SEP] passerotto [SEP] ' , ' ciccio ' , ' miciotta ' e così via !
itwac	Federico - ( seccato ) Che cosa !? Virgilio - Quella volta che trovammo il [SEP] passerotto [SEP] caduto dal nido .
itwac	Nel 1932 , a quindici anni , è scoperta dall' impresario L. Leplée che rimane colpito dalla sua straordinaria potenza vocale e la scrittura per il suo cabaret Gerny ' s. Qui la P. , presentata come môme ( [SEP] passerotto [SEP] ) in ragione della sua corporatura esile , si esibisce in qualità di cantante con crescente successo .
itwac	un [SEP] passerotto [SEP] cadde dal nido nella neve , stava per morire di freddo quando una mucca lo vide e gli fece una cagata addosso , l' uccellino al caldo della merda si riprese e stava bene quando passò una volpe che lo tolse dalla merda , lo lavò e lo mangiò !!!
itwac	Guai a chi mi chiema ' bel [SEP] passerotto [SEP] ' .
itwac	* ° * ^  ^ * ° * MARIO : " sei un [SEP] passerotto [SEP] da combattimento , la migliore definizione sintetica d lisa " L' INTER KE VINCE LO SCUDETTO !!!!!!!!! ...
itwac	 mi diceva , mostrandomi i [SEP] passerotti [SEP] che dalle grondaje spiccavano il volo e si tenevano sospesi su le ali gridando quasi per esortar più da vicino l' albero a rizzarsi .
itwac	Nicola Calipari aveva lo stesso corpo minuto di Giuliana , un corpo fragile , da [SEP] passerotto [SEP] .
itwac	Ma questi due me li sono portati dietro quando ancora tiravano su col naso , piccoli come dei [SEP] passerotti [SEP] e guardate adesso cosa sono diventati : due marcantoni , mangiano e lavorano come leoni .
itwac	( 2004 - 05 - 17 13:27:07.0 ) Commenti [ 0 ] Scrivi venerdì , 14 maggio 2004 bambini in ospedale Il titolo è " Guai a chi mi chiama [SEP] passerotto [SEP] " .
itwac	Al canto soave del [SEP] passerotto [SEP] e della tortora si era sostituito quello cupo della civetta e del barbagianni ; allo svolazzare colorato e smagliante delle farfalle diurne era subentrato quello vorticoso delle falene .
itwac	Si incendian le piume a un incauto [SEP] passerotto [SEP] , si brucia l' orecchio a un ozioso coniglietto .
itwac	Indovina nel [SEP] passerotto [SEP] cosa c' è ?
itwac	Il [SEP] passerotto [SEP] prende il fucile e spara al falco .
itwac	Ore 16.30 circa spettacolo teatrale " Come il lombrico mangia il [SEP] passerotto [SEP] " a cura del Gruppo Libero Teatro .
