corpus	sentence
itwac	SPOSTAMENTI - Spostarsi in casa , alzarsi dal letto , da una [SEP] sedia [SEP] , etc. Entra ed esce dal letto e si alza o siede su una sedia senza assistenza ( può usare oggetti di sostegno come un bastone o una stampella ) Entra ed esce dal letto o si siede o si alza da una sedia con assistenza Non può uscire dal letto 5 .
itwac	Entra Stefan , urta una [SEP] sedia [SEP] , fa cadere una ciotola .
itwac	Rimase al suo fianco , e guardò quegli scarponi più rotti dei suoi , e il tappeto bagnato di sputo e il biliardo e le luci e la gente e le [SEP] sedie [SEP] e i quadri e un divano grande sul quale erano seduti due giovani .
itwac	Insomma l' Assessore ha sbattuto un po' la [SEP] sedia [SEP] , i tassisti hanno menato i pugni sul tavolo e il signor Gargano si e' acquietato .
itwac	PASQUA e LUCIETTA escono dalla loro casa , portando le loro [SEP] sedie [SEP] di paglia , i loro scagni e i loro cuscini , e si mettono a lavorare merletti .
itwac	Poi si alza per spegnere la televisione e veniamo a conoscenza del fatto che , in questa anonima stanza caratterizzata dall' opprimente scenografia in acciaio , tiene imbavagliata e legata ad una [SEP] sedia [SEP] una donna : la psichiatra Laura Galan , sua ex moglie .
itwac	Sono arrivati con la guida ed hanno apparecchiato per il loro pic-nic con [SEP] sedie [SEP] i tavolini la TV i telefonini e le facce di chi va lontano da chi , lontano da che , lontano per sentito dire senza un perché se vuoi restare resta pure ho da fare non mi viene in mente cos' è ma lo so che , io lo so com' è che state bene lì , seduti in riva al fosso state bene lì seduti in riva al fosso ...
itwac	Trascinandolo con tutta la [SEP] sedia [SEP] , portò l' uomo vicino al fornello a gas .
itwac	Rimango a guardare non so quanto , poi , vinto da una stanchezza più potente di qualsiasi clima , crollo sulla stessa [SEP] sedia [SEP] su cui ero seduto .
itwac	SU LIBRAGGI PIU' BASSI 30/50 E CON PREDE DICIAMO PICCOLE DIREI CHE ABBANDONARE LA [SEP] SEDIA [SEP] PER COMBATTERE IN PIEDI E' UN IMPERATIVO , L' EMOZIONE E' COMUNQUE ASSICURATA !
itwac	David lo osservava seduto sulla sua [SEP] sedia [SEP] di legno .
itwac	« Mi manca - dice Debora , uno scricciolo di nove anni costretto su una [SEP] sedia [SEP] a rotelle - perché Ax era grande e riusciva a mettere la testa sulle mie ginocchia per farsi accarezzare » .
itwac	In teoria si dividono sullo Stato Sociale , ma in pratica sono incollati sulle [SEP] sedie [SEP] " .
itwac	Gli ascensori accessibili alle persone su [SEP] sedie [SEP] a ruote devono avere le caratteristiche rispondenti alle norme dell' art. 15 .
itwac	Il mobile in legno è un elemento comune a tutte le grandi civiltà del passato : le sepolture dell' antico Egitto ci hanno restituito cofani , armadietti , [SEP] sedie [SEP] , sgabelli , letti , culle , utensili e sarcofagi finemente decorati .
itwac	Il mistero s' infittisce il giorno dopo quando il presidente del Consiglio si aggira da solo tra scrivania ( di ciliegio ) e [SEP] sedia [SEP] a « Porta a porta » e non si accorge dei due direttori ( uno dei quali tarda persino ad entrare in studio perché nessuno fa caso al din-don che annuncia l' ingresso degli ospiti ) .
itwac	Ogni aula è arredata con tavoli e [SEP] sedie [SEP] di colore diversi , nei toni chiari pastello L' aula è organizzata in angoli , ognuno distinto e attrezzato per un insieme di attività .
itwac	Gerri gerri - 20/9/2004 alle 08:18 Ciao Mino , mi era sfuggito il tuo post , quote : Come composizione mi piaceva piu la prima : piu belle le [SEP] sedie [SEP] , il tavolo ed il lampadario in ferro ( anche se era troppo piccolo ed alto per illuminare bene il tavolo ) .
itwac	) Burattini vari Telo di stoffa o una coperta e due o tre [SEP] sedie [SEP] , oppure una porta a disposizione Una storia ( inventata , una favola , presa da un libro , ...
itwac	Le case coloniali colorate , le immancabili [SEP] sedie [SEP] a dondolo di legno e vimini in ogni cortile , salone e sui marciapiedi .
itwac	K - 9 carts , questo il nome della [SEP] sedia [SEP] a rotelle creata dal dottor Parkers , è ideale per cani ( di grande e piccola taglia ) , gatti , pecore , capre , furetti e , perché no , anche conigli .
itwac	Rappresenta un uomo su una [SEP] sedia [SEP] , con fattezze cinesi e alcuni elementi stranieri : la bombetta , il mantello , barba e baffi all' occidentale .
itwac	Vieri ha letto i giornali ed è caduto dalla [SEP] sedia [SEP] .
itwac	Non più come un disgraziato cui le immancabili malelingue avevano pronosticato un futuro sulla [SEP] sedia [SEP] a rotelle , o nella migliore delle ipotesi da precoce , per quanto brillante , commentatore televisivo .
itwac	Sulle bancarelle si possono trovare anche alcuni tipici prodotti locali : le famose ' sedie di Chiavari ' , dette ' [SEP] sedie [SEP] campanino ' , e i ricercatissimi pizzi macramè , stoffe di lino lavorato con disegni e frange .
itwac	Global Crossing , Kmart , Tyco , sono altri nomi che possono far ballare sulla [SEP] sedia [SEP] gli uomini più potenti dell' America e soprattutto far disperare i risparmiatori che avevano avuto fiducia nel sistema di controllo degli scambi azionari americani .
itwac	" Del Noce : " Con Paolo trattative avviate " La smentita del Biscione : " Sono solo falsità " 05 - 03 - 2005 Bonolis , è super Festival ancora un picco di ascolti 05 - 03 - 2005 Ecco i quindici finalisti Fuori Meneguzzi e Dj Francesco Deve andarsene ( fra gli applausi ) anche Nicola Arigliano Fra le donne finisce l' avventura all' Ariston di Marina Rei 04 - 03 - 2005 Bonolis , buio in sala " Bentornata Giuliana " Arigliano , jam session fuori programma ma alla fine viene eliminato dal nostro inviato ALESSANDRA VITALI 04 - 03 - 2005 Quando la [SEP] sedia [SEP] vuota era per Vasco 04 - 03 - 2005 Vasco entusiasta del Festival " E' il vero sogno italiano " dal nostro inviato ALESSANDRA VITALI 04 - 03 - 2005 Così Bonolis ti conquista in sette mosse strategiche di ANTONIO DIPOLLINA 04 - 03 - 2005 Ascolti , stracciata la Ventura " Ma a me la papaya mi fa schifo " Califano-Baudo , nessuna mossa legale : polemica chiusa E stasera sul palco dell' Ariston Hugh Grant e Gwen Stefani dal nostro inviato ALESSANDRA VITALI 04 - 03 - 2005 Sanremo , le classifiche della terza serata 04 - 03 - 2005 Paolo e Will cantano il rap Eliminati i Velvet e Califano Si sono esibiti i Giovani , i Gruppi e i Classic Gli opinionisti polemizzano sui verdetti delle giurie dal nostro inviato ALESSANDRA VITALI 03 - 03 - 2005 Corto circuito Bonolis-Fallaci In onda la tv degli estremi dal nostro inviato ALESSANDRA VITALI 03 - 03 - 2005 Fiori sul palco , il sindaco si arrabbia E Bonolis , ogni sera , chiama mammà dal nostro inviato ALESSANDRA VITALI 03 - 03 - 2005 Il rapper e il capitano Così belli , così lontani La star Usa : " Sono felice di essere americano " L' eroe di " Elisa " presto in un musical su Colombo dal nostro inviato 03 - 03 - 2005 Un pomeriggio con Tyson manager , pupe e limousine " Ho due amici che mi sono sempre rimasti vicini .
itwac	Formati da una camera matrimoniale con due armadi , una camera con tre letti separati e rispettivi armadi , soggiorno con divano letto ( due posti ) più tavolo con 6 [SEP] sedie [SEP] e ombrellone , cucina attrezzata con frigo e cappa aspirante , caldaia istantanea per produzione acqua calda .
itwac	- Piglia una [SEP] sedia [SEP] e apri quella finestra !
itwac	La saletta sarà dotata di un armadio chiuso per documenti , di un tavolo e di [SEP] sedie [SEP] idonee alle riunioni delle RSU e verrà messo a disposizione , su richiesta , un telefono per comunicazioni con l' esterno strettamente inerenti l' attività sindacale .
itwac	Mio figlio si sposa di Dino Scodellaro Scena : soggiorno di una casa con un tavolo con 4 [SEP] sedie [SEP] Personaggi e interpreti : Rosa - Gianluca , Don Ferdinando - Dino , Pasquale - Massimiliano , Zia Filomena - Fabiana , Zia Carmela - Chiara , Laura - Jenny , Salumiere - Sandro .
itwac	Ho preparato un piccolo percorso in cui c' è da saltare la corda , fare slalom con la pallina da tennis tra le [SEP] sedie [SEP] , correre nel sacco e saltare un paio di ostacoli .
itwac	Letizia , che ci ospita , prepara con dovizia una ventina di [SEP] sedie [SEP] oltre a divani e divanetti .
itwac	Fu fatta sedere sur una [SEP] sedia [SEP] a braccioli , e le fu portata una chicchera di cioccolata : il che , a que ' tempi , era quel che già presso i Romani il dare la veste virile .
itwac	A tal fine devono essere rispettati i seguenti minimi dimensionali : - lo spazio necessario all' accostamento e al trasferimento laterale dalla sedia a ruote alla tazza w.c. e al bidet , ove previsto , deve essere minimo 100 cm misurati dall' asse dell' apparecchio sanitario ; - lo spazio necessario all' accostamento laterale della sedia a ruote alla vasca deve essere minimo di 140 cm lungo la vasca con profondità minima di 80 cm ; - lo spazio necessario all' accostamento frontale della [SEP] sedia [SEP] a ruote al lavabo deve essere minimo di 80 cm misurati dal bordo anteriore del lavabo .
itwac	I corpi sprofondano contro la rigidità delle [SEP] sedie [SEP] , gli sconosciuti si stringono gli uni contro gli altri , come scaglie di un unico carapace .
itwac	Comunque ci sono delle similitudini : ad esempio un tavolo di legno con tre [SEP] sedie [SEP] di legno e paglia ; al centro della tavola era presente , in risalto , una ciotola con dentro della pasta fatta a mano .
itwac	Sono seduto su questa [SEP] sedia [SEP] in attesa di spostarmi , con calma , senza fretta , sulla poltrona .
itwac	Alla fine ( solo dopo che avete parlate con gli altri attori ) parlate anche con la ragazza sul palco che vi indirizzerà nei camerini per parlare con Doris , aprite la porta a sinistra e troverete Doris completamente ubriaca che dorme sulla [SEP] sedia [SEP] , parlate ( per quanto potete fare ) con lei e una volta finito aprite la porta vicino al tavolo del trucco .
itwac	Guardo in basso , le mie scarpe sono scolorite , metto un piede fuori ma non ho il coraggio di fare la stessa cosa con l' altro , la [SEP] sedia [SEP] sta per scivolare e il cuore mi va in gola e comincia a battere velocemente mentre il sudore più freddo della mia vita scende fino agli occhi e me li fa bruciare .
itwac	[SEP] sedie [SEP] internet ...
itwac	Assistenza alle persone che utilizzano sedie a rotelle ed a quelle con mobilità ridotta Nel predisporre il piano di emergenza , il datore di lavoro deve prevedere una adeguata assistenza alle persone disabili che utilizzano [SEP] sedie [SEP] a rotelle ed a quelle con mobilità .
itwac	Una nuova dimensione che la fa allontanare dal marito , costretto a vivere su una [SEP] sedia [SEP] a rotelle , ma che la porta ad avvicinarsi alla figlia , partorita in giovane età ed abbandonata su suggerimento del padre .
itwac	Ricordo mio nonno , sulla sua [SEP] sedia [SEP] , gemeva dal dolore della sua malattia .
itwac	L' altro elemento fondamentale e qui probabilmente qualcuno salterà sulla [SEP] sedia [SEP] , soprattutto in ambienti sindacali , è la legittimazione dei ruoli di coordinamento .
itwac	Avendo velocemente letto gli interventi ed i commenti nel sito , posto che per quante volte le dinamiche inspiegabili della Sorte mi abbiano fatto rischiare di aver bisogno anche io di una [SEP] sedia [SEP] con le ruote per muovermi , non ho problemi di disabilità ma non per questo dimentico l' inquietante realtà della quale tutti facciamo parte ...
itwac	2.2 REQUISITI PER IL SUPERAMENTO DELLE BARRIERE ARCHITETTONICHE : 2.2.1 Per i pubblici esercizi , secondo tipologia , in presenza di interventi edilizi globali , o per ampliamenti , o per le richieste di autorizzazioni per nuove attivita' , gli immobili debbono essere conformi alle seguenti caratteristiche in materia di barriere architettoniche : 2.2.1.1 RISTORAZIONE TIPO " A " Nelle sale per la ristorazione , almeno una zona della sala deve essere raggiungibile mediante un percorso continuo e raccordato con rampe , dalle persone con ridotta o impedita capacità motoria e deve inoltre essere dotata di almeno uno spazio libero per persone su [SEP] sedia [SEP] a ruote .
itwac	L' hotel dispone di un parcheggio privato e di un garage , oltre che di un bel giardino con [SEP] sedie [SEP] di canapa e parasole .
itwac	Una mezz ' oretta dopo lo raggiunge , è pallida , provata , si lascia cadere su una [SEP] sedia [SEP] .
itwac	Torna all' indice Scheda n ° 1 TAVOLI E [SEP] SEDIE [SEP] Art. 1 Finalità 1.1 L' occupazione con tavoli e con sedie è finalizzata ai servizi di somministrazione all' aperto .
itwac	Getrade produce strumenti musicali ( tamburi , djembè , maracas , xilofoni ) , altri prodotti intagliati in legno come statue , tavoli , [SEP] sedie [SEP] , e i cesti di Bolga .
itwac	Deve essere del tipo a mensoia in maniera da consentire adeguato avvicinamento con [SEP] sedia [SEP] a rotelle .
itwac	Abbiamo assaggiato prodotti locali in un negozietto nel quale si sono fatti in tre per procurarci un tavolo e due [SEP] sedie [SEP] , gentilissimi , davvero .
itwac	Non esagero affatto , del resto basta anche solo guardarmi per rendersene conto : sono una mummia pensante seduta su una [SEP] sedia [SEP] elettronica , con gli occhi fissi e storti .
itwac	Ma là vide , seduti sulle [SEP] sedie [SEP] davanti al camino , i due vecchi che si erano presi cura di lui la prima volta , quando era arrivato a casa loro dal bosco .
itwac	« Stiamo rispettando la delibera rendendo non operativo il servizio all' esterno all' orario prestabilito - spiega Negro - I tavoli , però , restano fuori , con le [SEP] sedie [SEP] capovolte , perchè all' interno sottrarrebbero tutto lo spazio per i clienti e questo significherebbe praticamente chiudere all' una e trenta .
itwac	Un album che contiene anche quattro inediti : Sguarauunda , L' esercito delle dodici [SEP] sedie [SEP] , Sciur capitan e la traduzione in dialetto di Frank 's Wild Years di Tom Waits , ribattezzata I ann Selvadegh del Francu .
itwac	âTM âTM âTM âTM âTM " Il 90 % dei problemi di un PC sta tra la tastiera e la [SEP] sedia [SEP] " cremina ( Privato ) Vedi le inserzioni del venditore 15 - lug - 05 21:56 CEST 4 di 4 marò era un filetto da 230 kb !!!
itwac	Diventando più bravi possono essere rese più pesanti appoggiando i piedi su una [SEP] sedia [SEP] .
itwac	Al caffè Drechsler - un posto dove il tempo si è fermato , con i tavolini di marmo , le [SEP] sedie [SEP] Thonet , il Beuschel di frattaglie con gli gnocchi di pane - giurano che non resisterà ai suoi stessi provvedimenti impopolari .
itwac	Ogni cavaliere accompagna la sua dama alla [SEP] sedia [SEP] , dove l' aiuta a sedersi .
itwac	Senza quei foglietti oggetto di gratuite ironie , scherniti per la povertà delle origini e le limitazioni culturali , certamente non avrebbe avuto tanta raccapricciante eco nel mondo la tragica sorte di Sacco e Vanzetti , considerati comunisti nel loro tempo , portati alla [SEP] sedia [SEP] elettrica innocenti per appagare sordidi interessi , il cui ricordo ancora oggi fa inorridire la coscienza dell' America libertaria e democratica .
itwac	Il parco è in gran parte percorribile anche da persone in [SEP] sedia [SEP] a rotelle ° Gubbio â   Santo Stefanoâ   Loc .
itwac	Certe volte Florence veniva sottoposta dagli studiosi e dagli scettici a severi controlli e addirittura veniva legata alla [SEP] sedia [SEP] .
itwac	Vuol dire che chi vi suona , sia esso un clarinetto , una tromba o corno , quando il ritmo della musica si fa incalzante , prova la spiacevole sensazione che la [SEP] sedia [SEP] dove si accomoda possa cadere , essendo lo spazio a disposizione ampio appena 93 centimetri .
itwac	Credo ce ne sia abbastanza per farci saltare tutti dalle [SEP] sedie [SEP] , e spingerci a far quadrato per impedire che cio' avvenga .
itwac	Oltre a questo , quiando egli utilizzò la Visione Assoluta , potè intravedere per un istante un demone spuntare dietro la [SEP] sedia [SEP] dove vi era Marcus , sfoderare gli affilatissimi artigli e infilarglieli dentro la testa .
itwac	E il grande gioco si trasferisce nella sala accanto a quella delle [SEP] sedie [SEP] disordinate .
itwac	Come ci sono quelle che chiamiamo le classi Chernobyl ( quelle che devi tenerle a bada con [SEP] sedia [SEP] e frusta ) , così ci sono i docenti Chernobyl .
itwac	Cui rivolgersi con il pensiero , e talvolta con le parole , com' è d' uso anche nel nostro Mezzogiorno , dove ci si porta la [SEP] sedia [SEP] da casa per parlare al defunto .
itwac	Ora , quando Wilburn dormiva sulla [SEP] sedia [SEP] , Winnie poteva vederlo .
itwac	Per più di una generazione di telespettatori Raymond Burr e Perry Mason ( ma anche Robert Ironside , l' investigatore paraplegico bloccato su una [SEP] sedia [SEP] a rotelle , che in un certo senso di Mason è un succedaneo ) sono stati la medesima persona : Mason , avvocato inflessibile ed infallibile ( ma con una carica umana fino ad allora rara a vedersi in un [ tele ] film di genere giudiziario ) , ha avuto sempre - a differenza del quasi coevo James Bond , che di volti ne ha cambiati parecchi - le sembianze di Burr , così come i comprimari della stessa fortunata serie televisiva degli anni '50 - '60 - Barbara Hale - Della Street , William Hopper - Paul Drake e William Talman - Hamilton Burger - debbono la loro notorietà a quel serial televisivo .
itwac	Aveva letto tutti i suoi libri e da quando aveva saputo che era lì in ospedale come lei , non mancava tutte le mattine di pregare la mamma che l' accompagnasse , con la [SEP] sedia [SEP] a rotelle , a salutarla ; un solo cenno con la mano , un cenno che diceva tutto : " ciao " o anche " benvenuta " o ancora " t' aspetto , raccontami dei tuoi folletti che vengano a farmi compagnia nelle mie notti buie e dei tuoi sogni fanciulli che s' incrociano con i miei .
itwac	Cornici , macinini , candelabri , [SEP] sedie [SEP] , comodini e altri oggetti ormai malridotti e inservibili torneranno a svolgere la loro funzione nelle nostre case e anche nella nostra scuola , come testimonianza concreta del valore che attribuiamo al nostro passato e alle nostre radici .
itwac	- assortimento video , suono , informatica , elettrodomestici , ferri , forni a microonde , robot , bistecchiere , aspirapolvere , lavatrici , lavastoviglie , congelatori - per la casa : pentole di marca , linea picnic , articoli usa e getta colori vari , set in vetro per gelato , macedonia e da bibita , pentole e tegami a marchio Coop , Lagostina saltapasta , articoli per la pulizia , coprisedie e tovaglie in plastica - abbigliamento uomo donna bambino : vogatori , t-shirt , jeans , completini per bambini e neonato , calzature estive ( sabot donna / bambina , sandali bambino ) - arredo per giardino : tavoli e sedie in resina coordinati , tavoli con decoro a mosaico , poltrone ( cinque posizioni ) , lettino , dondolo , carrello , gazebo , panchina , arredo in ferro e legno ; per il picnic : tavoli , [SEP] sedie [SEP] regista in legno , borsa termica e frigo .
itwac	Inoltre tavoli , [SEP] sedie [SEP] , finestre e tutto quanto ci capiti sotto mano , può essere usato come arma , rotto , scaraventato lontano e così via verso la quasi totale libertà delle azioni da compiere .
itwac	" Il prete alzò la [SEP] sedia [SEP] e la tirò più vicino al letto .
itwac	Bye TUNABUSTER TRA [SEP] SEDIA [SEP] E STAND UP ?
itwac	Le chiedo , cosa e' la sofferenza di 50 scimmie se questo intervento adesso sta lentamente dando i frutti richiesti , a breve lo studio verra' ufficializzato , e delle persone dalla [SEP] sedia [SEP] a rotelle ricomincieranno a camminare !!!
itwac	( 18 Aprile 2005 ) Non male Il film forse è un pò lento , ma riesce a creare una strana atmosfera che tiene incollati alla [SEP] sedia [SEP] .
itwac	Una casa non significa solo un tavolo , delle [SEP] sedie [SEP] e un armadio .
itwac	Tutti , escluso la Signora Mendolìa , saltano sulle [SEP] sedie [SEP] ) SIGNORA LEONI Commendatore ?
itwac	I due bambini si rovesciano dalla [SEP] sedia [SEP] , schiantandosi contro il vetro frontale .
itwac	Distribuzione e vendita online di articoli per la cura del corpo e per il benessere tipo Sedia ergonomica , [SEP] Sedie [SEP] ergonomiche , sedie ergonomiche per il mal di schiena , allume di potassio , cristallo di potassio , cristallo deodorante , lampade di sale , ...
itwac	Premio alla carriera a Cannes nel ' 82 , Premio Cultura nel ' 87 , insignito nel ' 95 , anno del centenario del Cinematografo , del Premio Oscar alla carriera , nello stesso anno dà un' ennesima prova della sua forza quando , oramai su una [SEP] sedia [SEP] a rotelle dal 1985 , gira " Al di la delle nuvole " con Wim Wenders .
itwac	Non m' importa del proiettile , quella è un' esperienza in più - fece una breve pausa , sospirò - ma adesso la sua famiglia sta crollando - - Chi se lo sarebbe mai aspettato - disse Matt sedendosi su di una [SEP] sedia [SEP] che avevano messo al centro della stanza le infermiere .
itwac	Assistenza alle persone che utilizzano [SEP] sedie [SEP] a rotelle ed a quelle con mobilita' ridotta .
itwac	Nelle sale per la ristorazione , almeno una zona della sala deve essere raggiungibile mediante un percorso continuo e raccordato con rampe , dalle persone con ridotta o impedita capacità motoria e deve inoltre essere dotata di almeno uno spazio libero per persone su [SEP] sedia [SEP] a ruote .
itwac	Tocca una [SEP] sedia [SEP] che barcolla un po' ) Poi quando dici tu sistemiamo queste sedie .
itwac	Era la figlia della Contessa De Benedittis , padrona del Castello De Benedettis ( oggi ridotto a misero rudere chiamato " [SEP] Sedia [SEP] del Diavolo " ) , nonchè del ponte che collegava i due colli qui situati ( oggi l' attuale Ponte delle Valli che unisce i quartieri Africano e Talenti ) .
itwac	Così alla trattoria di mezzogiorno mi siedo alla stessa [SEP] sedia [SEP] , chiedo minestra e vino e leggo .
itwac	Il percorso di cui al comma 3 raccordato da rampe deve essere privo di ostacoli , con eventuali dislivelli non superiori di norma al 5 per cento e di larghezza , nel caso di impiego di [SEP] sedie [SEP] a ruote non inferiore ad 1,50 m. La zona di ponte corrispondente deve essere rivestita con materiale antisdrucciolevole .
itwac	E mi passa proprio la voglia di alzarmi dalla [SEP] sedia [SEP] .
itwac	Eppure l' abuso di droga è maggiore in Florida che in Massachusetts , dove gli spacciatori non finiscono sulla [SEP] sedia [SEP] elettrica .
itwac	Soltanto a giugno la direzione ha chiesto di riaprire il confronto con i lavoratori , ma il risultato è stato pessimo : « ci volevano pagare soltanto il 20 % dei giorni di sciopero , ma poi il direttore ha preso una [SEP] sedia [SEP] è ha minacciato di tirarcela addosso .
itwac	La costante della serie Almerisa è la labilità temporale : in un arco stretto di anni , la bambina d' asilo che vediamo seduta compostamente sulla [SEP] sedia [SEP] diventa donna ma nello sguardo mantiene tutta la volatilità della giovinezza e della sublime ignoranza sul conto del proprio futuro .
itwac	Si alzò dalla [SEP] sedia [SEP] della cucina e corse verso la finestra del soggiorno , scostò appena la tenda per non essere visto .
itwac	" Ma vale poi la pena de soffrì lontano da ' na tavola e ' na [SEP] sedia [SEP] pensanno che se deve da morì ?
itwac	Si ricorre dunque alla fisioterapia , alla mobilizzazione , all' utilizzo di tutori , [SEP] sedie [SEP] a rotelle , a strumenti elettronici che consentano al malato di comunicare , fino all' uso di respiratori artificiali .
itwac	Si riesce a riconoscere Palpatine all' interno , seduta su una grande [SEP] sedia [SEP] ( dall' aspetto molto familiare , simile a quella di " Episodio VI " ) .
itwac	Venus Williams Serena Williams E adesso le grida di fatica dell' atleta siberiana , che hanno infastidito non poco parte del pubblico , le avversarie e i giudici di [SEP] sedia [SEP] a Wimbledon diventeranno un segnale di chiamata per chi desidera avere sul proprio cellulare una suoneria " da urlo " .
itwac	Al centro della stanza , un tavolo da pranzo con [SEP] sedie [SEP] capovolte sul piano .
itwac	03/03/2005 19:49 * A Ferrara l' 8 marzo 03/03/2005 19:38 * Unicoop Tirreno per Baghdad e per Giuliana 03/03/2005 16:58 * Appello congiunto Veltroni-Delanoe 03/03/2005 16:13 * I " digiunanti " : " Andiamo avanti " 03/03/2005 16:11 * Mantica incontra i sauditi 03/03/2005 16:07 * Oggi a Palazzo Chigi 03/03/2005 16:00 * L' appello del Parlamento europeo 03/03/2005 15:55 * Una mostra a Firenze 03/03/2005 15:54 * L' Atomium di Bruxelles illuminato l' 8 marzo 03/03/2005 15:52 * Il convegno del Cidi dedicato a Giuliana 03/03/2005 15:48 * La [SEP] sedia [SEP] vuota di Giuliana 02/03/2005 22:41 * La " Non violenza attiva " dedicata a Giuliana 02/03/2005 22:31 * L' Università di Torino si interroga " contro la guerra " 02/03/2005 19:45 * Agnese Ginocchio canta per Giuliana alla Tenda della Pace di Sanremo 02/03/2005 19:07 * La mozione del Consiglio comunale di Nonantola ( Mo ) 02/03/2005 18:51 * Il Tribunale mondiale sull' Iraq a Genova 02/03/2005 18:34 * Una fiaccolata di solidarietà sulla frontiera italo-francese 02/03/2005 18:28 * L' appello di Alain Goussot sul quotidiano marocchino Al Bayane 02/03/2005 18:18 * I messaggi di Juri su Capodistria 02/03/2005 16:49 * Un miracolo in Iraq : appello del comico bolognese Vito per Giuliana 02/03/2005 16:32 * Digiuno per Giuliana .
itwac	Arrancando con fatica sulla sua [SEP] sedia [SEP] a rotelle , il capo della delegazione della commissione europea in Romania , Jonathan Scheele ricordava che tempo fa , parlando con alcune persone disabili , aveva appreso con stupore che molte di loro non avevano più usato da 14 anni la metropolitana o un autobus .
itwac	Fiore all' occhiello della dotazione è sicuramente la [SEP] sedia [SEP] da combattimento posta a prua .
itwac	E infatti dentro tavoli e [SEP] sedie [SEP] sono in plastica , c' è una sola pista , molte meno luci .
