corpus	sentence
itwac	Due punti di altissimo pathos , uno in particolare che mi ha fatto saltare dalla [SEP] sedia [SEP] in quanto non mi aspettavo una simile manifestazione del lato oscuro : L' imperatore e la fine di mace windu .
itwac	se l' uomo è solo un impasto di male se la storia è la storia degli orrori se la pietà è debolezza se l' amore è illusione NOTICE anyone proceeding beyond this point implies their permission to a search of person property and vehicle ronzavano i fax squillavano i telefoni giù giù fino ai due antiquati apparecchi in bachelite nera solo da quelle cornette poteva venire la salvezza nella camera verde la fine arriva con una pastiglia negli Usa diceva se non appartieni alle classi affluenti vieni semplicemente fatto fuori allargando ai minori e agli handicappati la possibilità di salire sulla [SEP] sedia [SEP] elettrica o di entrare nella camera a gas la Corte suprema si era già fatta interprete di un bisogno diffuso in mezzo alla gente la vita per la vita occhio per occhio dente per dente mano per mano piede per piede " Capital punishment : Yes !
itwac	Nel soggiorno ecco riapparire la [SEP] sedia [SEP] di compensato a sbalzo già vista in altri concorsi ; sparite le tradizionali gambe di legno , sono sostituite da una struttura di metallo tubolare .
itwac	In un anno - spiegano i fondatori - ' ConFido' è riuscita a mettere in piedi una struttura non da poco : quello che era un campo coltivato a carciofi è stato trasformato in un' area con tre box , un campo di addestramento , uno spazio chiuso dove si tengono le lezioni teoriche e una zona ' ad hoc ' per il lavoro con la [SEP] sedia [SEP] a rotelle dove insegnare ai cani l' accompagnamento dei disabili .
itwac	" L' intervento della stampa  scrive Pucci  ben presto trasformò l' intenzione di Cora di salvare Maria Barbella dalla [SEP] sedia [SEP] elettrica nella prima campagna ufficiale americana contro la pena di morte " .
itwac	L' arredamento , i sussidi didattici e le attrezzature necessarie per assicurare lo svolgimento delle attività didattiche devono avere caratteristiche particolari per ogni caso di invalidità ( banchi , [SEP] sedie [SEP] , macchine da scrivere , materiale Braille , spogliatoi , ecc. ) .
itwac	Sicura che il mio gruppo non avrebbe vinto , mi accasciai su una [SEP] sedia [SEP] e mi tolsi le punte , cominciando a piangere .
itwac	Ai fini del presente titolo si intende per : a ) videoterminale : uno schermo alfanumerico o grafico a prescindere dal tipo di procedimento di visualizzazione utilizzato ; b ) posto di lavoro : l' insieme che comprende le attrezzature munite di videoterminale , eventualmente con tastiera ovvero altro sistema di immissione dati , ovvero software per l' interfaccia uomo-macchina , gli accessori opzionali , le apparecchiature connesse , comprendenti l' unita' a dischi , il telefono , il modem , la stampante , il supporto per i documenti , la [SEP] sedia [SEP] , il piano di lavoro , nonche' l' ambiente di lavoro immediatamente circostante ; c ) lavoratore : il lavoratore che utilizza una attrezzatura munita di videoterminale in modo sistematico ed abituale , per almeno quattro ore consecutive giornaliere , dedotte le pause di cui all' art. 54 , per tutta la settimana lavorativa .
itwac	Se due anni Israele aveva folgorato con i video di Michal Rovner , quest' anno lascia tiepidamente incuriositi con il film-maker Guy Ben-Ner e il suo " Treehouse Kit " , opera che si compone di un albero artistico , che nasce dall' assemblamento di vari pezzi smantellati da tavoli , [SEP] sedie [SEP] , scale a pioli , come un gioco di bricolage , presentato insieme ad un video che illustra quale sia l' utilità di ciascuna parte di questo albero sui generis .
itwac	Sistema la [SEP] sedia [SEP] finita vicino alle altre 3 .
itwac	Essi riferiscono di aver visto Baba prendere o mettere oggetti sui lati o sullo schienale della [SEP] sedia [SEP] sulla quale era seduto  non ricordo quale dissero - .
itwac	Mr Cooper si voltò sulla [SEP] sedia [SEP] e guardò fuori dalla piccola finestra  che da parecchio tempo non veniva lavata  verso il primo fairway , i bulldozer che in lontananza stavano spianando un altro appezzamento di terra .
itwac	In tali uffici deve pertanto essere previsto un adeguato spazio libero , eventualmente in ambiente separato , ove possa svolgersi una ordinata attesa , nel quale inoltre possano disporsi un numero di posti a sedere ( preferibilmente [SEP] sedie [SEP] separate ) pari al 5 per cento del numero totale di affluenze giornaliere prevedibili .
itwac	a Guido : hai scritto " Se tu fossi su una [SEP] sedia [SEP] a rotelle paralizzato e sapessi che la tua guarigione passa dalla ricerca sulle staminali [ ...
itwac	L' ultima parte della lista stilata dall' Ue viene definita ' miscellanea ' ( 52 milioni di dollari ) : le merci comprese spaziano dalle [SEP] sedie [SEP] in legno rivestite in tessuto , agli spazzolini da denti ; dagli orologi da polso alle penne a sfera con inchiostro liquido ; dagli strumenti musicali ai materiali per costruire prefabbricati .
itwac	I regolamenti comunali inerenti ai noleggi ed ai servizi di piazza , devono prevedere , ai fini del rilascio delle relative licenze , che i mezzi da adibirsi al trasporto di persone siano dotati di portabagagli idonei a contenere una [SEP] sedia [SEP] a rotelle ripiegata .
itwac	Parlare di campionato falsato , potrebbe far sobbalzare sulle [SEP] sedie [SEP] .
itwac	Il 9 c' è una [SEP] sedia [SEP] con su scritto il tuo nome .
itwac	Per non ritrovarsi tutti sulla famosa [SEP] sedia [SEP] a rutelle , mi permetto con rispetto di suggerire al leader dell' opposizione alcuni buoni motivi per delle vivissime proteste contro questo governo : 1 ) Scandaloso ed ulteriore aumento delle buste paga dei deputati per arrivare al livello dei senatori , per il quale pero' nessun grido di indignazione mi pare si sia levato da parte dei deputati dell' opposizione .
itwac	IL GAZZETTINO ( Rovigo ) Calci e pugni ai poliziotti , finisce in manette Al loro arrivo stava scagliando in strada [SEP] sedie [SEP] e tavoli .
itwac	Sedie ufficio , [SEP] sedie [SEP] tessuto Mobex Group Cervignano del Friuli ( Ud ) Mobex group è un' interessante iniziativa di produttori italiani , con sede nel famoso e in tutto il mondo conosciuto " Triangolo della sedia " .
itwac	Il Villaggio nasce dall' impegno di don Mario Campidori , con la sua chiamata al sacerdozio e , dal 1947 , con la sua nuova condizione di handicap , a causa della sclerosi multipla che lo ha costretto alla [SEP] sedia [SEP] a rotelle .
itwac	La nuvola di fumo , una nuvolaglia densa come smog , come nebbia , pare non mancasse mai , e rumori vari , di dubbia provenienza , e [SEP] sedie [SEP] di legno , scomode e scricchiolanti .
itwac	Vinta la gara avete distrutto tutte le copie degli dei e ora non resta che Zanat , tornate al laboratorio , sedetevi sulla sedia e parlate con lui per scoprire che siete stati presi in giro per un valido motivo e ora l' unica cosa che vi resta da fare è saltare il muro , scendete dalla [SEP] sedia [SEP] e entrate nello schermo ( il muro ) davanti a voi .
itwac	Carlos ammira la sua bellezza si accosta alla tavola apparecchiata , il Cameriere si ritira discreto , mentre Carlos offre la [SEP] sedia [SEP] alla sua dama .
itwac	Non parlerò della " Gaestekarte " con la quale si viagga gratis su treni / tram ecc. Non parlerò dei parcheggi per le auto con carrozzine a bordo , non le [SEP] sedie [SEP] a rotelle , quelle sono scontate , no , proprio carrozzine e passeggini .
itwac	L' Associazione , inoltre , mette a disposizione gratuitamente di chi ne ha effettivamente bisogno , [SEP] sedie [SEP] a rotelle , stampelle , girelli ed altri ausili , in attesa che vengano espletate le pratiche dell' ASL da parte degli interessati .
itwac	L' ho proprio costretta a sedersi sulla [SEP] sedia [SEP] e a non alzarsi prima di averli letti fino in fondo .
itwac	La [SEP] sedia [SEP] a rotelle l' ha lasciata in clinica e a casa è ritornata per fare campagna elettorale : " Ho accettato l' incarico perché stimo Bossi e perché gli voglio bene " .
itwac	Quando fu il turno di Federica , però , l' insegnante le indicò il posto accanto ad Elena , ed ella si mosse rapida , sorridendo , mentre il ragazzo sbuffava e le cedeva la [SEP] sedia [SEP] .
itwac	" " Quanto ti odio quando storpi il mio povero nome !!!!  esclamò il ragazzo indispettito salendo su una [SEP] sedia [SEP] mentre la ragazza delle carte sorrideva  il mio nome è FRANCYS e sottolineo la s finale !!!
itwac	( Si accascia su una [SEP] sedia [SEP] ) POLDO - Io non c' entro .
itwac	Pubblicato su Va' Pensiero n ° 223 Le foto di Mick Jagger e dei figli appese alle pareti , un casco appoggiato sulla [SEP] sedia [SEP] .
itwac	Buiani - Il sito di un ´ azienda con sede ad Udine da tempo specializzata nella produzione di [SEP] sedie [SEP] in legno pieghevoli .
itwac	Antonio Serratore Wed , 7 Feb 2001 00:22:38 + 0100 Comunico scossa di terremoto avvertita in Liguria città Genova ore 23 30 circa resasi palese con improvvisa sensazione di movimento di tipo " orizzontale " della [SEP] sedia [SEP] su cui ero seduta ed analogo del computer sul quale stavo lavorando che visibilmente si muoveva .
itwac	) e poiché tutte le [SEP] sedie [SEP] erano occupate , si è seduto sull' inginocchiatoio di un banco , in un lato della chiesa , prima di sedersi vicino a don Albino Bizzotto ; quando poi è andato al microfono e ha incominciato a parlare , subito si è fatto trascinare e ha incominciato a gesticolare , ad allargare le braccia , chiudendo gli occhi ...
itwac	In molti casi non ci sono palestre ed aule per tutti e mancano , o sono ridotte in stato pietoso , [SEP] sedie [SEP] , banchi e lavagne .
itwac	Andrea Ho la [SEP] sedia [SEP] di quelle girevoli con le rotelle e scivolando all' indietro ho dato una testata fortissima contro il letto .
itwac	e sedermi sulla [SEP] sedia [SEP] della foto di Corinna Segnala questo messaggio ad un moderatore | IP : Loggato 08 - 04 - 2005 09:34 Jobinda Collaboratore Pastrugni Registrato il : May 2004 Provenienza : Leuven , Belgium Post : 1485 Icq : Corinna , belle foto e bei colori , ma quella dell' uomo non ce l' avrei messa affatto ...
itwac	E' possibile fare rimostranze e comunicare pensieri arringando , dall' alto di una [SEP] sedia [SEP] o di uno scoglio , una folla più o meno interessata , come se ci si trovasse in pieno Hyde Park ...
itwac	Assume l' identità di un individuo valido , Jerome , un campione di nuoto geneticamente perfetto che è inchiodato sulla [SEP] sedia [SEP] a rotelle a causa di un incidente e che non può quindi più permettersi quella vita di lussi cui era abituato .
itwac	Se Gesù fosse stato eliminato 20 anni fa , i bambini di scuola cattolica , invece di portare delle croci appese al collo , indosserebbero catenine con tante piccole [SEP] sedie [SEP] elettriche ( Lenny Bruce ) .
itwac	Ho passato la convalescenza , quattro mesi sulla [SEP] sedia [SEP] a rotelle , a casa di mia madre : è stata dura convivere con lei , le nostre idee su come allevare un bimbo erano completamente diverse !
itwac	In un paese come gli Stati Uniti dove ogni competizione sportiva è presa con serietà assoluta , potete imbattervi in partite di rugby sofferte e rabbiose , su [SEP] sedia [SEP] a rotelle .
itwac	ORE 11.21 - Prima di raggiungere la [SEP] sedia [SEP] a lui riservata , il Presidente della Repubblica si inchina davanti alle bare .
itwac	Vedo un quotidiano piagato su una [SEP] sedia [SEP] poco distante , lo prendo per sfogliarlo .
itwac	La donna , Ina , si guarda attorno stranita e poi avanza lentamente verso una delle quattro [SEP] sedie [SEP] che si trovano presso Dike .
itwac	Per le giornate calde avrete anche il piacere di quattro tavolini fuori , sotto il pergolato ; per tutte , brutte o belle che siano , il calore di una saletta interna rustica , familiare , accogliente , dalle luci discrete : pareti bianche strollate , pavimenti in piastrelle rosso scuro , applique ed aspiratori , tovaglie a quadretti bianchi e blu , massicce [SEP] sedie [SEP] impagliate , posate d' acciaio .
itwac	Ha già così trascorso più di 10 anni in carcere con l' incubo della [SEP] sedia [SEP] elettrica infatti inizialmente la condanna a morte era prevista per il 16 dicembre 1993 .
itwac	Esempio : per trovare una [SEP] sedia [SEP] a dondolo con la parola " antiquariato " nel titolo , inserisci : sedia dondolo + antiquariato .
itwac	Allora il corpo senza vita di Sir Andrew Barthleby si rovesciò dalla [SEP] sedia [SEP] sul parquet .
itwac	Quando sono rientrata , i gatti stavano gia' dormendo sulle [SEP] sedie [SEP] .
itwac	Attilio Gasparo stava seduto dietro al suo bancone di lavoro ben dritto sulla [SEP] sedia [SEP] ma con una espressione contratta , assente .
itwac	gli appartamenti , tutti al piano terra e con uno spazio esterno con tavolo e [SEP] sedie [SEP] sono contraddistinti dai colori diversi delle pareti e dei mobili Agriturismo Via San Bartolo , 19 57027 - SAN VINCENZO ( LIVORNO ) Visualizza Telefono Segnala che ci hai trovato su Agriclub.it Tel : + 39 0565703171 - + 39 335301494 - Mobile : 0335301494 Fax : + 39 0565703171 TOSCANA COSTA ETRUSCA Visualizza la scheda e-Mail Sito web Focus on Costa Etrusca IL BOSCO L' agriturismo # Il Bosco # é situato nella campagna bolgherese immerso nel verde e nella tranquillità , a pochi minuti dal mare e dal viale dei cipressi che Giosuè Carducci cantò nella sua poesia più citata e memorizzata .
itwac	( La Bisnonna crolla su una [SEP] sedia [SEP] del giardino ) MARIA Mamma ?! Mamma !? BISNONNA L' insulina , una caraffa di insulina !
itwac	Come spesso accade , i bambini siedono per terra , e uno fra gli obiettivi dell' associazione nel breve periodo è quello di dotare la scuola di [SEP] sedie [SEP] .
itwac	Quindi accatasta [SEP] sedie [SEP] e rimette al loro posto varie suppellettili che , nel corso delle rappresentazione precedente , erano state disseminate in giro .
itwac	Il ragazzo vive su una [SEP] sedia [SEP] a rotelle , a Viadana , in provincia di Mantova .
itwac	La chiave di volta è l' intuizione scenografica per cui la casa di Nora si riduce a un abbacinante tappeto bianco di forma quadrata , ai cui lati sono disposte delle alte [SEP] sedie [SEP] nere : questo tappeto diventa un ring sul quale i personaggi - per lo più a due per volta , isolati dal loro ingannevole contesto , mentre gli altri siedono immobili attendendo che arrivi il proprio turno - si affrontano in violentissimi scontri simbolici , veri round agonistici che alludono a una società in lotta per sopravvivere , riflesso di una classe « che , appena nata , mostrava già il volto livido della propria marcescenza » .
itwac	Il Codacons chiede inoltre l' obbligo per i gestori di accatastare ogni sera tavoli e [SEP] sedie [SEP] all' aperto , legandoli fra loro per evitare il comodo sostare degli avventori dopo l' orario di chiusura degli esercizi pubblici prosegue la Crivellari e di recepire inoltre la legge statale 447/95 e la legge regionale 21/99 in materia di inquinamento acustico .
itwac	Al centro della stanza un tavolo con due [SEP] sedie [SEP] SIPARIO SCENA PRIMA Metà mattina .
itwac	Il Foglio , 21 gennaio Domanda ( per esempio a Luca Sofri ) Ma una persona di sinistra che legge ( collegando il cervello ) questo discorso non dovrebbe alzarsi dalla [SEP] sedia [SEP] è urlare : " Cazzo , ma questo tizio è fenomenale , proprio il leader di sinistra che abbiamo sempre sognato " ?
itwac	Andate al manicomio , esaminate la macchia in basso a destra e noterete delle impronte di scarpe , usate il rilevatore adesivo e prendetene un campione , girate verso destra lo sguardo e esaminate la pozzanghera sotto il muro , usate il tampone e prendetene un campione e fate la stessa cosa per il disegno sul muro in alto , girando ancora a destra esaminate il tavolino a sinistra della porta , usate i guanti e prendete il pezzo di vetro , esaminate la parte in basso a destra della porta e troverete un altro pezzo di vetro , usate la polvere per le impronte digitali ( ne troverete una incompleta ) , e poi prendetelo con i guanti : entrate in prove e oggetti , controllate il vetro che avete preso sul tavolino e uniteci l' altro per vedere che combaciano , usate un' altra volta la polvere e troverete un' impronta un po' più completa , esaminate le macchie di sangue in terra sotto la finestra e poi in modo più approfondito le crepe che ci sono vicino in modo da scoprire una larva di mosca sotto , prendetela con le pinzette e poi avvicinatevi alla porta in alto , esaminate la polvere sotto e usate il rilevatore elettrostatico per prenderne un campione , entrate nella porta davanti , esaminate la maniglia della [SEP] sedia [SEP] a rotelle e usate la polvere delle impronte per trovarne una .
itwac	ciao una [SEP] sedia [SEP]                   rosy Torna all' inizio mariam Newbie Iscritto : 28 - Agosto - 2004 Località : Italy Messaggi : 25 Inviato : 24 - Novembre - 2004 alle 8:54 am | IP Connesso io non credo che le keniote / italiane siano arroganti solo perche viviamo qui .
itwac	Un tempo era Batgirl e volteggiava libera nel cielo di Gotham , prima di essere ridotta sulla [SEP] sedia [SEP] a rotelle dal Joker .
itwac	Accanto alla finestra una [SEP] sedia [SEP] a dondolo , sulla quale é seduta la donna In un angolo , un letto .
itwac	Generalmente verso gli 11 anni il bambino è costretto a muoversi su una [SEP] sedia [SEP] a rotelle .
itwac	Altri Articoli Lo strano " caso " di Francesco Romeo [ 26/07 ] Tutti in prigione ( a cominciare da chi parcheggia in seconda fila ) [ 21/07 ] La tirannia degli umori più cupi [ 05/07 ] Fare di tutta l' erba un fascio [ 17/06 ] Carceri modello Malaysia [ 17/05 ] Il confine di quello che chiamiamo vita [ 18/04 ] Castelli e il Mercato della Cura Coatta [ 04/04 ] La sicurezza sociale non sempre è « civile » [ 22/02 ] L' agonia della speranza [ 10/02 ] La demagogia dei risarcimenti impossibili [ 24/01 ] Links correlati Suicidi in carcere , le cifre crudeli « Il 24 marzo 2004 , nel carcere di Opera , si è tolto la vita un detenuto paraplegico , costretto su una [SEP] sedia [SEP] a rotelle , Andrea Mazzariello » .
itwac	Ma la [SEP] sedia [SEP] a rotelle , al secondo piano , come ci arriva ?
itwac	in fondo , tra banchi , quaderni e [SEP] sedie [SEP] ; tra libri , matite e colori ...
itwac	A volte le lunghe file di banchetti stuoie , tappetini , mercanzie , carabattole , [SEP] sedie [SEP] , cassette espositive , creano un ambiente di gioco che sembra una discarica di macerie però abitato dalla buffoneria e da una surreale passione per gli oggetti .
itwac	Anziché escludere chi sta in carrozzina , attraverso il Progetto Calamaio noi proponiamo a tutti di sederci in carrozzina , o più facilmente su una [SEP] sedia [SEP] , e poi giochiamo da seduti " .
itwac	» Allora don Predu si riversò ridendo sulla [SEP] sedia [SEP] , col petto gonfio , i denti scintillanti fra le labbra carnose .
itwac	Quindi premiamo T per tornare a sederci sulla [SEP] sedia [SEP] , poi ancora T e X contemporaneamente ( una semplice pressione ) , in modo da sollevare la chiave con i piedi e prenderla con i denti allo stesso tempo .
itwac	Entrando si trovò di fronte un uomo di circa quaranta anni , ma che ne dimostrava almeno dieci di più , seduto su una grossa [SEP] sedia [SEP] di legno , con un libro aperto sulle ginocchia .
itwac	Deve essere garantito in particolare : lo spazio necessario per l' accostamento laterale della sedia a ruote alla tazza e , ove presenti , al bidet , alla doccia , alla vasca da bagno , al lavatoio , alla lavatrice ; lo spazio necessario per l' accostamento frontale della [SEP] sedia [SEP] a ruote al lavabo , che deve essere del tipo a mensola ; la dotazione di opportuni corrimano e di un campanello di emergenza posto in prossimità della tazza e della vasca .
itwac	Non ti metti il casco per fare 100 metri e se rimani su una [SEP] sedia [SEP] a rotelle ti incazzi : ma che ti incazzi , mettiti il casco no ?
itwac	A destra e in prima una [SEP] sedia [SEP] per il paziente .
itwac	Il corpo era legato alla [SEP] sedia [SEP] da grossi legacci di cuoio .
itwac	Lei impugnava , dondolandole , le due stampelle a cui si appoggiava ogni mattina per raggiungere la sua [SEP] sedia [SEP] .
itwac	Il professore allora prendeva i foglietti dei primi arrivati , bloccava la competizione , dava un voto negativo a tutti coloro che non si erano nemmeno alzati dalla [SEP] sedia [SEP] e controllava le risposte che gli erano pervenute .
itwac	Dichiarò d' averla usata tanto perché questa [SEP] sedia [SEP] con braccioli , « certamente più banale e di prezzo più modesto [ ...
itwac	Con l' ausilio della [SEP] sedia [SEP] da combattimento tale limite può essere portato più in là , ma si rischia di stressare il pesce e farlo attaccare dai suoi simili , cosa da evitare .
itwac	Con la [SEP] sedia [SEP] a prua questa fase risulta molto facilitata , ma se l' inseguimento risulta più veloce e semplice non bisogna rischiare di andare troppo velocemente sul pesce con il rischio di non fargli sentire la trazione del filo .
itwac	E la vide , brulicante di vermi , seduta sulla [SEP] sedia [SEP] vicino al letto .
itwac	Il protagonista è un usuraio costretto su una [SEP] sedia [SEP] a rotelle che osserva lo strazio che lo circonda dalla sua casa semidistrutta .
itwac	Tabella " A " Requisiti minimi obbligatori per gli esercizi di affitacamere - Camere da letto , aventi accesso indipendente da altri locali e non più di tre posti letto ciascuna arredate con : 1 ) letto , comodino , lampada e [SEP] sedia [SEP] per persona ; 2 ) armadio ; 3 ) specchio e presa di corrente ; 4 ) cestino per rifiuti .
itwac	Le persone in [SEP] sedia [SEP] a rotelle hanno bisogno di aiuto per raccogliere le cose , accendere le luci ecc. e i cani sono molto utili a questo scopo .
itwac	Le [SEP] sedie [SEP] scalciate cadono , si allungano mani a prendere bicchieri d' acqua , a dare pacche sulle spalle per far sputare il supplì a Fidel-Diego .
itwac	L' ufficio non è nulla di pretenzioso : una stanza che sulla destra ha una fila di schedari , subito dopo , una porticina che da sul bagno ; sulla parete sinistra è appoggiato un divano verde che ha visto giorni migliori , come pure la scrivania , letteralmente stracolma di carte ammonticchiate alla rinfusa , davanti alla scrivania ci sono tre [SEP] sedie [SEP] destinate ai visitatori , dietro , una poltroncina in finta pelle nera alle cui spalle si apre l' unica finestra protetta da veneziane .
itwac	La presenza di Guido che lentamente si sta accartocciando sulla sua [SEP] sedia [SEP] a rotelle , costituisce invece un centro di attenzione , di affetto .
itwac	Sardus Senior Member Sardegna Meridionale 558 Posts Posted - 30/05/2002 : 10:08:58 Forse sono ancora incoscente Diego pero l' unico vantaggio rispetto ad altri posti e che da noi i Tonni passano veramente a Terra e che se entra un po di mare in 30 minuti sei a terra il mio dubbio e relativamente al fatto che su una barca cosi piccola il beccheccio con la [SEP] sedia [SEP] a prua crei qualche problema Giorgio per esempio vuole montarla a poppa .
itwac	Ecco dunque che mi siedo per terra , visto che l' unica [SEP] sedia [SEP] presente nella camera è occupata da vestiti e borsa , e appoggio la schiena alla pediera del letto .
itwac	A quel punto mi alzai dalla [SEP] sedia [SEP] dove ero seduto e mi incamminai come se dovessi percorrere il miglio verde per arrivare alla sedia elettrica .
itwac	Gli accordi pure , manca solo la " copertura " delle [SEP] sedie [SEP] .
itwac	Mi alzo dalla [SEP] sedia [SEP] , mi stiracchio e mi distraggo un po' e proprio in quel momento sento il mio alutecnos urlare all' impazzita .
itwac	Il rafforzamento della nuova legittimità nell' elezione del Doge fu derivata , in primis , perchè questi iniziò subito la tradizione di distribuire denari propri alla folla , da una sorta di " [SEP] sedia [SEP] gestatoria " , condotta intorno a piazza San Marco e Rivo Alto , definita pozzetto ( ndr : una sorta di larga tinozza portata a spalle da portantini , a mezzo di due stanghe infisse nella parte superiore della tinozza stessa ) .
itwac	Viene a riprendersi Heidi e la manda a studiare a Francoforte in una casa dove vive Clara , una bambina costretta su di una [SEP] sedia [SEP] a rotelle .
itwac	Ognuno è sceso portandosi dietro la propria [SEP] sedia [SEP] : duemila persone , duemila sedie , i bambini con le seggioline ...
itwac	Camera-studio ; scrivania con [SEP] sedia [SEP] ; Libreria .
itwac	Il Papa lascia la residenza Notre Dame dove ha alloggiato come altri malati e percorre il breve tratto di strada che lo separa dalla roccia di Massabielle sulla [SEP] sedia [SEP] mobile .
itwac	E ancora [SEP] sedie [SEP] , ruote , bottiglie di vetro e plastica e chi più ne ha più ne metta .
itwac	L' unica manifestazione della sua malattia era che gli ci voleva un bel po' per alzarsi dalla [SEP] sedia [SEP] .
itwac	Mio marito si chiama Arakolla di SaleSole ( con tutte e due le S maiuscole ) Per quanto riguarda la serie rustica a noi non serve il tavolino ma il comodino ok tra 10 minuti ti mando i codici del letto e della [SEP] sedia [SEP] .
itwac	Io e le mie cose posate su una [SEP] sedia [SEP] per farle riposare io e le mie cose sotto una lampada accesa che illumina i miei libri io e le mie cose che stanno lì a guardarmi che stanno ad ascoltarmi che sanno aiutarmi .
itwac	PERSONALMENTE , E TI PREMETTO FORTUNATAMENTE , HO AVUTO LA POSSIBILITA' IN QUESTI ANNI DI PESCA DI PROVARE L' EMOZIONE DEL COMBATTIMENTO IN VARI MODI , INTENDO DIRE , BARCA PICCOLA CON SEDIA A PRUA FILO DA 80 E DA 50 LBS , BARCA GRANDE [SEP] SEDIA [SEP] A POPPA IN POSIZIONE " NORMALE " E FILO DA 80 LBS , BARCA GRANDE CON SEDIA " ALLA FRANCESE " FILO DA 80 LBS , BARCA GRANDE CANNE STAND-UP FILO RISPETTIVAMENTE DA 80 , 50 , 30 LBS , QUINDI VORREI DIRE CHE HO PROVATO DIVERSE SITUAZIONI , NON CREDI ?
