corpus	sentence
itwac	In termini di abito in senso lato , siamo interi quando i segni del nostro mostrarsi ( vestiti compresi ) giocano con " sintassi coerente " ( Roland Barthes ) : possono sbizzarrirsi nei richiami , negli stili , nelle allusioni , nelle figure di invenzione , possono evidenziare un aspetto , un gesto corporeo , oppure porre in risalto la parte più eloquente di sé e possono anche provocare contrasti , come un foulard con una [SEP] sedia [SEP] a rotelle e come una " passeggiata meccanica " sul bagnasciuga del mare ...
itwac	Nelle stazioni metropolitane devono essere agevolati l' accesso e lo stazionamento su [SEP] sedia [SEP] a ruote , anche con l' installazione di idonei ascensori e rampe a seconda dei dislivelli , al fine di consentire alle persone non deambulanti di accedere con la propria sedia a ruote al piano di transito della vettura della metropolitana .
itwac	Un po' divertito ( e nascondendo l' ironia - faccio il loro mestiere , vengo da quei loro giornali - pur mescolata alla simpatia umana ) , le snocciolavo a bella posta fatti e dati e la vedevo sgranare gli occhi , agitarsi sulla [SEP] sedia [SEP] .
itwac	Arredamento delle camere : 1 ) letto , armadio , specchio ( 1,2,3,4 ) 2 ) comodino e tavolino ( sostituibili da ripiani con analoga funzione ) ( 1,2,3,4 ) 3 ) lampade o appliques da comodino ( 1,2,3,4 ) 4 ) cestino rifiuti ( 1,2,3,4 ) 5 ) sgabello o ripiano apposito per bagagli ( 2,3,4 ) [SEP] Sedie [SEP] e poltrone nelle camere o unità abitative : 1 ) una sedia per letto ( 1,2,3,4 ) 2 ) una poltroncina per letto ( 3,4 ) Televisione : 1 ) in tutte le camere ( 4 ) 2 ) con antenna satellitare ( 4 ) 3 ) ad uso comune ( 2,3,4 ) Telefono : 1 ) apparecchio telefonico per uso comune ( 1,2,3,4 ) 2 ) apparecchio telefonico in camera ( 4 ) Assenza barriere architettoniche ( 4 ) Sala per colazione ( 3,4 ) Sala soggiorno lettura ( 4 ) Camere con vista panoramica ( 3,4 ) Seggiolone per bambini ( 2,3,4 ) Lettino / culla per bambini ( 2,3,4 ) Servizio sveglia ( 1,2,3,4 ) Possibilità di utilizzo lavatrice ( 3,4 ) Possibilità di utilizzo ferro da stiro ( 3,4 ) Possibilità di utilizzo computer ( 4 ) Giardino ( 3,4 ) Per le tipologie di immobile che lo prevedono .
itwac	Nella prima edizione , nel '98 , Jack l' albatro doveva morire sulla [SEP] sedia [SEP] elettrica ad Alcatraz , ma all' ultima puntata riuscì a fuggire e continuò a trasmettere i suoi programmi da latitante , prima a Cuba , poi di nuovo in Italia .
itwac	Due Effe Sedie - Ditta friulana operante nel settore legno specializzata nella produzione di [SEP] sedie [SEP] in legno e in legno e metallo .
itwac	La struttura si presenta come un bellissimo edificio arredato in maniera raffinata con mobili antichi che offre una sala colazione , un bar ed un giardino con [SEP] sedie [SEP] e tavolini .
itwac	Una rappresentazione quasi da incantesimo vista per noi da Piero Gelli Tevjie un mir ( Tevjie e noi ) ( 3 maggio 2001 ) Una storia popolare in un villaggio : Moni Ovadia torna al teatro yiddish con l' intenzione di coglierne lo spirito popolare A tutto tondo - nuova certificazione del mondo di Suzie Wong ( 27 febbraio 2001 ) Una partitura verbale insensata e surreale , in un impasto linguistico ossessivo , debordante , amenamente indecifrabile Le [SEP] sedie [SEP] ( 25 gennaio 2001 ) Nel suo approccio dal taglio eminentemente visivo , Pericoli non va oltre un paio di ininfluenti invenzioni , quelle sedie che escono dal pavimento come strane efflorescenze , come entità bizzarramente invasive La sonnambula ( 16 gennaio 2001 ) Dal pubblico coloriti dissensi che , l' opera di Bellini non ha del tutto meritato .
itwac	Ci vorrebbero tecnici disposti a perdere fette di potere , associazioni disposte ad investire in cultura e informazione , volontari disposti a guardarsi prima di tutto allo specchio , assessori e giornalisti che tirano su le " chiappe " dalle [SEP] sedie [SEP] per andare a conoscere direttamente le cose di cui si occupano , persone disabili forse più " cattive " ( leggasi a tal proposito di Elisabeth Auerbacher il volume " Babette , handicappata cattiva " , EDB ) e che non cedono alla tentazione , che è poi una bugia che si dice a sè stessi , di parlare a nome dell' intera categoria .
itwac	Finissima pasticceria mignon , finissima pasticceria salata , monoporzioni , dolci al bicchiere , torte da credenza , biscotteria , fondant , gelatine di frutta , torte semifreddi e mousse , torte gelato , pralineria , creazioni di marzapane , lingua : it http://www.caffecavour.com Campus & co di Campopiano Gaetano La ditta CAMPUS si occupa dell' allestimento di feste e cerimonie in genere e dispone di tavoli e [SEP] sedie [SEP] in vari modelli , attrezzature , mobili , posateria di raffinata fattura , nonchè di ombrelloni eleganti e funzionali .
itwac	Ed era un bisogno incontenibile riempire ogni ora di ogni giorno , sfuggire al silenzio anche di un solo momento , disertare la casa , accumulare indumenti su [SEP] sedie [SEP] e poltrone rinviando all' infinito la decisione di mettere ordine .
itwac	Felice Farina ( Sembra morto ma è solo svenuto , Affetti speciali , Sposi , Condominio , Ultimo respiro , Bidoni ) siede con una certa ostentazione di sicurezza su una [SEP] sedia [SEP] " da regista " un po' particolare , più che altro una imitazione dell' originale , in un luogo che potrebbe essere un teatro di posa o un capannone per le prove .
itwac	Mio nonno fa una [SEP] sedia [SEP] .
itwac	Folclore pittoresco , nel migliore dei casi , roba da cartolina turistica con guardia svizzera , [SEP] sedia [SEP] gestatoria , flabelli ...
itwac	Quando Arthen aveva nominato Marcus Laghen , dapprima posseduto , e Josevof il cerusico , aveva quasi fatto un balzo sulla [SEP] sedia [SEP] : chissà per quanto tempo erano andati a caccia di vampiri dimenticandosi di persone che potevano conoscere alcuni tra i più importanti dettagli !
itwac	SETTIMO QUADRO SCENA La stessa del sesto quadro , solo che il tavolo dello studio è sgombro di carte e libri ed è cirondato da una serie di [SEP] sedie [SEP] .
itwac	Il ripiano di fermata , anteriormento alla porta della cabina deve avere una profondità tale da contenere una [SEP] sedia [SEP] a ruote e consentire le manovre necessarie all' accesso .
itwac	Una grava malattia lo costringe su una [SEP] sedia [SEP] a rotelle .
itwac	Nelle case non ci sono più verande , gli spazi dove le famiglie si riunivano a parlare , ne panchine sui giardini o [SEP] sedie [SEP] a dondolo .
itwac	Una piccola [SEP] sedia [SEP] di legno , sola in mezzo a quello spazio desolato , anch' essa imbiancata come tutto il resto .
itwac	Mi chiedo , in [SEP] sedia [SEP] forse sarebbe stato più breve il combattimento ?
itwac	Il cameriere che viene , ci accompagna al nostro tavolo , mi scosta la [SEP] sedia [SEP] per farmi sedere ...
itwac	[SEP] Sedie [SEP] , tavole , piatti , raudi ?
itwac	[ 06 06 2005 14:39 ] ciao , ho due belle [SEP] sedie [SEP] impagliate di una volta da restaurare .
itwac	Critica " Quasi cinquant' anni fa , ne ' La finestra sul cortile ' di Hitchcock era l' ivestigatore per caso Jmaes Stewart a indagare stando provvisoriamente sulla [SEP] sedia [SEP] a rotelle , poi anche il Perry Mason televisivo si trovò nella stessa condizione : Denzel Washingoton sta peggio , immobilizzato a leto , paralizzato , capace di muovere appena due dita .
itwac	Le nuove scuole stanno riflettendo sempre più questa direzione disponendo di tappeti , [SEP] sedie [SEP] più comode , schermi , zone calme e della presenza di piante , mostre vivaci e interessanti e di lay-outs ( addobbi ) flessibili .
itwac	Ognuno è sceso portandosi dietro la propria [SEP] sedia [SEP] : duemila persone , duemila sedie , i bambini con le seggioline ...
itwac	Ma noi eravamo come legati alle [SEP] sedie [SEP] ed al pavimento , alle sue smorfie neanche badavamo .
itwac	RABBIELE : - ( si alza dalla [SEP] sedia [SEP] prende la sigaretta la mette in tasca ) Grazie segreta ' , se permettete , m'  a fummo roppo !
itwac	All' interno di almeno un' autovettura del convoglio deve essere riservata una piattaforma di spazio sufficientemente ampio per permettere lo stazionamento di [SEP] sedia [SEP] a ruote , senza intralciare il passaggio .
itwac	Nell' asilo di Noemi la maestra ha fatto tagliare le gambe ad un tavolo ed ha preso delle [SEP] sedie [SEP] più basse ...
itwac	Grazie ancora , a presto nettuno E quanto bisogna aiutarsi con le mani sul filo in bobina , durante il combattimento ?? In [SEP] sedia [SEP] , con libraggi alti , chiudi di più la frizione e sforzi , o addirittura con la mano tieni stretto il filo sul fusto ( non so se é corretto , ma alcuni lo fanno ) .
itwac	Vieni siediti ( offre la [SEP] sedia [SEP] ) parliamo un po' .
itwac	Richard Yates L' incipit di Revolutionary Road Leggi un estratto da Revolutionary Road di Richard Yates UNO L' ultima eco della prova generale si spense , e gli attori della Compagnia dell' Alloro si ritrovarono senza altro da fare che starsene lì , silenziosi e smarriti , a guardare oltre le luci della ribalta verso una platea deserta , battendo le palpebre ; osavano appena respirare , mentre la figura tozza e solenne del regista emergeva tra le nude [SEP] sedie [SEP] per raggiungerli sul palcoscenico e dalle quinte tirava fuori , trascinandola rumorosamente , una scala doppia , vi saliva fino a metà , e da qui si voltava e gli diceva , raschiandosi più volte la gola , che erano tipi maledettamente in gamba e che era proprio un piacere lavorarci assieme .
itwac	Ovviamente , nell' immediato si lotta per la [SEP] sedia [SEP] di Noyer .
itwac	Mobilie - Azienda specializzata nella produzione di [SEP] sedie [SEP] , tavoli , poltrone e divani per casa , bar , caffetterie e alberghi .
itwac	« Questa volta quando andrò in America - continua ad urlare Benigni al telefono - comincerò a saltare sulle [SEP] sedie [SEP] già sull' aereo .
itwac	Alla nostra destra , nella stanza , ad un' altezza di circa trenta centimetri da terra si trovava una pedana sulla quale c' erano alcune sedie , mentre alla nostra sinistra c' erano altre [SEP] sedie [SEP] preparate per noi .
itwac	Operazioni da effettuare nel corso della distribuzione : Il personale addetto alla distribuzione dovrà osservare , per il buon andamento del servizio , oltre alle norme previste nel piano di autocontrollo adottato dall' I.A. per le operazioni di distribuzione di cui al comma 4 dell' art. 14 , anche le seguenti disposizioni : - I locali refettorio devono essere aerati prima di iniziare le operazioni di apparecchiatura per il tempo necessario al ricambio dell' aria - Le [SEP] sedie [SEP] , anche nelle aree non usate giornalmente , dovranno essere riordinate " a terra " e non appoggiate sui tavoli ed i tavoli igienizzati con appositi prodotti prima dell' apparecchiatura - Il personale addetto alla distribuzione dovrà indossare apposito camice ( distinto da quello per i lavori di pulizia ) e dovrà essere provvisto di cartellino di identificazione riportante il nome dell' impresa ed il proprio nominativo , cuffia , in modo tale da contenere tutta la capigliatura , e dovrà usare guanti monouso .
itwac	Sulla [SEP] sedia [SEP] la mia vecchia signora si è svuotata , dei suoi ricordi con me e ora per il suo amore .
itwac	se va male si mette a ballare sulla [SEP] sedia [SEP] a rotelle 23 .
itwac	Le sue gambe tremavano nello spasmo di volersi alzare da quella [SEP] sedia [SEP] per fuggire eppure rimanevano immobili .
itwac	TELEFONO 0321 3702320 ORARI Da lunedì a venerdì : 8.30 - 12.00 INFORMAZIONI L' attività di riscossione della Tassa Occupazione Spazi ed Aree Pubbliche è stata affidata , a far data dal 1 ° di gennaio 2003 , alla società A.I.P.A. S.p.A. - via Mossotti , 10 Tel. 0321 612291 - fax 0321 399052 Da lunedì a venerdì : 8.30 - 12.30 ; Lunedì-mercoledì-giovedì : 14.00 - 15.00 OCCORRE RIVOLGERSI ALL' UNITA' PLATEATICO PER : VARIE Tavolini e [SEP] sedie [SEP] esterni agli esercizi Vasi e fiori all' esterno di edifici Aree esterne alle officine ( meccanici , elettrauto , ecc ) Manifestazioni sportive o culturali o religiose Esposizione macchine agricole ( in p .
itwac	Improvvise cadute di ospiti nel ristorante , ben 2 clienti , per le [SEP] sedie [SEP] vecchie e obsolete che si rompevano malamente .
itwac	lingua : it http://www.glomanet.com/3barredamenti 3 Emme Produzione di [SEP] sedie [SEP] pieghevoli in legno , sofa e tavoli .
itwac	io sono un purista della lingua italiana ( anche se limitato ) , e sopporto meno di voi le scorribande letterarie con neologismi da arresto e [SEP] sedia [SEP] elettrica !
itwac	( ride ) ( Fascista P si procura rapidamente una nuova [SEP] sedia [SEP] SEDIA 4 vistosamente scassata , la mette al posto di quella fracassata e poi i due Fascisti escono ; in scena è comparsa Viola ) VIOLA - Io l' ho visto , stanotte , ho visto Anteo era in cortile e faceva i giochi con Friz - Friz è un cane , il cane che sta lì in cortile - Friz scappava di qua e di là e lui gli correva dietro e gridava  attento Friz , che se ti prendo !
itwac	Attraverso un cancello costituito da tavole di legno dipinte , gli agenti hanno quindi raggiunto il portico di un secondo stabile , attiguo al primo , dove erano ammassati , alla rinfusa ed in evidente stato di deterioramento , vecchi televisori , tastiere e monitor di computer in disuso , biciclette e [SEP] sedie [SEP] .
itwac	Già la distanza aristocratica e rigida di Pio XII , flabelli e [SEP] sedia [SEP] gestatoria , fu violata , annuncio dei nuovi tempi , dal mediocre intrallazzo dell' archiatra pontificio , foto mortuarie cedute per soldi e vanità .
itwac	E seduta su una [SEP] sedia [SEP] rococò , con una sua antica dignità perduta , ascolto trasognata le sue parole pesanti , bocconi amari , che ancora lo stomaco non riesce a digerire .
itwac	Le [SEP] sedie [SEP] della platea ?
itwac	Seduti attorno al tavolo , in [SEP] sedie [SEP] di plastica , di fronte a bicchieri di plastica e borsetta di cartone personale , 18 altri cristiani .
itwac	I ricercatori che lo circondano sono comunque soddisfatti : Nagle infatti è tetraplegico , costretto da quattro anni sulla [SEP] sedia [SEP] a rotelle , e manovra il computer solo con la forza del pensiero .
itwac	Nel retro della casa si trova un' area attrezzata con tavolo e [SEP] sedie [SEP] , comoda per cenare all' aperto .
itwac	Potrete aumentare i piani della vostra casa costruendo nuove scale per il comunicamento tra i due piani , potrete abbellire sotto ogni punto di vista la vostra casa con quadri , tappeti , rivestire le mura , acquistare accessori per i bagni con straordinarie vasche da bagno , lampade , tavoli , letti , [SEP] sedie [SEP] , armadi e tantissimi altri oggetti e , ovviamente , dovrete attrezzare le vostre stanze per dedicarle allo staff con scrivanie , set fotografici ...
itwac	Posti dove l' ideale sarebbe starsene , all' interno della propria tuta isolante , seduti su una [SEP] sedia [SEP] a sdraio a godersi i colori di un panorama così ben dipinto .
itwac	Nella originaria villa , circondata da una fitta vegetazione , sono state ricavate 16 camere e 2 appartamenti , completamente e finemente ristrutturate nel 2004 , disposte a piano rialzato e primo piano , tutte dotate di servizi privati con doccia , TV color con satellite , ventilatore e dispongono di giardinetto o balcone con tavolo e [SEP] sedie [SEP] .
itwac	La sala ristorante è dotata di seggioloni , alza [SEP] sedie [SEP] , tavoli apparecchiati con posate , piatti e bicchieri adatti ai più piccini e tovagliette e pastelli a cera per colorare durante il pasto .
itwac	Sarcastici e autoironici li vediamo alle prese con gli ostacoli da affrontare nella vita quotidiana : da quelli materiali ( le scale " impossibili " per le [SEP] sedie [SEP] a rotelle ) a quelli di relazione ( la difficoltà a comunicare per i sordi ) .
itwac	Fa la comparsa il primo scrittoio con ripiano liscio e cassetti disposti come fossero fregi oppure sovrapposti ai due estremi del mobile e si diffonde la decorazione a tornio per le gambe di tavoli e [SEP] sedie [SEP] .
itwac	Il sole sta tramontando sulle colline e gli ultimi raggi illuminano , ancora per pochi minuti , le tegole dei tetti i grossi sassi dei muri , i portali di legno , le fioriere di terracotta , le vecchie [SEP] sedie [SEP] impagliate e i visi della gente .
itwac	( comparendo in scena , spingendolo su una [SEP] sedia [SEP] a rotelle ) FILIPPO Sbigghiai !
itwac	In cella egli non disponeva che di un piccolo tavolo , una [SEP] sedia [SEP] di paglia , un catino per la toeletta , una minuscola tela raffigurante l' " Ecce homo " , una croce di legno in capo al letto , il breviario e i quaresimali da lui scritti .
itwac	Ero al Congresso DS a Palermo e le cose sono andate in modo un po' diverso : Crisafulli al termine del suo discorso dove ha chiesto la pace ( ecumenica ) nel partito ( anche con Fava , ovviamente ) e' sceso dal palco e passando davanti la [SEP] sedia [SEP] dove era seduto Fava gli ha alzato il pugno in aria , tra la platea plaudente .
itwac	Poi si accomodò su una [SEP] sedia [SEP] : si reggeva a pena , era curvo e stanco .
itwac	GIUSEPPE 347 - 7942346 20/06/2005 - giuseppe234@gmail.com - 347 - 7942346 Gianluca Vendo un tavolo da giardino con quattro [SEP] sedie [SEP] + un lettino con materassino , di colore bianco .
itwac	Chi versa lacrime per l' Olocausto mentre insulta la lotta antifascista , mente ed è un ipocrita che furbescamente si sintonizza con l' aria che tira e coloro che , eredi delle vittime , si compiacciono per le lacrime da coccodrillo dei nostalgici del buon Mussolini , tirano la volata ad una mascherata retorica il cui scopo è quello di fare incallire il sedere di politici mediocri sulle [SEP] sedie [SEP] del potere .
itwac	In particolare : - tavoli , [SEP] sedie [SEP] , pensili , letti , armadi , cassettiere , divani , scrivanie , librerie , poltrone , corpi illuminanti ; - gli elettrodomestici di uso comune , quali : frigorifero , stufa , forno , lavastoviglie , lavatrice , televisore , nella misura di uno di ciascuna tipologia per nucleo familiare .
itwac	E mi sono vista rubare davanti agli occhi una [SEP] sedia [SEP] anni Cinquanta , modello danese , lasciata in un angolo della strada con altre cose di poco conto .
itwac	Nella [SEP] sedia [SEP] a fianco a lei , canta mio padre .
itwac	o le [SEP] sedie [SEP] sn nuove e alte e i banchi piccoli e bassi o viceversa ...
itwac	Un esempio pratico di questo modo di percepire la realtà ci viene da alcuni oggetti di moderno design : la [SEP] sedia [SEP] di Rietveld ne è un esempio lampante , in essa si tende ad accontentare soprattutto l' aspetto estetico e , anche se a prima vista l' oggetto sembra funzionale , ci si accorge che in realtà non riesce più a svolgere la sua funzione primaria , e se si sorvola sull' impatto visivo immediato e si prova ad usarla per quello per il quale sembra essere stata progettata ( sedersi ) ci si accorge che l' oggetto necessita di molte migliorie per poter essere fruibile e quindi raggiungere un' " estetica " ottimale dell' oggetto .
itwac	) Il film fa saltare periodicamente gli spettatori periodicamente sulla [SEP] sedia [SEP] , come una continua bomba a orologeria , e questo è in fondo quello che si chiede oggi a un horror .
itwac	Anche se ci sono delle [SEP] sedie [SEP] io sono sdraiata sul pavimento .
itwac	( I Servitori portano le [SEP] sedie [SEP] .
itwac	Tiesse [SEP] Sedie [SEP] attualmente é presente anche in Italia , e precisamente a Montesilvano , in Abruzzo dove l' esperienza quasi trentennale , e la professionalità del servizio la rendono un punto di riferimento per gli importatori ed i distributori di tutto il mond http://www.tiessesedie.it Arredamento MONTESILVANO ( Pescara ) Angelo gaggioli spa L' azienda di Roma esporta i propri prodotti in tutto il mondo , con la continua creazione di nuovi modelli che soddisfano sempre piu' vaste ed esigenti clientele .
itwac	tutti sappiamo far saltar dalla [SEP] sedia [SEP] le persone con un buuuuuu improvviso .
itwac	Le donne le vestiamo da talibane e le mettiamo in bella posa patetica sulle [SEP] sedie [SEP] ...
itwac	Degli anni '60 sono presenti alcuni degli oggetti più noti : la [SEP] sedia [SEP] Carimate , che diventerà uno degli emblemi della Swinging London e dei Beatles , la lampada Eclisse , prodotta per Artemide , e la sedia Selene , in plastica stampata , uno dei suoi pezzi più venduti al mondo .
itwac	Ora , superato il traguardo degli ottant' anni , del magnifico attore , non alto ma fascinosissimo , che piace ad uomini e donne , resta un uomo obeso ( supera i 170 kg ) , costretto dalla mole sulla [SEP] sedia [SEP] a rotelle e attaccato alla bombola dell' ossigeno per respirare .
itwac	Nella navata della chiesa di San Pietro a Lubecca , appoggiati a un piano inclinato , diverse [SEP] sedie [SEP] , sgabelli e poltroncine di legno , originali o riprodotti oggi , fanno bella mostra di sé , elegantissimi , lineari , di una sobrietà che in questo caso affianca Aalto al rigore formale del Razionalismo e che è assolutamente valida anche oggi .
itwac	Si tratta di descrivere se stessi attraverso lo sguardo e la voce narrante che si immagina possa avere il vicino di [SEP] sedia [SEP] .
itwac	Non c' è spazio sufficiente per le [SEP] sedie [SEP] , ma se anche ci fosse non ricaverebbero molto utile da queste manifestazioni .
itwac	Sono qui seduto su questa [SEP] sedia [SEP] fragile e muto ...
itwac	Le [SEP] sedie [SEP] dell' aula più grande sono state divelte e sono fuori posto .
itwac	Solitamente la visione di un vedente va dal generale al particolare ( prima vedo una sedia interamente po i mi accorgo che ha dei fregi o i braccioli inclinati ) , il non vedente toccando la sedia va dal particolare al generale , prima cioè si accorge dei fregi e dei braccioli poi arriva alla rappresentazione totale della [SEP] sedia [SEP] .
itwac	Inoltre , sono state consegnate ad altrettanti disabili 32 [SEP] sedie [SEP] a rotelle e due elettriche a batterie pari a 8.000 Euro e 5 protesi per traumatizzati dalla guerra o affetti da gravi malattie .
itwac	Le piaceva sedere sulle [SEP] sedie [SEP] rigide di ferro bianco e freddo a sfogliare le pagine dei libri .
itwac	- risponde lei prendendo una [SEP] sedia [SEP] e sorridendogli dolcemente .
itwac	Quando sono nato ( 1963 ) , eravamo in pieno boom demografico , basti pensare che quando mia Madre arrivò all' ospedale non c' era posto e dovette aspettare le gioie e delizie del parto , seduta su una [SEP] sedia [SEP] ...
itwac	All' interno di almeno un' autovettura del convoglio deve essere riservata una piattaforma di spazio sufficientemente ampio per permettere lo stazionamento di [SEP] sedia [SEP] a ruote , senza intralciare il passaggio .
itwac	Bob ( Si alza dalla [SEP] sedia [SEP] .
itwac	Certo che mettere fra i premi una [SEP] sedia [SEP] da combattimento é il massimo ...
itwac	92 04078/08 , che modifica l' art. 5 del Regolamento per la concessione dei locali comunali da parte delle Circoscrizioni , può essere quantificato in EURO 21,70 = ; la pubblicizzazione per mezzo di pieghevoli illustrativi in distribuzione , una pubblicita' mirata mediante invio di materiale ad un indirizzario di persone interessate ed eventualmente la predisposizione di manifesti da affiggere nelle bacheche del territorio circoscrizionale ( oneri di affissione a carico dell' Associazione ) ; la predisposizione e duplicazione di eventuali materiali informativi e formativi ; l' utilizzo degli strumenti tecnici ( lavagna luminosa , microfono , tavolo e microfono partatile , videoproiettore per slide da PC ; regolazione impianto di amplificazione a cura di un addetto della Circoscrizione , prolunghe e collegamenti per le proiezioni con PC , [SEP] sedie [SEP] ) , utili alla realizzazione dell' intervento .
itwac	Nella " sala ricreativa " di giochi non ce n' erano , ma non c' erano neppure [SEP] sedie [SEP] e tavoli .
itwac	Aveva sfilato i libri dagli scaffali come alibi per alzarsi , prendere un manichino , vestirne la metà superiore con la sua felpa e il suo berretto e infine sistemarlo sulla [SEP] sedia [SEP] .
itwac	Ed infatti le cose non sembravano mettersi per il meglio perché le [SEP] sedie [SEP] erano quasi tutte occupate da un' umanità freddolosa e preoccupata .
itwac	Allora in silenzio monto la digitale sul cavalletto , prendo una [SEP] sedia [SEP] e ci appoggio l' Album della Russia , meglio che posso , e inquadro con moderata attenzione , una volta per tutte .
itwac	Le [SEP] sedie [SEP] avevano lo schienale ed anche le cassapanche .
itwac	Appena entrati , Eric diede il tempo ai suoi ospiti di ambientarsi , poi gli disse « Bene , sedetevi pure li e li » indicando due [SEP] sedie [SEP] che avevano di fronte a loro altrettanti schermi di pc , « e lasciate pure i cappotti dove volete » [ x Algaroth e Ananke : qui mi fermo , vi dò il tempo di aggiungere una vostra descrizione / impressione , poi continuo con il collegamento alla Digital Web !
itwac	Locale very trendy , con arredamento tuttaltro che soft , infatti , si mangia seduti su [SEP] sedie [SEP] tigrate in un' am ...
itwac	Bosnia Erzegovina : Impegno dei militari italiani per i bambini vittime della guerra I trasmettitori della 3 ª Compagnia " Drago " del 1 ° Reggimento Trasmissioni di Milano , inquadrati nel contingente Italfor Bosnia , hanno donato una [SEP] sedia [SEP] a rotelle ad un ragazzo disabile vittima della guerra , Hasan Zimic , 12 anni , regalandogli un momento di sorriso .
itwac	I giornali di famiglia e gli alleati più fedeli dicono in coro che si tratta di un normalissimo avvicendamento , che De Bortoli aveva occupato la [SEP] sedia [SEP] per fin troppo tempo , che il direttore entrante è meglio di quello uscente , forse anche perché dopo gli esordi con Spadolini Stefano Folli è finito di recente a compilare le schede politiche per Bruno Vespa .
