corpus	sentence
itwac	pochi passi dal confine col Lazio e a 2 km dal Sacrario di Mignano Montelungo dove riposano tanti giovani vite che combatterono lungo la linea Gustav , è un ristorante di recente costruzione con una grande sala luminosa ci siamo stati a pranzo in due prendendo una farfalla ai carciofi , una bavette ( tipo linguine ) pegaso con gamberi calamari pesce spada e saltati nei pomodori pachino , un pesce [SEP] spada [SEP] ed una scaloppina , 2 coca da 33 , un acqua da un litro e mezzo , mezzo vino della casa pagando 17 euro ciascuno .
itwac	" Chrysale aveva teso la mano verso di lui , e il chierico si affrettò a porgergli la lunga [SEP] spada [SEP] dall' elsa cesellata .
itwac	Anche allora la cerva , fingendosi timorosa , gli chiese d' entrare , pregandolo di legare i cani e il cavallo , di rompere l' arco , di spuntare le frecce e di chiudere la lama della [SEP] spada [SEP] .
itwac	Per quanto riguarda il microinfusore si sono confrontati Andrea ( 16 anni ) e Enrico ( 14 anni ) , portatori di microinfusore pentiti e che ormai lo hanno abbandonato , che ricoprivano il ruolo dell' accusa da una parte , e Jacopo ( 16 anni ) e Angelo ( 17 anni ) dall' altra a difendere a [SEP] spada [SEP] tratta il microinfusore e a decantare le mirabolanti qualità di una terapia siffatta , che meglio di tutte le altre si avvicina alla secrezione fisiologica di insulina , e che permette di ottenere un controllo metabolico pressoché perfetto .
itwac	25 Daniele rispose : " Io adoro il Signore mio Dio , perché egli è il Dio vivente ; se tu me lo permetti , o re , io , senza [SEP] spada [SEP] e senza bastone , ucciderò il drago " .
itwac	Kaleb era riuscito a rotolare fuori portata , alzarsi e estrarre la [SEP] spada [SEP] ed ora osservava inebetito quella mostruosa creatura alta due metri che lo guardava sogghignando .
itwac	[ 17 ] Grida e lamèntati , o figlio dell' uomo , perché essa pesa sul mio popolo , su tutti i prìncipi d' Israele : essi cadranno di [SEP] spada [SEP] insieme con il mio popolo .
itwac	Oltre alle armi bianche ( [SEP] spada [SEP] e sciabole ) è possibile utilizzare anche dei poteri magici donati , man mano che si prosegue , dai vari Dei dell' Olimpo , utilizzabili però solo quando la barra dell' indicatore di magia lo permette .
itwac	Una , Yu Shu Lien ( Michelle Yeoh ) , è l' allieva prediletta del maestro di [SEP] spada [SEP] Li Mu Bai ( Chow Yun-Fat ) .
itwac	Così deciso in Roma , nella camera di consiglio del 20 gennaio 2003 , presso la sede del Consiglio di Stato , Palazzo [SEP] Spada [SEP] , con l' intervento dei Signori : Alberto DE ROBERTO Presidente del Consiglio di Stato Mario Egidio SCHINAIA Presidente di Sezione Paolo SALVATORE Presidente di Sezione
itwac	Quindi il centro destra si rassegni e rifletta sul motto " Chi di spada ferisce , di [SEP] spada [SEP] perisce " .
itwac	Sul risultato di Delecour pesa la [SEP] spada [SEP] di Damocle della decisione della commissione d' appello cui si e' rivolta la Peugeot ( facendo automaticamente sospendere la decisione e il responso non arrivera' prima di un paio di settimane ) , ma resta il fatto che la casa del leone rampante e' stata la protagonista di una tappa avvincente , che ha dominato dall' inizio alla fine .
itwac	Perché la politica estera comune e la comune [SEP] spada [SEP] sono ancora tutte da costruire .
itwac	Quella che sembra essere l' unica riproduzione esistente della [SEP] spada [SEP] è in possesso di Chariza .
itwac	[ 4 ] Giònata si tolse il mantello che indossava e lo diede a Davide e vi aggiunse i suoi abiti , la sua [SEP] spada [SEP] , il suo arco e la cintura .
itwac	69 Napoli , 11 febbraio 2005 Ai Dirigenti Scolastici delle Istituzioni Scolastiche di Istruzione Secondaria di II grado della regione Campania LORO SEDI e p.c. al dott. Antonio Giunta La [SEP] Spada [SEP] Direttore Generale per gli Affari Internazionali dell' Istruzione Scolastica MIUR - Roma Oggetto : Programma Operativo Nazionale 2000 - 2006 " La scuola per lo sviluppo " - Bando di concorso " Progetti in onda " - produzione di video sul tema " La Scuola per lo sviluppo " Si comunica alle SS.LL. che il Direttore Generale per gli Affari Internazionali dell' Istruzione Scolastica con nota prot .
itwac	Ma quando stavamo per salutarci e prima di salire sull' auto in affitto che lo avrebbe condotto nuovamente a Madrid , mi diede una medaglietta dell' Ordine di San Tiago della [SEP] Spada [SEP] ( ...
itwac	Non può mancare inoltre l' assalto al castello , un classico delle avventure medievali , dove vengono messe in scena spettacolari ma innocue tecniche di attacco e di difesa : sassi e [SEP] spade [SEP] in gommapiuma e pece " bollente " , ma anche tante tattiche di astuzia per individuare i punti deboli del " nemico " e della fortezza .
itwac	10 Allora la comunità vi mandò dodicimila uomini dei più valorosi e ordinò : " Andate e passate a fil di [SEP] spada [SEP] gli abitanti di Iabes di Gàlaad , comprese le donne e i bambini .
itwac	Alcuni fedelissimi guerrieri si lanciarono contro di lei con le [SEP] spade [SEP] sguainate che sembravano fatte di alme ardenti , ma Chariza strinse la mano sull' elsa di Kageboshi e disegnò tre archi di fronte e a fianco a sé colpendo quegli uomini che caddero a terra insozzando l' erba di rosso .
itwac	Mano e [SEP] spada [SEP] rappresentano la differenza sessuale tra chi è il fallo e chi in realtà lo gestisce .
itwac	Mosca e Pechino potranno quindi continuare nella loro difesa a [SEP] spada [SEP] tratta di Khartoum , con cui i due membri permanenti del Consiglio intrattengono ottimi rapporti commerciali .
itwac	Quello originale gli era stato disintegrato dal contatto con la magica [SEP] spada [SEP] di InuYasha , Tessaiga , ma ora ha capito che , munendosi di un arto umano , può brandire la favolosa arma .
itwac	CAPITOLO 20 : LE PRIGIONI DELLA CITTA' DI PIETRA Se tu riuscissi a trovare tutte le fate nascoste in questa zona verresti ricompensato con la [SEP] Spada [SEP] delle Fate , ma ti assicuriamo che è quasi impossibile .
itwac	Le [SEP] Spade [SEP] di Lankhmar è il primo libro del ciclo di Fafhrd e Gray Mouser , due eroi o forse antieroi della letteratura fantasy .
itwac	la ragazza nota che la persona ha una [SEP] spada [SEP] , e così la sguaina ...
itwac	Sesshoumaru appare dietro a Naraku e lo lacera con Toukijin , ma Naraku respinge l' onda di Sesshoumaru rendendo inutilizzzabile la sua [SEP] spada [SEP] .
itwac	Con qualche novità Maurizio Fanciullacci Nel segno di Leonardo Dalle abili mani di un artigiano campigiano rinascono i modelli del genio di Vinci Una mostra permanente in piazza Signoria Debora Pellegrinotti La [SEP] spada [SEP] nella roccia Da re Artù a San Galgano : due storie tra leggenda e religione Riccardo Gatteschi Salute Sangue amaro Troppa insulina nel sangue dopo mangiato .
itwac	Il combattimento corpo a corpo - comprendente l' uso delle mani e delle armi " bianche " ( bastoni , mazze , [SEP] spade [SEP] , etc. ) - viene svolto mediante l' uso di una prova di Forza .
itwac	; - D Orsu dunque , non mostrar timore , non vile manifestar devi , non tremar ma il nemico affronta e torna vittorioso a [SEP] spada [SEP] tratta ...
itwac	Devono essere guerrieri kage  pensò Chariza , respingendo un' altra cascata di coltelli da lancio con la sua [SEP] spada [SEP] .
itwac	Se morissi questa notte - Idea Vilariño Se morissi questa notte se potessi morire se io morissi se questo coito feroce interminabile combattuto e senza clemenza raggiungesse il suo apice e si afflosciasse se proprio adesso se adesso morissi socchiudendo gli occhi sentissi che è fatta che ormai l' affanno è cessato e la luce non fosse più un fascio di [SEP] spade [SEP] e l' aria non fosse più un fascio di spade e il dolore degli altri e l' amore e vivere e tutto non fosse un fascio di spade e finisse con me per me per sempre e che non dolesse più e che non dolesse più
itwac	La [SEP] spada [SEP] , la cappa , il cappello : subito .
itwac	8 Avete paura della spada e io manderò la [SEP] spada [SEP] contro di voi , dice il Signore Dio !
itwac	Ciao dryflower per giorgio vorrei essere piu chiaro , i pesci [SEP] spada [SEP] adulti sono cacciatori diurni , cacciano nelle ore diurne sul fondo ciubandosi di pesci demersali , mentre si porta all largo e in acque superficiali la notte , in sintesi lo spada deve periodicamente portarsi in superfice per riprendersi dallo stres subito cacciando in profondita a temperature inferiori ai 6 g per poter facilitare la digestione , ifatti analizzandoil contenutostomacale di 126 individui l osservazione a portato a riconoscere di 4 femiglie di crostacei con prevalenza di cefalopodi , in maggioranza daommastrefidi e cranchi , un saluto Ricky Escaviva Non so dove peschi tu lo spada ma nelle acque ponzesi si prende sui salti della batimetrica dei 200 e 300 metri .
itwac	La stanchezza e la sofferenza la costringono ora in ginocchio , ma le mani stringono ancora la [SEP] spada [SEP] e l' arcana luce che ne scaturisce illumina il volto di lei .
itwac	- esclama Xena , con la [SEP] spada [SEP] già sguainata - ...
itwac	Tutta questa moltitudine saprà che il Signore non salva per mezzo della [SEP] spada [SEP] o della lancia , perché il Signore è arbitro della lotta e vi metterà certo nelle nostre mani " .
itwac	Il pesce [SEP] spada [SEP] ( Xiphias gladius ) che si può trovare con facilita anche a 300 metri di profondità , adotta un piccolo stratagemma per individuare le sue prede : mantiene la temperatura degli occhi e del cervello tra i 19 e i 28 gradi - contrapposti ai circa 3 gradi della temperatura esterna - in modo da migliorare di dieci volte la sua capacità di vedere i piccoli pesci veloci .
itwac	La rapidità non doveva essere una delle abilità degli spadaccini Sciri poiché quelle [SEP] spade [SEP] erano pesanti e più adatte a fendenti decisi , dovevano servire a dare la morte a nemici ormai straziati , piuttosto che a un combattimento uno contro uno .
itwac	                 Io sono la [SEP] spada [SEP] nelle tenebre .
itwac	Il Custode , leggermente sconcertato , appoggiò la punta della [SEP] spada [SEP] bastarda a terra .
itwac	grazie alle due [SEP] spade [SEP] si possono attaccare parti opposte del corpo nello stesso momento mandando in confusione l' avversario finendolo con un doppio colpo a X sulla faccia .
itwac	Il periodo migliore sarebbe a luglio , anche se a maggio , comunque , qualche [SEP] spada [SEP] ci dovrebbe essere .
itwac	** The SWORDMAN ** , sa sempre dove mettere la [SEP] spada [SEP] senza ferire .
itwac	L' ambiente mistico del fantasy , particolari che richiamano atmosfere medievali , fatte di [SEP] spade [SEP] , cavalieri , draghi e principesse rapite .
itwac	Conquista delle città meridionali di Canaan 28 Giosuè in quel giorno si impadronì di Makkeda , la passò a fil di [SEP] spada [SEP] con il suo re , votò allo sterminio loro e ogni essere vivente che era in essa , non lasciò un superstite e trattò il re di Makkeda come aveva trattato il re di Gerico .
itwac	Ho comunque fatto bene perche' avevo calato una attrezzatura leggera e se ferravo uno [SEP] spada [SEP] credo l' avrei perso .
itwac	Pertanto anche l' ispirazione non è da ricondursi ad un folclorico richiamo alla nobiltà bretone : la [SEP] spada [SEP] di San Galgano era già lì , a testimonianza forse di un miracolo , e di certo di un mistero .
itwac	Lithain sguainò la sua lunga [SEP] spada [SEP] e spinse la porta .
itwac	Abbondante e molto sapido lo [SEP] spada [SEP] viene contrastato degnamente dal tortino appena un po' troppo esiguo .
itwac	Sopra a Tyrannide si librano ancora tre malefiche donne : Avaritia , di nuovo una vecchia con le ali di pipistrello , le mani uncinate che serrano un torchio da cui fuoriescono sacchi di monete ; Superbia con la [SEP] spada [SEP] sguainata e il giogo tutto di sghimbescio , perché non c' è pace né concordia nel prevalere dell' interesse privato del singolo sul bene della comunità ; infine Vanagloria , una donna intenta a specchiarsi , un vizio Da notare il cambiamento di registro linguistico non appena si passa da una generica allegoria alla concreta realtà cittadina , segnata  come ci ricordano le cronache , durante il tempo in cui fu commissionato l' affresco  da carestie , morie e continue insurrezioni ; infatti il Si e il No fanno appello alla lingua e alla comune esperienza degli spettatori ; Guerra e non Bellum è scritto sullo scudo del soldato chiuso nella sua armatura .
itwac	Il Custode , leggermente sconcertato , appoggiò la punta della [SEP] spada [SEP] bastarda a terra .
itwac	Complimenti a Lucia che conosco di vista e a Mady che difende a [SEP] spada [SEP] tratta tutti i suoi protetti ...
itwac	to IL DIRETTORE GENERALE REGGENTE Antonio Giunta La [SEP] Spada [SEP] Istruzioni per la compilazione dell' autocertificazione FESR
itwac	La [SEP] spada [SEP] !
itwac	Della [SEP] spada [SEP] di questi non restava che una polvere scura e maleodorante , che andava depositandosi a terra .
itwac	Chariza si guardò attorno scrutando l' erba in cerca di un segnale , istintivamente sfoderò la [SEP] spada [SEP] ; Tumet accorciò le redini e le strinse nella mano sinistra , mentre per non essere sbalzata di sella avvolgeva il costata della sua cavalla che si impennava , e si voltò a fissare Chariza con sguardo deciso annuendo , in pochi istanti anche la sua lama fu pronta e un attimo dopo dall' erba della prateria emergevano , come demoni sputati fuori dall' inferno , guerrieri in armature scure che urlando balzarono sui cacciatori aggredendoli con spade e pugnali e tentando di trascinarli giù dai loro pony .
itwac	Dai tuoi commenti sembra che nei Live fantasy tu abbia incontrato solo fanatici che non vedono solo l' ora di poter spaccare la [SEP] spada [SEP] in testa a qualcuno .
itwac	La speranza di riuscire a fornire agli storici elementi certi su cui sviluppare nuove indagini è molto forte , dall' individuazione dell' area di provenienza del metallo con cui è stata forgiata la [SEP] spada [SEP] , alla sua effettiva dimensione , compresa la parte nascosta alla vista , dall' esame del suolo sottostante alla roccia alla datazione del manufatto , ogni dato scientificamente confermato potrà aprire nuove e impreviste strade , oltre che per la soluzione del mistero della spada nella roccia , soprattutto per un più sicuro inquadramento della figura storica di san Galgano , che nulla toglierà comunque al fascino della sua leggenda e alla magia delle sue testimonianze .
itwac	Allargò i piedi per avere maggior stabilità , controllò che non fosse rimasto nessuno nel raggio d' azione della sua spada , sciolse i muscoli del collo muovendo la testa a destra e a sinistra , poi sfoderò Kageboshi con sibilo minaccioso e la portò nella mano sinistra , fendette l' aria per abituarsi al peso della [SEP] spada [SEP] nella mano poco abituata ad impugnarla e sospirò .
itwac	Altre armi che utilizzerete sono ad esmpio la mazza da baseball , la motosega , la katana ( [SEP] spada [SEP] dei samurai ) , il Ruger , l' AK 47 , l' UZI , il fucile di precisione , il lanciarazzi , il tirapugni , le molotov , le granate , la mazza da golf , ecc ...
itwac	Tali difficoltà riguardano in particolare questi aspetti : 1 ) Lo spada si alimenta quasi esclusivamente di notte su batimetriche poste nelle immediate vicinanze di secche , banchi o cadute repentine di fondale ben oltre i 100 metri ; 2 ) Si sposta di frequente sia in orizzontale che in verticale , seguendo i movimenti dei branchi di cefalopodi e le variazioni di temperatura ; 3 ) E' un pesce estremamente " preciso " nell' entrare in maggiore o minore attività in concomitanza delle diverse fasi di bassa ed alta marea e nei periodi di riproduzione ; 4 ) Lo [SEP] spada [SEP] è un predatore dotato di sensibilità superiore , per cui risulta molto ostico ed estremamente sospettoso nell' approccio e nella mangiata dell' esca ; 5 ) Ha un apparato boccale soffice , per cui se non si adoperano ami e tarature di frizione adatti si perde facilmente ; 6 ) A parità di peso è almeno due volte più forte e tenace nel combattimento rispetto a qualsiasi altro pesce sportivo .
itwac	L' ottenne ad un patto : la consegna della spada , sulla quale la Gabrielli fece incidere " [SEP] Spada [SEP] dell' Ambasciatore di Francia che osò vibrarla contro Caterina Gabrielli " .
itwac	Iscrizione : Euro 1.00 Premio : attestato calligrafato del " Primo torneo di [SEP] spada [SEP] Eldalie " ralizzato da Erumer .
itwac	17 Egli prenderà per armatura il suo zelo e armerà il creato per castigare i nemici ; 18 indosserà la giustizia come corazza e si metterà come elmo un giudizio infallibile ; 19 prenderà come scudo una santità inespugnabile ; 20 affilerà la sua collera inesorabile come [SEP] spada [SEP] e il mondo combatterà con lui contro gli insensati .
itwac	81 Ella avea fatto nel palazzo inanti [SEP] spade [SEP] e lance arrecar , corazze e scudi , onde armar si potessero i mercanti e i galeotti ch ' eran mezzo nudi .
itwac	La loro [SEP] spada [SEP] entrerà nel loro cuore .
itwac	" In quello stesso momento Gesù disse alla folla : « Siete usciti come contro un brigante , con [SEP] spade [SEP] e bastoni , per catturarmi .
itwac	13 Quando il Signore tuo Dio l' avrà data nelle tue mani , ne colpirai a fil di [SEP] spada [SEP] tutti i maschi ; 14 ma le donne , i bambini , il bestiame e quanto sarà nella città , tutto il suo bottino , li prenderai come tua preda ; mangerai il bottino dei tuoi nemici , che il Signore tuo Dio ti avrà dato .
itwac	FORZA CANI - Backstage ( ore 16.15 ) Regia Marina [SEP] Spada [SEP] Italia , 2001 col .
itwac	^ ^ ^ Livello 2 4500 sfere anime più potenti ^ ^ ^ Livello 3 10000 sfere anime potentissime " [SEP] Spada [SEP] degli dei Viene usata solo nel duello finale e in nessun altra parte del gioco .
itwac	Parò il colpo sollevando la [SEP] spada [SEP] , con un rapido gesto del polso disarmò Yukai facendo volare la sua arma lontano .
itwac	Io uso la mia [SEP] spada [SEP] miete anch' essa le sue vittime » rispose Diaroth .
itwac	Il vecchio pallone d' Oro Nedved che incrocia la [SEP] spada [SEP] con il nuovo Shevchenko .
itwac	Il pesce piu' grande che ti puo' capitare trainando e' ovviamente il tonno rosso , l' aguglia imperiale ed il pesce [SEP] spada [SEP] .
itwac	Era morto neanche quindicenne , dopo aver appena imparato a maneggiare una [SEP] spada [SEP] .
itwac	" Non ho mai brandito una [SEP] spada [SEP] così pesante " Gatsu , Berserk " Ognuno deve decidere cosa fare con il tempo che gli viene concesso " Gandalf , Il signore degli Anelli
itwac	Il ritmo del film si snoda senza scossoni mantenendo un clima di tensione e attesa che accompagna lo spettatore per oltre due ore durante le quali si registrano solo pochissimi passi falsi ( il bambino che estrae la [SEP] spada [SEP] dalla " roccia " era davvero necessario ?
itwac	Perchè tutti quelli che usano la [SEP] spada [SEP] moriranno di spada " ( Mt 27,51 - 52 ) " Pace a voi !
itwac	Chrysale crollò ancora a terra , ma Arjuse fu subito al suo fianco , un braccio intorno al suo petto per sostenerlo , la mano sulla sua mano , ad impugnare la [SEP] spada [SEP] .
itwac	Volevamo vedere di innescare un paio di canne per lo [SEP] spada [SEP] , poi , vediamo come butta !! male che vada staimo comunque in pesca per tutto il resto !
itwac	Ed è ora che si accorgono che Golaud li spia , nascosto dietro un albero , con la [SEP] spada [SEP] in mano .
itwac	Sarebbe altrettanto disdicevole mettere in orbita ordigni nucleari , chimici e biologici , riprogrammabili e pronti all' uso come altrettante [SEP] spade [SEP] di Damocle .
itwac	La [SEP] spada [SEP] di Ash era rimasta imprigionata nell' armatura del Guardiano , e lui si tirò a fatica vicino al corpo irriconoscibile di Cael McFada , lasciando una scia di sangue dalla mano ferita .
itwac	52 Allora Gesù gli disse : " Rimetti la spada nel fodero , perché tutti quelli che mettono mano alla spada periranno di [SEP] spada [SEP] .
itwac	Io stesa prenderò la [SEP] spada [SEP] che fu di mio padre e dei miei cari fratelli defunti e combatterò contro chiunque osi vantare dei diritti sulla mia gente .
itwac	Quindi l' unico modo era stringere in pugno la [SEP] spada [SEP] .
itwac	E Craxi aveva promesso di ripulire il partito non con la scopa , bensì con la [SEP] spada [SEP] .
itwac	Inoltre ha deciso di dare lezioni gratuite per il primo mese a tutti i giovani che vogliono provare a cimentarsi con fioretti e [SEP] spade [SEP] , magari sognando ad occhi aperti di imitare D' Artagnan , Zorro o più realisticamente la Trillini , la Vezzali o Puccini , il nuovo formidabile campione Olimpico .
itwac	lei doveva consegnare a me la [SEP] spada [SEP] e restarmi accanto per ubbidire al mio volere .
itwac	I cavalieri Ryokin invece si erano portati tutti attorno al principe e al cavallo dell' Imperatore e con le loro [SEP] spade [SEP] cercavano di deviare il percorso delle frecce che continuavano a piovere dagli alberi lungo la strada , mentre altri avevano imbracciato a loro volta gli archi per cercare di colpire il nemico così ben mimetizzato nella vegetazione .
itwac	In Galleon potremo compiere tutti i movimenti caratteristici di Tomb Raider , infatti potremo arrampicarci , saltare e dondolarci sulle corde , inoltre Rhama potrà affrontare i suoi nemici con la sua fedele [SEP] spada [SEP] , con la quale potrà compiere una moltitudine di combo .
itwac	Amor mio , nell' ora più oscura sgrana il tuo sorriso , e se d' improvviso vedi che il mio sangue macchia le pietre della strada , ridi , perché il tuo riso sarà per le mie mani come una [SEP] spada [SEP] fresca .
itwac	Ma mi venne incontro al Giordano e gli giurai per il Signore : Non ti farò morire di [SEP] spada [SEP] .
itwac	Per quanto riguarda invece i latinismi possiamo portare come esempio il " brando " , ovvero la [SEP] spada [SEP] , al verso 27 , " l' alma Cipride " , verso 75 , che ci ricorda l' Alma Venus del proemio del Rerum Novarum di Lucrezio , cioè la Venere datrice di vita , oppure anche la natura " egra " del verso 104 .
itwac	Ma eccolo ora suddito di Filippo Visconti , sposo della figlia di lui , circondato da cortigiani invidiosi che gli tessono insidie : a lui , avvezzo a sciogliere i nodi con la [SEP] spada [SEP] , inconscio degli intrighi di corte .
itwac	quelli che gli prestano attenzione sono i poveri [ ebionim ] del gregge , questi saranno risparmiati nell' epoca della visita , mentre i restanti saranno dati alla [SEP] spada [SEP] , quando verrà il Messia di Aronne e di Israele ...
itwac	zza [SEP] Spada [SEP] , 5 tel. 0775 505 973 chiuso : giovedì orario : estate 08.30 - 15.00/17.30 - 23.00 inverno 8.30 - 14.00/16.00 - 20.00 .
itwac	L' Esperienza è la Vita con le ali - Paulo Cohelo ^ Top Shirl Hobbit Registrato : 03 - 05 - 2004 15:44 Messaggi : 37 Località : Roma Inviato : Dom 23 Gen 2005 16:07 pm Oggetto : Da buon appassionata della Bradley , mi permetto di aggiungere : Naufragio sulla terra di Darkover L' alba di Darkover ( antologia ) La Signora delle Tempeste Thunderlord ( non ancora pubblicato ) * Fall of Neskaya ( prossima uscita , iniziata la traduzione per Longanesi a cura di Maria Cristina Pietri ) * Zandru 's forge * A flame in Hali * = facenti parte della trilogia Clingfire Trilogy La Donna del Falco Gli Eredi di Hammerfell Il Sapiente di Darkover I cento regni di Darkover ( Antologia ) La riscoperta di Darkover La catena spezzata La [SEP] spada [SEP] incantata La torre proibita I regni di Darkover La città della magia Ritorno a Darkover Il signore di Storn I signori di Darkover ( antologia ) L' esiliato di Darkover L' erede di Hastur Le Foreste di Darkover La Spada di Aldones L' esilio di Sharra Reluctant King ( Non ancora pubblicato ) Il ribelle di Thendara Darkover e l' impero ( Antologia ) La sfida degli Alton La Matrice Ombra Attacco a Darkover Children of Kings ( Gli amministratori di MZB assicurano che l' opera , talmente lunga da dover essere divisa in 2 parti , verrà pubblicata al più presto in America .
itwac	Ruppi una [SEP] spada [SEP] e rischiai di ferire il pubblico , tutto ok per fortuna .
itwac	E' in continuo vagabondaggio per l' intero Giappone , e con se' porta una [SEP] spada [SEP] a lama invertita che se usata come una spada normale non è in grado di tagliare nulla .
itwac	E' un esca eccezionale per lo [SEP] spada [SEP] , magari si può usare anche per la ricciola ...
itwac	La nonviolenza , naturalmente , era inscritta nel codice genetico del cristianesimo ( " chi di spada ferisce , di [SEP] spada [SEP] perisce " ) , ma ben presto era stata dimenticata in nome della " guerra giusta " : in quegli anni , poi , i vescovi e tutto il clero erano ben disposti a sorvolare sulla critica alla violenza , qualora quest' ultima venisse " dalla parte giusta " , quella istituzionale ( qualche anno dopo , l' aggressione all' Etiopia e la collaborazione con Franco sarebbero state benedette dai parroci ) .
itwac	Tortino di alici alla beccafico , pesce bandiera macerato , arancino di mare ( con seppie , calamari e polpo ) , timballo di mezzanelli con seppie , melanzane e zucchine ; pasta fresca con la genovese di finocchi e pesce [SEP] spada [SEP] , spaghettoni con polpa di ricci e bottarga , TVB cioè tonno-vuole-bufala ( due filetti sullo stesso piatto , uno di tonno e uno di mozzarella ) , coniglio disossato all' arancia , tazza di cioccolato e ricotta , pesca nell' Aglianico ( una rivisitazione del tipico vino con le " percoche " ) , sorbetti e gelati del giorno ( fragole , rosmarino e pepe , cioccolato e ginger ecc. ) .
itwac	Fantasmi e [SEP] spade [SEP] , baleni e spettri Prendi le misure opportune - come un esperto lottatore - per non agitarti , anche se vedi d' un tratto un fantasma ; per non turbarti , anche se vedi una spada brandita contro di te o un guizzo luminoso che ti colpisce al volto ; per non perderti assolutamente d' animo , anche se vedi una figura laida e sanguinolenta .
