corpus	sentence
itwac	124 La fama che la vostra casa onora , grida i segnori e grida la contrada , sì che ne sa chi non vi fu ancora ; 127 e io vi giuro , s' io di sopra vada , che vostra gente onrata non si sfregia del pregio de la borsa e de la [SEP] spada [SEP] .
itwac	Il pesce tipo " filetto di pesce [SEP] spada [SEP] " era buono , il resto ...
itwac	Allo stesso modo , Iano era stato attratto da Clotilde e dai suoi occhi che erano un' estensione della sua [SEP] spada [SEP] , taglienti come le lastre di ghiaccio che negli inverni innevati di quei territori ricoprivano il suolo della steppa .
itwac	Il fatto che questo disegno abbia continuato ad aver fortuna per più di tre secoli fa sì oltretutto che i collezionisti possano allineare nelle loro vetrine oltre ai pezzi ancora in produzione quelli delle varie epoche , facilmente riconoscibili sia per il diverso tipo di insegna della manifattura ( da molto tempo il segno delle due [SEP] spade [SEP] incrociate ) sia per il modo di disegnare che rivela all' esperto la probabile datazione .
itwac	e tanto per cominciare uno sparo un semplice sparo a Sarajevo poi esplosioni in serie raffiche e sordi boati a poppavia e a Milano , Brescia , Bologna e sui treni squarciati giù nella stiva e c' è chi giura d' averne visto uno di ferroviere volare fuori dalle finestre del salone spinto in mare da un pulotto col cognome da terrone e c' è chi giura d' aver visto quello stesso pulotto ucciso dal fuoco amico di sbarramento d' insabbiamento e trincee sul Grappa sin sulla cima innevata dell' albero maestro e ad Anzio e ad Ostia a Napoli e tanto per proseguire coi cavalli lanciati alla carica sul ponte di terza la tromba di Bava Beccaris che squilla repressione e Tambroni dalla sala radio dirige le ondate dei celerini che spazzano il quadrato fin sotto a Valle Giulia calpestando Alice i suoi specchi e il walk-man e ustascia cetnici che corrono nei corridoi a caccia di scalpi indiani di scalpi metropolitani da offrire poi in sacrificio a questo secolo così breve da stare tutto in una poesia tanto breve da mozzare lì il millennio tanto breve da stare tutto in un solo gulag « C' è chi mi trova [SEP] spada [SEP] qualcuno Invece la flangia e la rotaia ; fiamma Zanna , o flutto » la Morte batte sul tamburo e le tempeste strombazzano la sua fama .
itwac	nomade domenica 3 agosto 2003 , 23:38 L' indignazione cresce , certo , se a togliere l' ultima barriera è quella Chiesa che invece dovrebbe difendere a [SEP] spada [SEP] tratta la creazione di Dio mio caro Guyton , da che mondo e' mondo e da che tempo e' tempo , la chiesa porta lo stendardo della distruzione e dell' appiatimento .
itwac	Ai due lati dei raggi di questa cometa si vedeva un gran numero di mannaie , coltelli , [SEP] spade [SEP] macchiate di sangue tra le quali c' era un gran numero di facce umane orribili , con le barbe e i capelli irti " .
itwac	Da vari testi paralleli risulta chiaramente che " la spada affilata " è una metafora della Parola di Dio [ cfr. Is 49,2 : ha reso la mia bocca come [SEP] spada [SEP] affilata ; Os 6,2 : per questo li ho colpiti per mezzo dei profeti , li ho uccisi con le parole della mia bocca ; Sap 18,15 : la tua parola onnipotente dal cielo , dal tuo trono regale , guerriero implacabile , si lanciò in mezzo a quella terra di sterminio , portando , come spada affilata , il tuo ordine inesorabile ; 2 Tess 2,8 : e il Signore Gesù lo distruggerà con il soffio della sua bocca ; Eb 4,12 : la parola di Dio è viva , efficace , e più tagliente di ogni spada a doppio taglio : essa penetra fino al punto di divisione dell' anima e dello spirito , delle giunture e delle midolla e scruta i sentimenti e i pensieri del cuore ] .
itwac	Ma questo " Carlo Magno " di internet ( o cavalloweb , in questo caso ) si fa chiamare key , è teutonico , monta un maremmano andaluso o forse arabo che pare Varenne e , ricevuta l' investitura , indossati gli stivali , sguainata la [SEP] spada [SEP] , controllate le selle , le corazze , gli scudi , a bordo dei suoi velocipedi equestri arabi , frisoni , normanni , andalusi o maremmani d' allevamento bedesco , guida - nella sua personale crociata - gli affiliati e la cavalleria : ordini di butteri nei loro costumi e paladini contro il feudalesimo medievale e costantiniano .
itwac	Magari ti è venuta fuori una [SEP] spada [SEP] un po' da parata piu che da battaglia , ma è molto bella ...
itwac	" : a partire dall' arco trionfale troviamo sulla destra l' apostolo Pietro con le chiavi , Giacomo il minore con la [SEP] spada [SEP] ( decapitato ) , Tommaso con la squadra ( architetto di chiese ) , Filippo con la croce , Matteo tra due libroni del Vangelo , Simone lo zelota con la sega .
itwac	Segnala questo Post ai Moderatori | IP : Logged 05 - 02 - 2003 23:45 Lithium Viandante Registrazione : Jun 2001 Città : Sfigalandia Posts : 777 Dèvìn ripose con lentezza la [SEP] spada [SEP] , ubbidendo alle guardie che urlavano contro il gruppo .
itwac	Edhelwen dovette trattenersi dallo sfilare la [SEP] spada [SEP] dal fodero ed affondarla nel collo taurino dell' uomo - Anche se fosse !
itwac	Il clan Hayabusa ha trovato il modo di forgiare un arma micidiale , direttamente dalle ossa di un drago : la [SEP] Spada [SEP] del Drago .
itwac	I fabbri maniaghesi sin dalla seconda metà del 1400 hanno coltivato e perfezionato un' abilità particolare nel forgiare il metallo , dando forma a coltelli , utensili per contadini e boscaioli , nonché [SEP] spade [SEP] ed altre armi per le truppe della Serenissima Repubblica di Venezia .
itwac	e adesso i fantasmi sono in giro in vestaglia Spüden la brögna e majen la giànda Sputano la prugna , mangiano il nòcciolo tiren fö un fulcèn che l' è un punto de dumanda , tirano fuori un falcetto che è un punto di domanda pensiunaa cun scià la spada cume Napulèon pensionati con la [SEP] spada [SEP] come Napoleone quaand che vann in posta a ritirà la pensiòn , quando vanno in posta a ritirare la pensione , suldaa che spècen i Marziani in müdanda , soldati che aspettano i marziani in mutande Profeti che i crumpen la Bibbia alla Standa ...
itwac	[SEP] spada [SEP] ; fr .
itwac	Come quella della [SEP] spada [SEP] di San Venceslao che si dice sia infissa nella muratura del ponte di san Carlo .
itwac	Aveva fatto scivolare fuori da una manica un lungo pugnale , lo si sarebbe detto una [SEP] spada [SEP] corta spezzata poco sotto la punta , e minacciava il sovrano attendendo , come un cacciatore paziente , il momento di balzare sulla preda .
itwac	Se non avessi saputo tutto questo non l' avrei scelta né per convincere Shen-dao a restituire la [SEP] spada [SEP] , né per procurarmi il corpo perfetto .
itwac	O dimenticherò che sei il mio Imperatore e non esiterò a usare la [SEP] spada [SEP] contro di te .
itwac	Qui ci si difende a [SEP] spada [SEP] tratta dalle accuse di doping con l' ormone della crescita .
itwac	80 Due [SEP] spade [SEP] altre non so per prova elette ad esser ferme e solide e ben dure , ch ' a tre colpi di quei si fosser rette , ch ' erano fuor di tutte le misure : ma quelle fur di tempre sì perfette , per tante esperienze sì sicure , che ben poteano insieme riscontrarsi con mille colpi e più , senza spezzarsi .
itwac	Con il suo messaggio dichiaratamente pacifista ( l' obiettivo finale del guerriero è di abbandonare la [SEP] spada [SEP] e portare al mondo la pace ) , Hero segna davvero il culmine della ricerca artistica ed espressiva di Zhang Yimou e le conferisce un singolare andamento chiasmico : dalla messa a fuoco di personaggi ribelli di fronte alle ingiurie della Storia e alle coercizioni della società , Zhang passa a celebrare personaggi che sacrificano se stessi a favore della collettività .
itwac	81 2 forchette rapporto q / p corretto Osteria a le Due [SEP] Spade [SEP] Trento via don A. Rizzi , 11 tel. 0461234343 chiuso lunedì a pranzo e domenica ferie 20 - 7/5 - 8 prezzo 66 euro vini escl .
itwac	Era difficile per Nezumi attaccare poiché vedeva solo l' arma e non la guerriera che la manovrava , quindi non faceva che menare colpi sconnessi alla [SEP] spada [SEP] , forse timoroso di colpire lo spirito della tigre .
itwac	Troy di Wolfgang Petersen con : Brad Pitt e Eric Bana Brad Pitt brandisce la [SEP] spada [SEP] conferendo un tono vigoroso e riflessivo al personaggio del guerriero greco Achille , in questa spettacolare rivisitazione dell' Iliade .
itwac	Anche Yukai li evitò proteggendosi con la [SEP] spada [SEP] , ma non potè sfuggire alla catena che uscì all' improvviso dal flusso nero dei guerrieri in corsa .
itwac	Il Circolo di Spada Eldalië Siamo lieti di annunciarvi che è stato costituito il " Circolo di spada Eldalië " , che è ora a tutti gli effetti una Gilda di Eldalië e il cui primo torneo si è tenuto in occasione dell' incontro Eldalië di Marina di Pisa : www.eldalie.it/forum/list = 5165 Il circolo si occuperà di tornei con [SEP] spade [SEP] cortesi [ agli incontri ] e , in forum e in sezioni apposite del sito , di discussioni su scherma medievale , tecniche orientali , tecniche filmiche , ecc. I materiali verranno divisi in sezioni , discussi , e non si esclude che in occasione di qualche incontro queste varie tecniche possano venir mostrate in pubblico .
itwac	Libera pensieri malfidi e voragini di dubbio che muovono intrattenibili mani , versano veleni , sfoderano [SEP] spade [SEP] , annegano la diafana , obbediente Ofelia .
itwac	E di fronte al disinteresse e agli sbagli dei potenti della Terra , incapaci di porre rimedio alla tragedia dei " trafitti dalla [SEP] spada [SEP] " e all' " orrore della fame " , ammoniva richiamando " il silenzio di Dio , che non si rivela più e sembra essersi rinchiuso nel suo cielo , quasi disgustato dell' agire dell' umanità " .
itwac	La cerimonia ufficiale comprendeva , oltre le solite imponenti parate militari , una messa celebrata sul campo dal vescovo Talleyrand ( che si divertiva molto tanto da pregare l' abate Louis di non farlo ridere ) ; una esibizione di La Fayette a cavallo che , con la [SEP] spada [SEP] sguainata , giura fedelta' a questo ed a quello , tra le deliranti acclamazioni dei suoi mouchards .
itwac	Nessuna nazione alzerà la [SEP] spada [SEP] contro un' altra nazione e non impareranno più l' arte della guerra .
itwac	lo [SEP] spada [SEP] è il mio sogno nel cassetto , incostantemente seguito da 10 anni .
itwac	La [SEP] spada [SEP] di Prato Pagano di bronzo è stata scoperta nell' inverno 1847 - 48 a Bernate .
itwac	Grande novità riguardante gli indumenti è la possibilità di incastonarvi delle pietre preziose : infatti scudi , [SEP] spade [SEP] e armature ( rigorosamente provviste di incavi e per questo segnalate col colore grigio ) non ancora dotate di qualità magiche potranno essere combinate con topazi , smeraldi , diamanti , ametiste , teschi e quant ' altro .
itwac	Poi liberò Ganku dalle corde e gli procurò una [SEP] spada [SEP] .
itwac	Era eletto dal Capitolo di Aquileia e riceveva poi l' investitura dal papa , di solito ad Aquileia , ma veniva insediato , come principe , dall' imperatore o da un suo rappresentante a Cividale , quando , seduto sul trono marmoreo , al centro dell' abside del duomo , riceveva una [SEP] spada [SEP] sguainata che egli rimetteva nel fodero .
itwac	Luigi 09 - 01 - 2005 18:10 Posted by : luigi festa della toscana 2004 Provincia di Grosseto Ente Aree Istituzionali Aree Territoriali Home | Mappa | Contatti | Notizie | Cerca Iscriviti alla news-letter W 3 C HTML 4.01 W 3 C CSS Homepage Area Istituzionale Ente La Provincia è Il Consiglio provinciale La Festa della Toscana Festa della Toscana 2004 La Festa della Toscana 2004 è dedicata alla pace e alla guerra vista con gli occhi dei bambini Il programma delle iniziative promosse dalla Provincia di Grosseto Giovedì 25 novembre Ore 17 - Esposizione dei disegni realizzati dagli alunni di alcune scuole elementari della città di Grosseto , in collaborazione con le associazioni interessate e sulla traccia del versetto biblico : " Delle loro spade fabbricheranno vomeri , delle loro lance roncole , una nazione non leverà più la [SEP] spada [SEP] contro l' altra e non impareranno più la guerra " .
itwac	Tutti i discepoli del Drago Bianco , infatti , sostenevano una prova per ottenere quella che sarebbe divenuta la loro arma , ma mai nessuno prima di lei era stato mandato sulla montagna con la promessa di ottenere la [SEP] spada [SEP] del Maestro .
itwac	Davide era stanco [ 16 ] e Isbi-Benòb , uno dei figli di Rafa , che aveva una lancia del peso di trecento sicli di rame ed era cinto di una [SEP] spada [SEP] nuova , manifestò il proposito di uccidere Davide ; [ 17 ] ma Abisài , figlio di Zeruià , venne in aiuto al re , colpì il Filisteo e lo uccise .
itwac	Una ragazza che non poteva avere più di diciotto - diciannove anni stava avanzando tra i tavoli cercando di mostrarsi sicura , indossava una tunica e pantaloni neri , sul petto il drago dorato si alzava e si abbassava seguendo il ritmo del suo respiro , in vita una fascia bianca bordata d' oro e infilata al fianco una lunga [SEP] spada [SEP] dal fodero di metallo , con l' elsa semplice , avvolta in strisce di cuoio scuro , il fodero non presentava alcuna decorazione , benché fosse laccato di nero ; la lama era leggermente ricurva , a giudicare dalla forma del fodero .
itwac	Non perdevano l' occasione quei signori per scambi di fioretto , di [SEP] spada [SEP] e di randello uno contro l' altro se ne avevano l' occasione pubblica .
itwac	Porto sempre con me la mia fedele [SEP] spada [SEP] Darshlee , fabbricata nelle fucine elfiche e mi prendo cura di lei come se fosse un essere umano !
itwac	Ama Goi Ken Corta [SEP] spada [SEP] giapponese con lama di circa 33 cm a doppio tagliente in uso nei templi .
itwac	Penso che di [SEP] spada [SEP] ce ne siano più di quanto si immagini sopratutto in particolari zone .
itwac	Il tutto è frutto di un lavoro certosino : la preparazione affidata ad un maestro d' arme e le [SEP] spade [SEP] , gli elmi , gli scudi e le vesti risultato di ricerche storiche .
itwac	Ma la sabbia è anche la fatica immane di Modou , sotto la [SEP] spada [SEP] di Damocle dei controlli - Carlo Giorgi Terre di mezzo 104 , giugno 2003 Le vacanze speciali di immigrati e altri viaggiatori atipici Tutta un' altra estate La vacanza si chiama così perché di solito è un " vuoto " .
itwac	Gli stessi lettori , probabilmente , che poi le hanno difese a [SEP] spada [SEP] tratta quando si è passati alla versione successiva .
itwac	Le ampie lame delle [SEP] spade [SEP] celtiche potevano raggiungere anche il metro di lunghezza : armi davvero temibili .
itwac	La spada celtica ( Golasecca ) di Prato Pagano Ho avuto modo di vedere più volte Museo Archeologico di Como una [SEP] spada [SEP] particolarmente rara e preziosa , bellissima , di 3.000 anni fa !
itwac	Inoltre verrà presentata una nuova realtà milanese sportiva : Il Circolo della [SEP] Spada [SEP] M ° Marcello Lodetti che è il tributo doveroso alla figura di un grande maestro milanese che ancora in carriera oltre ad aver formato e " regalato " campioni su campioni alla sua città , è stato motore " morale " anche di gran parte delle iniziative che culminano in questa serata .
itwac	Oltre al mio [SEP] spada [SEP] ne ho avvistato un' altro , ho avvistato un branco di tonni in caccia in superfice , ho avvistao un banco di aguglie in volo con dietro il tonno , e poi ho visto tanti delfini , bellissima giornata .
itwac	( Palestrione si getta in mezzo a delle ragazze che sono al lato della scena ) Poi passa l' olio anche a questa [SEP] spada [SEP] , che troppo digiuno ha sopportato .
itwac	Consideriamo , ad esempio , la normativa sulla scuola , che tende a rivoluzionare il mondo della cultura ed a fornire al mondo della produzione giovani più preparati , o la riforma delle pensioni , che evita quella « [SEP] spada [SEP] di Damocle » di costi pubblici e privati che gravavano sul sistema .
itwac	In una storia con una struttura a base mitologica , in effetti , la presenza della [SEP] spada [SEP] non può non apparire perfettamente coerente e quanto mai opportuna .
itwac	Solite diffcoltà per un omicidio narra la storia di Nyx , amazzone guerriera che vaga in compagnia del fedele destriero e della mortifera sua [SEP] spada [SEP] , sempre pronta , attenta , vorace , violenta .
itwac	Cosa ne pensi dei SPEEDY LOCK della STONFO ?? [SEP] spada [SEP] mi spiace ma non li ho presente .
itwac	Mentre , anche nella nostra Provincia , l' evoluzione dell' economia e del lavoro è sempre più marcata dalla proliferazione delle micro imprese e del lavoro anomalo , un fenomeno che sotto l' aspetto quantitativo ha oramai superato i numeri del pubblico impiego : ignorare questo dato di fatto e pensare di poter sciogliere con la [SEP] spada [SEP] il nodo gordiano della complessità significa alimentare un' illusione di formale giustizia sociale lasciando inalterate le questioni di fondo e creando le condizioni per pasturare ulteriormente quel sottobosco precario e sommerso che già oggi sottrae alla contabilità nazionale 1 | 4 del reddito prodotto .
itwac	È dunque ottimo medico , ma nel corso degli anni si era fatto conoscere anche come un ottimo soldato ( era un ufficiale e ricevette la Croce di Ferro e la [SEP] spada [SEP] da ufficiale ) .
itwac	POLONIA : ABORTO , [SEP] SPADE [SEP] INCROCIATE TRA CLERO E ONU / ANSA VESCOVO CRACOVIA SI SCAGLIA CONTRO NAZIONI UNITE ( ANSA ) - VARSAVIA , 10 NOV - Spade incrociate a distanza tra il clero polacco e l' Onu sulla questione dell' aborto e sulla condizione femminile in Polonia .
itwac	Grande festa alla corte di Francia c' è nel regno una bimba in più biondi capelli e rosa di guance Oscar ti chiamerai tu Il buon padre voleva un maschietto ma ahimè sei nata tu nella culla ti ha messo il fioretto Lady dal fiocco blu Oh Lady Lady Lady Oscar tutti fanno festa quando passi tu Oh Lady Lady Lady Oscar come un moschettiere batterti sai tu Oh Lady Lady Lady Oscar le gran dame a corte ti invidiano perchè Oh Lady Lady Lady Oscar anche nel duello l' eleganza c' è Oh Lady Lady Lady Lady Oh Lady Lady Lady La Notte buia alla corte di Francia a palazzo si dorme già tre briganti con spada e con lancia agguato a sua Maestà Lady Oscar sei proprio nascosta nella grande stanza del re con scatto felino ed abile mossa colpirà tutti e tre Oh Lady Lady Lady Oscar la tua spada fischia non delude mai Oh Lady Lady Lady Oscar anche nella mischia vincere tu sai Oh Lady Lady Lady Oscar le gran dame a corte ti invidiano perchè Oh Lady Lady Lady Oscar anche nel duello l' eleganza c' è Oh Lady Lady Lady Lady Oh Lady Lady Lady La Oh Lady Lady Lady Lady Oh Lady Lady Lady La Oh Lady Lady Lady Oscar tutti fanno festa quando passi tu Oh Lady Lady Lady Oscar come un moschettiere batterti sai tu Oh Lady Lady Lady Oscar le gran dame a corte ti invidiano perchè Oh Lady Lady Lady Oscar anche nel duello l' eleganza c' è Oh Lady Lady Lady Lady Oh Lady Lady Lady La Oh Lady Lady Lady Oscar la tua spada fischia non delude mai Oh Lady Lady Lady Oscar anche nella mischia vincere tu sai Oh Lady Lady Lady Oscar la tua [SEP] spada [SEP] fischia non delude mai Oh Lady Lady Lady Oscar anche nella mischia vincere tu sai Oh Lady Lady Lady Lady Oh Lady Lady Lady La Oh Lady Lady Lady Lady Oh Lady Lady Lady La
itwac	Le frequentazioni nell' ambito surrealista gli avevano fatto conoscere editori e redattori di case editrici : per tutti avrà un testo e uno pseudonimo , sia che si tratti di romanzi polizieschi che di storie di pirati o di cappa e [SEP] spada [SEP] .
itwac	Potremmo provare a ricaricarla con la [SEP] Spada [SEP] e con la magia della Stella Sfavillante .
itwac	Ruppi una [SEP] spada [SEP] e rischiai di ferire il pubblico , tutto ok per fortuna .
itwac	Era una mossa azzardata , perché le ombre stipate nella [SEP] spada [SEP] sarebbero potute sfuggire al suo controllo , ma era un rischio che era disposto a correre .
itwac	) La gente si uccide nel nome di Dio e nel nome del Padre si uccide suo figlio Un chiodo nel cuore Una [SEP] spada [SEP] nell' Anima » Dalla Prefazione a « Impronte digitali sulla mia Anima » L' intuizione lirica , di questa raccolta di poesie della giovanissima Marcella Boccia , non sì cristallizza in immagini , ma trascende la particolarità nel canto , che le avvolge di un alone aereo , esprimendone la spiritualità più profonda della rappresentazione concreta .
itwac	Nell' arena PC Shogun : Total War Warlord Edition PC Warcraft III : Reign of Chaos PC Battle Realms PC Myth III : The Wolf Age Su Nextgame.it [ Anteprima ] Medieval : Total War [ Preview ] Medieval : Total War [ Screenshot ] Medieval : Total War [ Screenshot ] Medieval : Total War [SEP] Spade [SEP] in pugno con Medieval Total War Un nuovo filmato per Medieval : Total War Un sito per Medieval : Total War Medieval : Total War in una demo Cambio di proprietà per il seguito di Shogun
itwac	Signore e signori , benvenuti nell' Europa del dodicesimo secolo , dove alla minaccia incombente delle popolazioni arabe si mischiavano le gesta eroiche di combattenti che brandivano la [SEP] spada [SEP] con la benedizione di Dio .
itwac	Egli invece corse a villa [SEP] Spada [SEP] .
itwac	e non avrò pace finché non affonderò questa [SEP] spada [SEP] nel tuo petto ...
itwac	Il mago nemico era caduto dietro di lui , così che il ragazzo si buttò con la [SEP] spada [SEP] .
itwac	Sufyan al-Thawri ha detto : " Non ho mai avuto a che fare con qualcosa piu' forte di me del mio ego ; una volta era con me , e l' altra era contro di me " Yahya ibn Mu ` adh al-Razi ha detto : " Lotta contro il tuo ego con le quattro [SEP] spade [SEP] dell' addestramento : mangia poco , dormi poco , parla poco e sii paziente con chi ti fa del male ...
itwac	dalla [SEP] spada [SEP] ...
itwac	Preso dalla paura lanciai la [SEP] spada [SEP] contro l' avversario che sparì in una violenta esplosione : un disastro .
itwac	17 I giovani di Eliòpoli e di Bubàste cadranno di [SEP] spada [SEP] e queste città andranno in schiavitù .
itwac	[ 6 ] Il Manuzio [ 7 ] ad esempio , in un suo carme latino , se per un verso lo ritiene reo di una colpa contro cui non poteva restare oziosa la vindice [SEP] spada [SEP] della giustizia , per altro verso non accenna alla qualità del maleficio che pure , dice , non avrebbe reso meno glorioso il suo nome .
itwac	35 L' un ch ' avea fin a l' elsa ne la pancia la [SEP] spada [SEP] immersa alla maligna fera , Francesco primo , avea scritto , di Francia ; Massimigliano d' Austria a par seco era ; e Carlo quinto imperator , di lancia avea passato il mostro alla gorgiera ; e l' altro , che di stral gli fige il petto , l' ottavo Enrigo d' Inghilterra è detto .
itwac	Architetto , [SEP] Spada [SEP] individua nella cosiddetta progettazione partecipata un prezioso strumento di conoscenza .
itwac	Tutto troppo bello e perfetto se non fosse che come una [SEP] spada [SEP] di Damocle incombe sulla " nuova creatura " la questione palaghiaccio .
itwac	Ora potete recarvi dal fabbro Harod ( punto 6 della mappa di Khorinis ) e comprare una [SEP] spada [SEP] di metallo magico per 2000 monete d' oro ; visto che potrete comprarne una sola , scegliete attentamente se ne volete una a una mano o a due mani .
itwac	Finora tonnetti , [SEP] spade [SEP] ( piccole ) seppie , nella zona Pisticci .
itwac	Il drifting allo [SEP] spada [SEP] Bisogna innanzitutto piazzare le esche attorno alla linea del termoclino , usualmente situata tra i 12 e i 90 m di profondità .
itwac	cerca la [SEP] spada [SEP] e ...
itwac	24 Quando Israele ebbe finito di uccidere tutti i combattenti di Ai nella campagna , nel deserto , dove quelli li avevano inseguiti , e tutti fino all' ultimo furono caduti sotto i colpi della sIsraeliti si riversarono in massa in Ai e la colpirono a fil di [SEP] spada [SEP] .
itwac	Troppo tardi ci accorgiamo del pesce [SEP] spada [SEP] in salsa di menta , sarà per un' altra volta .
itwac	R giorgio Uno spada da 290 kg è uno [SEP] spada [SEP] da sogno .
itwac	Gli occhi di Valeria si dilatarono e guardarono con sospetto la [SEP] spada [SEP] che suo padre , contravvenendo a tutte le tradizioni dell' Impero , le aveva destinato ; sentiva di desiderarla , ma al tempo stesso ne avvertiva il potere q questo la faceva desistere per la paura di non poterlo controllare .
itwac	Sì , ma che sia " garbato " Gli Amici della Terra scendono in campo per difendere a [SEP] spada [SEP] tratta Biumo Superiore : dopo il botta e risposta con l' assessore alla mobilità Alessio Nicoletti sull' uso di alcune vie e sulla velocità di transito in strade costruite tempo fa quando mezzo di locomozione era il carro tirato dai cavalli , l' associazione ambientalista scrive al sindaco e ai vertici della Camera di Commercio raccomandando stile e rispetto dell' ambiente per la costruzione dell' albergo nelle parco delle ville Ponti .
itwac	Con un movimento rapido il giovane estrasse una lunga [SEP] spada [SEP] e la conficco nel ventre del pirata che stramazzò al suolo con un grido soffocato ...
itwac	Amos - Capitolo 9 Quinta visione : caduta del santuario [ 1 ] Vidi il Signore che stava presso l' altare e mi diceva : « Percuoti il capitello e siano scossi gli architravi , spezza la testa di tutti e io ucciderò il resto con la [SEP] spada [SEP] ; nessuno di essi riuscirà a fuggire , nessuno di essi scamperà .
itwac	Pel momento la vostra [SEP] spada [SEP] non è necessaria .
itwac	22 Anche l ` elsa entrò con la lama ; il grasso si rinchiuse intorno alla lama , perciò egli uscì subito dalla finestra , senza estrargli la [SEP] spada [SEP] dal ventre .
itwac	25 " I tuoi prodi cadranno di [SEP] spada [SEP] , i tuoi guerrieri in battaglia " .
itwac	Solo la [SEP] spada [SEP] del principe Bertrand poteva trafiggere a morte il terribile Gormogh , ma solo l' immensa forza del sacrificio di una fanciulla coraggiosa poteva annientare il malvagio Signore Oscuro .
