corpus	sentence
itwac	17 giugno Giuliano La [SEP] Spada [SEP] sostiene di essere Lucifero .
itwac	Egli aveva al fianco anche la [SEP] spada [SEP] con la quale aveva tagliato la testa ai tre giganti ; così entrò nella casina e si fece dare qualcosa da mangiare .
itwac	Rimane sempre latitante , invece , l ´ ex presidente del gruppo sportivo , Gabriella [SEP] Spada [SEP] , che dovrebbe trovarsi ufficialmente alle Maldive .
itwac	Immediatamente le sue membra si irrigidirono , la mano strinse con ancor più decisione l' elsa della [SEP] spada [SEP] ; voltandosi sfiorò il braccio di Yukai  Aspettatemi qui .
itwac	Dopo oltre 3 anni dalla denuncia di Adusbef ( 17.10.2001 ) che portò all' apertura delle indagini della Procura di Brescia sotto la [SEP] spada [SEP] di Damocle delle prescrizioni per la norma " salvapreviti " , si apre domani a Brescia alle ore 9,30 , presso l' Aula polivalente di Via Collebeato , 78 , l' udienza preliminare fissata dal dr. Lorenzo Bernini , Gip della Procura , il processo contro 42 manager della ex banca fiore all' occhiello della nuova economia , che capitalizzava oltre 30.000 miliardi di lire meno di 4 anni fa .
itwac	Don Chisciotti - ( Sfoderando la [SEP] spada [SEP] ) Cummatti si hai curaggiu ...
itwac	Senza dire più niente mi getto con tutte le mie forze sopra la [SEP] spada [SEP] , con la lama nel ventre .
itwac	22 Potea così scoprirlo al primo tratto , senza tenere i cavallieri a bada ; ma gli piacea veder qualche bel tratto di correr l' asta o di girar la [SEP] spada [SEP] : come si vede ch ' all' astuto gatto scherzar col topo alcuna volta aggrada ; e poi che quel piacer gli viene a noia , dargli di morso , e al fin voler che muoia .
itwac	Chariza fu buttata a terra ancora prima di rendersi conto che qualcosa la stava aggredendo e non riuscì ad estrarre la [SEP] spada [SEP] , sapeva che se avesse potuto usare Kageboshi sulla cosa che la teneva premuta contro il pavimento freddo e umido della cantina sarebbe stata salva , ma la forza dell' aggressore era davvero sovrumana e Chariza non riusciva ad alzare neppure un dito tanto era stretta la presa sul suo polso .
itwac	L' ultima domenica di Carnevale e il martedì successivo ad Oristano si " corre " LA SARTIGLIA , è un gioco cavalleresco di abilità di cavalieri che consiste nell' infilare con la [SEP] spada [SEP] o con lo stocco una stella forata sospesa sul percorso e un rito agrario dal galoppo Abbasanta - Ghilarza Paulilatino : Su Carrudzu Festa collettiva carnevalesca , in costume tradizionale , che coinvolge tutta la popolazione con sfilate e danze .
itwac	Seleziona l' immagine per ingrandirla La conferenza dal titolo " La [SEP] spada [SEP] giapponese fra realtà e leggenda " a cura del presidente onorario dell' associazione italiana per la spada giapponese , dr. Alberto Roatti .
itwac	Forse col tempo e coll ' uso la [SEP] spada [SEP] s' è spuntata ?
itwac	Il Kendo nasce formalmente insieme agli strumenti che permettono di praticarlo : lo shinai ( una [SEP] spada [SEP] formata da quattro listelle di bambù tenute insieme da stringhe di pelle ) e il Bogu ( un' armatura leggera che copre testa , addome e mani ) .
itwac	Sette P ne la fronte mi descrisse col punton de la [SEP] spada [SEP] , e « Fa che lavi , quando se' dentro , queste piaghe » , disse .
itwac	La sua lunga [SEP] spada [SEP] , tinta del sangue dei suoi nemici , giaceva a terra davanti a lui .
itwac	THE BLADE Regia : Tsui Hark con : Wing Zhao , Xiong Xin-Xin , Su Tsui-Yu , Wai Tin-Chi Sceneggiatura di : Tsui Hark , Koan Hui , So Man-Sing Durata : 104 min. circa Anno © 1997 Prezzo al pubblico L. 33.900 Conquistò il mondo con una lama spezzata In un passato barbarico , un fabbricante di [SEP] spade [SEP] é alla ricerca dell' assassino di suo padre .
itwac	Io credo che nella tua metafora il sapore della gomma rappresenti il processo di semiosi , vale a dire il magico momento in cui un oggetto ( un film , una gomma da masticare , una [SEP] spada [SEP] laser ; ma anche un gesto , una parola ) si legano a un significato .
itwac	E tutto l' esercito di Sisara , forte di novecento carri di ferro e di tutta la gente che era con lui da Aroset-Goim fino al torrente Kison , cadde a fil di [SEP] spada [SEP] e non ne scampò neppure uno .
itwac	Davide - Ah sì ?! Allora gli lancio la [SEP] spada [SEP] facendo un push sulla forza .
itwac	E' altrettanto vero che i grandi rischi , i grandi amori , le grandi battaglie , il camminare sul ciglio di profondi burroni , lo scintillio delle [SEP] spade [SEP] che si incrociano , sono l' antitesi di quella vita piatta , grigia , codificata e programmata che la modernità propone .
itwac	Una lancia dalla punta palmata , la lunga [SEP] spada [SEP] e lo scudo romboidale o tondo , dei leggeri pettorali .
itwac	Diego Caro Magno , purtroppo devo declinare il Tuo invito , causa problemi di lavoro ( la settimana prossima Grand Prix di Monaco ) , ma in seguito , se organizzerai ancora battute di pesca a [SEP] spada [SEP] , vi saro' di sicuro .
itwac	L' essere perse ogni forza e sfilai la [SEP] spada [SEP] dalla sua carne , guardandolo meglio : un satiro !
itwac	Alessiani , M. ; [SEP] Spada [SEP] , M. ; Vischi , S. ; Maestri , M. ; Dionigi , P. ; Arbustini , E. ; Grossi , P. ; Ippoliti , G.B. ; Regazzi , M. ; De Ponti , F. ; Moratti , R. ; Noli , S. ; Zonta , A. ; Todo , S. ; Starzl , T.E. : " Total orthotopic small bowel transplantation in swine under FK 506 immunosuppression .
itwac	Eurosia viene rappresentata con la scure , o con la [SEP] spada [SEP] e con una corona , in atteggiamento che sembra comandare al cielo di allontanare le folgori .
itwac	Il brano portante di questo singolo avrebbe dovuto essere un remix de " La danza dei pesci [SEP] spada [SEP] " , poi sostituito dalla cover di Gaber .
itwac	84 Vedi tra duo unicorni il gran leone , che la [SEP] spada [SEP] d' argento ha ne la zampa : quell' è del re di Scozia il gonfalone ; il suo figliol Zerbino ivi s' accampa .
itwac	Fin nel primo romanzo , La [SEP] Spada [SEP] di Shannara , il druido Allanon ci rivela l' origine delle Quattro Terre : un mondo completamente trasformato dall' uso di terribili armi in una guerra tecnologica avvenuta mille anni fa .
itwac	Proponiamo il periodo dal 22 al 26 settembre , data in cui sono programmati lanci di missili AIM - 9 L , missili [SEP] Spada [SEP] e sganci di bombe a guida laser .
itwac	STRAPPACARNE : quest' arma può apparire sotto forma di storta , scimitarra o [SEP] spada [SEP] lunga ( sembra che scelga la forma che più aggrada al padrone ) , è appartenuta a molti guerrieri , tutti posseduti dalla Furia berserker , e pare che li abbia condotti più volte alla vittoria , per poi abbandonarli improvvisamente .
itwac	I tedeschi quando è stato il loro turno hanno difeso a [SEP] spada [SEP] tratta imprese la cui tenuta sul mercato è parsa in quei frangenti perlomeno discutibile .
itwac	( vibra un colpo di [SEP] spada [SEP] a Caligola che cade , poi , rivolto al pubblico ) E' finita la vita di Caio Cesare , soprannominato Caligola .
itwac	4 gnoll ( 2 arco + 2 ) 3 gnoll ( [SEP] spada [SEP] e scudo ) CA 4 mv 12 Dv 2 pf 10 thaco 19 # att 1 dmg 1 - 8 S 2 m 2 gnoll ( arco ) CA 5 mv 12 Dv 2 pf 10 thaco 19 # att 1 dmg 1 d 6 S 2 m Stanno saccheggiando alcune macerie o una casa e verranno colti facilmente di sorpresa dal gruppo ( almeno che non facciano loro stessi confusione ) .
itwac	Per precauzione aveva ordinato a tutti di non separarsi né dalla [SEP] spada [SEP] , né dalla pistola .
itwac	Le Sette [SEP] Spade [SEP] del Vendicatore Rifacimento del suo primo film , Don Cesare di Bauzan , con forti connotazioni horror , soprattutto nelle scene girate nella camera delle torture .
itwac	Prende così il via una storia movimentata , ricca di tranelli , intrighi e colpi di scena , tra duelli di cappa e [SEP] spada [SEP] fra Paperino e Gastone , fughe in carrozza , incendi , innumerevoli tentativi di matrimonio da parte della servetta Paperina , che alla fine si trasformerà in ( quasi ) contessa , e perfino un Paperino condotto al patibolo !
itwac	Nella parte alta un prato pianeggiante disseminato di Pini domestici ( Pinus pinea ) , in precarie condizioni vegetative e di giovani querce ( di specie diverse ) , limitrofo al contiguo Parco di Villa [SEP] Spada [SEP] ed ai boschi collinari .
itwac	Il maestro di [SEP] spada [SEP] si accorse di avere involontariamente intimidito il giovane mago e gli rivolse un sorriso amichevole .
itwac	Antonio Francesco [SEP] Spada [SEP] - Consigliere Eccl .
itwac	Cioè una comunità fatta di persone con spirito , quel Spirito di Gesù che gli spinge a cercare modi diversi per sostituire la [SEP] spada [SEP] con l' aratro , e fare in modo che anche quando risuonano le spade , gri aratri lavorino la terra .
itwac	come fabbrico [SEP] spade [SEP] e altro ?
itwac	Perché vi dico : deve compiersi in me questa parola della scrittura : E fu annoverato fra i malfattori : In fatti tutto quello che mi riguarda volge al suo termine - Ed essi dissero : - Signore ecco qui due [SEP] spade [SEP] - ...
itwac	" Sovrano della [SEP] Spada [SEP] delle Stelle , è giunta l' ora che Solodan abbandoni una volta per tutte Feldstar .
itwac	Per un breve attimo esitai , tremai ; sfoderando la mia [SEP] spada [SEP] presi a volteggiare tastoni con essa torno torno alla cripta , ma basto' un attimo di riflessione per rassicurarmi .
itwac	Lettura dei simboli del nostro stemma Corona Le Torri stanno ad indicare il riconoscimento di San Donato come città avvenuta con Decreto del Presidente della Repubblica il 30 Dicembre 1976 [SEP] Spada [SEP] Le spade incrociate con l' elsa in basso ricorda i fatti d' arme avvenuti presso San Donato Milanese Scaglione La figura dello scaglione , in argento , divide il campo azzurro in due parti e simboleggia il taglio del tetto della chiesa , cioè della antichissima Pieve di San Donato Destrocherio Braccio destro armato di staffile , si riferisce all' impresa dei monaci cistercensi di Chiaravalle , dove sorge la celebre Abbazzia .
itwac	Quattro o cinque archibugi ed alcune [SEP] spade [SEP] furono introdotte .
itwac	Lo buttò a terra e sguainò la [SEP] spada [SEP] puntandogliela alla gola in posizione verticale .
itwac	Saluti Emi KURT MILLERS Advanced Member Livorno 2461 Posts Posted - 10/02/2005 : 15:26:53 Attenzione al palamito a [SEP] spada [SEP] .
itwac	Questa usa la tecnologia delle [SEP] spade [SEP] laser per creare un simbolo così che i comandanti possano essere riconosciuti dai loro sottoposti .
itwac	E anche a te una [SEP] spada [SEP] trafiggerà l' anima " ( Lc 2 , 34.35 ) , rimandano al Calvario .
itwac	Si picchiarono con le mazze e le impugnature si piegarono ; si colpirono con le [SEP] spade [SEP] e le lame si intaccarono ; si scagliarono le lance e le aste si piegarono .
itwac	- Lui vuole la [SEP] spada [SEP] ?
itwac	Mi fermai a guardare una bancarella dove c' erano [SEP] spade [SEP] piccole a mezza luna incise che erano molto belle ; mi accingevo a comprarne una che ritenevo la piu' lucente delle altre , ma la compro' un altro .
itwac	Quando al suo tempo usava le espressioni " usare la [SEP] spada [SEP] e il bastone " o " spaccare la testa in sette parti " nei santissimi Gosho , non c' era valore simbolico .
itwac	In preda alla furia snudò la [SEP] spada [SEP] e rivolse un violento fendente contro il mago .
itwac	- Eravamo seduti in un piccolo bar , un bar costruito lungo un corridoio , seduti di fronte ci guardavamo , è stato un momento ma è stato tutto forse era lì che il mondo aveva senso , forse era lì che aspettavano Cristo , forse era lì che il mondo confluiva nei nostri occhi stretti , coagulati in un abbraccio ma ora è la fine e io chiedo questo , lasciatemi in pace , devo pensare , lasciatemi in pace , non sarà per niente facile [ laghi ] [ dune ] [ eclisse ] [ fine ] [ Superficie liscia che produce una riflessione regolare dei raggi luminosi , in genere costituito da una lastra di cristallo metallizzata nella faccia posteriore ] [ MASTERMIND ] E ora Michele chiede cosa fare si nutre della sua [SEP] spada [SEP] inghiottito nel dubbio , non teme la fine e non conosce il nulla , distrugge ogni cosa e divide ogni pensiero , è furia , è fiamma , è notte pura e il suo cuore è una quercia che pianta radici , lì dove prima era aperta una crepa e da esso nascono frutti , bacche di anime diverse tra loro che crescono e si moltiplicano e pervadono ogni cosa , ogni mare , ogni cielo fin sopra il salotto divino e Dio stesso è prigioniero nel cuore dell' angelo e rantola come un insetto nel suo grande oceano di radici [ ...
itwac	inoltre lei ha fame " Così dicendo , gli conficcai la [SEP] spada [SEP] nello stomaco ...
itwac	Nel tempio di Madripoor gli X-Men piangono l' apparente morte di Rogue e Gambit , che giacciono di fronte a loro trafitti dalla [SEP] spada [SEP] di Vargas .
itwac	Uno dei pochi che finora ha difeso Rumsfeld a [SEP] spada [SEP] tratta è stato proprio George W. Bush , nonostante le voci di corridoio informino che il presidente abbia espresso il suo scontento per la gestione della crisi .
itwac	Appena il primo Gnoll entrò nella stradina Firis gli stacco di netto la testa con la [SEP] spada [SEP] .
itwac	Ma nella compagine governativa c' è chi difende l' operato del governatore a [SEP] spada [SEP] tratta .
itwac	CALIGOLA  Io non ho sentito che cavalli sfrenati , cozzare di [SEP] spade [SEP] e di scudi , grida di aiuto , rantoli di morte .
itwac	Ingredienti per 6 persone : 1 Kg. di pesce [SEP] spada [SEP] ; fette di limone ; fette di pomodoro .
itwac	Alvaro : La contendano le nostre [SEP] spade [SEP] .
itwac	Per la prima volta dopo molto tempo il sonno arriva presto a chiamarmi e come non ho mai fatto attivo il rilevatore di movimenti situato nel fondino della [SEP] spada [SEP] che mi porto legato alla gambaâ  ¦ temo i fantasmi che stanno in cantina .
itwac	Via la [SEP] spada [SEP] all' Arcangelo Gabriele .
itwac	L' atmosfera è densa di adrenalina , tutti i soldati dormono con la pistola sotto al cuscino e la [SEP] spada [SEP] al fianco , i consigli si radunano , i Khan sono pronti a combattere ma , nonostante ciò Aries riesce a trovare il modo di passare il tempo : la formosa principessa e due sue ancelle altrettanto prosperose gli fanno visita nel cuore della notte per ringraziarlo del suo prode gesto .
itwac	Dicendo questo trasse , da sotto il mantello , una [SEP] spada [SEP] del colore del sangue .
itwac	Il manipolo , con i fucili puntati , circondò il gigante straniero , che ringhiò sommessamente afferrando le lunghe [SEP] spade [SEP] .
itwac	Ho dovuto imparare a padroneggiare due modi di usare la [SEP] spada [SEP] : il Wushu , uno stile cinese , col maestro Yuen Woo-ping , e quello giapponese dei samurai , il Kenjutsu , insegnato da Sonny Chiba .
itwac	Si comprende come il nostro relitto abbia interessato subito il mondo scientifico europeo e d' Oltreoceano , in particolare gli Spagnoli che , con l' autorizzazione del Ministero per i Beni Culturali e Ambientali , effettuarono nell' estate di quell' anno una sistematica campagna di scavo , che diede come risultato immediato il recupero di due grandi ancore , di nove affusti di cannone in ferro fucinato con cerchiature di rinforzo , diciassette mascoli , una colubrina , proiettili in ferro e in pietra , una balestra , due [SEP] spade [SEP] con fodero concrezionate a solfuri , un piccolo stampo in pietra per fabbricare pallini per gli archibugi ; e infine , brocche , ceramiche , pentoloni in rame , piastrelle .
itwac	Direzione animazione : Nik Ranieri Voce italiana : Luca Bizzarri Voce originale : David [SEP] Spade [SEP] Nome : PACHA Ruolo : contadino Carattere : forse il più umano fra i protagonisti , è la tipica persona concreta che riesce a mettere a fuoco le situazioni ; ha una gestualità molto verosimile e tratti più realistici che fanno da contrasto all' aspetto fumettistico del lama .
itwac	Tocca a Wolverine aiutarla a recuperare la [SEP] spada [SEP] e riportarla nel luogo a cui appartiene " .
itwac	Attualmente le indicazioni cautelari riguardo al consumo di pesce sono rivolte alle donne in gravidanza , cui è raccomandato di evitare pesci ad alto contenuto di mercurio : sgombro , pesce [SEP] spada [SEP] e squalo in particolare .
itwac	Capitolo 18 : La [SEP] spada [SEP] delle stelle 20 .
itwac	( avanza verso il re con la [SEP] spada [SEP] in pugno ) IL RE  Che cosa volete fare ?
itwac	Napster fu ucciso , clonato e fatto risorgere armato di scudo e [SEP] spada [SEP] donatigli dalle major .
itwac	E la luce si riflette sul mare Ci sono decine di porti sparsi per i caraibi L' agile sloop protegge la lenta nave ammiraglia Lasciamo parlare le [SEP] spade [SEP] La tempesta potrebbe danneggiare la flotta Una finta per disorientare il nemico La mappa tattica di assalto alle città De Montalban .
itwac	Chi non vorrebbe eludere , per qualche giorno appena , la sorveglianza di quel cherubino dalla [SEP] spada [SEP] fiammeggiante che il Giardiniere , dopo la cacciata , pose a guardia del Paradiso terrestre per sbarrarci la via del ritorno ?
itwac	Quindi non abbiamo fretta e risolviamo il problema in modo organico " Per Claudio Zaccarin , infine , responsabile regionale per la Cgil del dipartimento dell' artigianato e della piccola impresa , gli industriali stanno solo pagando lo scotto delle loro scelte politiche : " Non si può sostenere a [SEP] spada [SEP] tratta il centrodestra e poi lamentarsi per questo problema .
itwac	- Una scena sconvolgente con Pipino , Faramir e Denethor ( il webmaster si rifiuta di dire di più ) - Aragorn che riceve Narsil dalle mani di Elrond ( così i puristi che temevano che la [SEP] spada [SEP] venisse portata da Arwen saranno tranquilli , N.d.R. ) - Una piccola scena in cui Eowyn e Theoden parlano del futuro ( ne abbiamo visto un estratto nel trailer ) - Theoden e la cavalcata dei Rohirrim - Shelob e Frodo , pochi momenti , ma orribili e disgustosi ( direi che è un buon segno , no ?
itwac	Ruppi una [SEP] spada [SEP] e rischiai di ferire il pubblico , tutto ok per fortuna .
itwac	18 Ma Edom gli rispose : " Tu non passerai sul mio territorio ; altrimenti uscirò contro di te con la [SEP] spada [SEP] " .
itwac	Già Caino aveva giocato sulla disinformazione di Abele - " andiamo nei campi " , gli aveva detto , guardandosi bene dal fargli capire che aveva tutte le intenzioni di liberarsene - , e , quindi , da che mondo è mondo , in ogni guerra che si rispetti , la parola e l' immagine sono state brandite quanto e più della [SEP] spada [SEP] .
itwac	Intanto Gio e Alessia erano soli in piazza che parlavamo , quando vennero interrotti dalle truppe della regina che catturarono Alessia circondando Gio mettendolo spalle a muro in condizioni da non poter reagire e fatto ciò gli spararono il primo attacco sotto gli occhi di dell' amata che implorava pietà per Gio che però subì una seconda infilzata di [SEP] spade [SEP] nel torace facendolo cadere in terra e così sino alla fine del quinto attacco Gio spirò l' ultimo respiro implorando pietà per l' amata Alessia ...
itwac	AMAZZONE L' Amazzone con [SEP] Spada [SEP] e Scudo TANKAZON - ovvero l' amazzone getta l' arco e impugna la spada .
