corpus	sentence
itwac	» Il re si alzò vivamente , in preda ad una visibile commozione , mentre i dissova gli si stringevano attorno snudando le loro [SEP] spade [SEP] , come per proteggerlo da qualche pericolo .
itwac	Come mai proprio in questa fase di ridefinizione scolastica , sull' educazione musicale , artistica e motoria , incombe questa [SEP] Spada [SEP] di Damocle , ovvero la collocazione facoltativa ?
itwac	10 Simon Pietro allora , che aveva una [SEP] spada [SEP] , la sguainò , colpì il servo del pontefice e gli mozzò l' orecchio destro .
itwac	[ 12 ] Essi alzarono gemiti e pianti e digiunarono fino a sera per Saul e Giònata suo figlio , per il popolo del Signore e per la casa d' Israele , perché erano caduti colpiti di [SEP] spada [SEP] .
itwac	un mago di 4 ° che possiede una [SEP] spada [SEP] + 3 , vampiro ( 3 cariche / giorno ) , curatrice ( 1 gurarigione totale / giorno ) che da la possibilità di levitare .
itwac	l' orco solleva la [SEP] spada [SEP] al cielo fa per colpirti ...
itwac	Finito il concerto , intorno all' una di notte , abbiamo assistito agli ultimi attacchi del prode Daiaran ( ancora impegnato nel suo allenamento con la [SEP] spada [SEP] ) e dopo via , tutti a casa , per il meritato riposo degli eroi !
itwac	Il problema Per le persone disabili , l' uso esteso della tecnologia dell' informazione è una [SEP] spada [SEP] dal doppio taglio .
itwac	" Ora Douglas era proprio diventato un cavaliere e l' amico della regina , ( così come è prescritto dal cerimoniale ) , lo toccò sulle sue spalle robuste con una bella [SEP] spada [SEP] lucente .
itwac	Nuova avventura per il bel Johnny Depp che torna con un' incursione in grande stile nel fantasy ( era già successo agli esordi con il romantico " Edward mani di forbice " e più di recente con " Il mistero di Sleepy Hollow " ) con una pellicola cappa e [SEP] spada [SEP] dal gusto avventuroso .
itwac	SIRA CUCINE ANCONA : Corvetta , Piombini , Gatin , Stelmach , [SEP] Spada [SEP] , Heikkinen , Mascagna ( L ) , Paparoni , Broccanelli , Carbonetti .
itwac	Con la [SEP] spada [SEP] diabolica e utilizzando l' agilità in volo del suo robot , Tetsuya riesce a distruggere Gabara ma l' onda d' urto dell' esplosione lo scaglia contro un costone di roccia facendogli perdere conoscenza .
itwac	Stava lentamente emergendo da questo stato di trance , quando udì delle grida cui presto si sovrapposero canti e risate  Ubriachi  pensò allungando la mano verso la [SEP] spada [SEP] appoggiata al suo fianco , pronta a cacciare chiunque intendesse venire a disturbare la quiete della villa Onshitu .
itwac	Così deciso in Roma , Palazzo [SEP] Spada [SEP] , sede del Consiglio di Stato , nella camera di consiglio del 3 dicembre 2002 , con l' intervento dei sigg .
itwac	Ma sta , tra l' altare e il cielo , la [SEP] spada [SEP] ; sta il cuore del vecchio patriarca lacerato e offerto : calice di sangue .
itwac	Come ti piace , o scendi , o sta a cavallo : pur che le man tu non ti tegna al fianco , io son contento ogni vantaggio darti : tanto alla [SEP] spada [SEP] bramo di provarti .
itwac	Decisi però che quella [SEP] spada [SEP] trovata nel mezzo della stanza e che mi aveva salvato la vita ( ma che aveva terminato un' altra vita , questo non riuscivo a dimenticarlo ) poteva essermi utile ancora .
itwac	Cerca di sorprendere i propri avversari con dei colpi veloci che feriscano di taglio , in modo da mantenere sempre una certa distanza dai nemici per riuscire a ritrarre la [SEP] spada [SEP] a sè per portarla in difesa del fianco scoperto quando ve ne sia la necessità .
itwac	Nel 1822 , quando la California spagnola sta per diventare provincia messicana , il nobile Diego de la Vega ( A. Hopkins ) , invincibile raddrizzatore di ingiustizie e corruzioni con la maschera e la [SEP] spada [SEP] di Zorro ( " volpe " in spagnolo ) , è arrestato e messo in galera dal governatore spagnolo ( S. Wilson ) che gli uccide la moglie e gli rapisce la figliolina , portandosela con sé in Spagna .
itwac	Forse uccidi uno che hai fatto prigioniero con la [SEP] spada [SEP] e con l' arco ?
itwac	Saranno esposte oltre 170 opere grafiche / pittoriche , tutte le sculture , le [SEP] spade [SEP] ed i gioielli dei popoli della Terra di Mezzo , le scenografie ( tra le quali dalla Nuova Zelanda lo splendido Barbalbero - studio realizzato per il film di Peter Jackson ) e diverse rarità del mondo dell' illustrazione di Tolkien .
itwac	Non lo dice esplicitamente , ma la prospettiva di condurre il resto della campagna elettorale sotto la [SEP] spada [SEP] di Damocle dell' ineleggibilità lo turba .
itwac	" Ora che il numero di reati gravi in Russia sta aumentando , la totale revoca della pena di morte , che è la [SEP] spada [SEP] di Damocle che può fermare un potenziale omicida , potrebbe provocare dissenso nella società " , ha detto Kalamanov .
itwac	Uomini che passavano dalla [SEP] spada [SEP] alla cetra con la stessa disinvoltura con cui violentavano le donne inglesi per poi ritornare tra le braccia delle loro amate .
itwac	) attratte o repulse dai tre elementi centrali del mito ( l' anello , la bacchetta magica e la [SEP] spada [SEP] ) che nella spazio del Tesoro costituiscono degli elementi di navigazione .
itwac	Se invece la sentinella vede giunger la spada e non suona la tromba e il popolo non è avvertito e la [SEP] spada [SEP] giunge e sorprende qualcuno , questi sarà sorpreso per la sua iniquità : ma della sua morte domanderò conto alla sentinella .
itwac	Divenne ben presto una delle più potenti [SEP] spade [SEP] dell' Islam ed ebbe la nomina di sangiacco-bey .
itwac	In generale questo Conan targato TDK è un' avventura fantasy di discreto livello che finisce però per divenire una gigantesca arena di combattimento in cui la maggior attrazione è specializzarsi in nuove mosse e provare l' ebrezza di essere per una volta protagonisti di avventure altrimenti solo lette , magari trovandosi circondati da uomini in armatura armati solo della propria [SEP] spada [SEP] .
itwac	Consideravano la nostra musica fuori dal tempo perché troppo allegra e perché , nei testi , non si parlava di draghi e [SEP] spade [SEP] magiche !
itwac	Per riflesso condizionato cerco' la [SEP] spada [SEP] che avrebbe dovuto trovarsi nel fodero accanto alla sella , non trovandola naturalmente ; la sua missione di ambasciatore non gli consentiva di girare armato , impreco' sottovoce e fece per rimontare , quando si accorse che dietro di lui , seminascosto da una delle capanne coperte di frasche , si trovava un giovane nomade che lo osservava .
itwac	Domenica prossima l' architetto Stefano Zironi presenta Villa [SEP] Spada [SEP] , di cui ha curato il restauro .
itwac	Francesco Lauria La penna e' piu' potente della [SEP] spada [SEP] , ed anche considerevolmente piu' facile da usare per scrivere .
itwac	Il parco va bene , la vera [SEP] spada [SEP] di Damocle può essere il Sic » .
itwac	Diego angler ciao a tutti vorrei chiedervi alcune informazioni sulla pesca allo [SEP] spada [SEP] .
itwac	La tua [SEP] spada [SEP] è sempre stata strana sorella , ma a quanto pare è efficace !
itwac	Interrogatus dicit , il Sig. Don Gioanni l' ho visto à giocar di spada con Filippo , e con altri , che non mi raccordo , chi siano , et hò anche visto detto Filippo à gioccar di [SEP] spada [SEP] in Castello con un' altro scrimatore , mà non lo conosco se non di vista .
itwac	Certo , tra le responsabilità primeggiano quelle degli eletti e dei politici : chiamati a garantire il bene comune , di questa funzione si sono fatti scudo e [SEP] spada [SEP] per accrescere la loro potenza ( o la loro ricchezza ) privata .
itwac	Solo così avrei impedito a me stesso , dopo quindici anni , quasi alla fine , di desiderare di incontrare di nuovo il fuoco dei tuoi occhi e il freddo della tua [SEP] spada [SEP] , Capitano Gert dal Pozzo .
itwac	Due di essi si avvicinarono titubanti , le [SEP] spade [SEP] intaccate ed insanguinate ancora strette in pugno .
itwac	Artiglio di tigre : questa mossa si esegue con 2 spade , il fendente è doppio ed orizzontale dal basso verso l' alto con le [SEP] spade [SEP] parallele .
itwac	QUESTA [SEP] SPADA [SEP] VIENE RUBATA DALLA DISCEPOLA DI VOLPE DI GIADA , L' ASSASSINA DEL MAESTRO DI MOBAI .
itwac	Megrez con la sua [SEP] spada [SEP] d' Ametista gli stava dando filo da torcere .
itwac	Una " spia " che ha confessato come farebbero tutti quelli che hanno una [SEP] spada [SEP] che punta verso il collo .
itwac	È difficile immaginare i principali dirigenti peronisti sospendere al di sopra delle loro stesse teste questa [SEP] spada [SEP] affilata .
itwac	Quanto alla prima , incontriamo gli oggetti - setacci , ponti , cavalli , [SEP] spade [SEP] , scarpe , rane , rocce - e i personaggi della vita quotidiana - soldati , mugnai , osti , mamme , nonne , frati e fratelli .
itwac	Egli attaccò una grossa bestemmia invece della croce ; saltò sulla spada che avea gettato in mezzo alla camera , e così com' era , mezzo svestito , colla [SEP] spada [SEP] nuda in pugno , al buio , si slanciò nell' andito che era dietro all' alcova .
itwac	Chariza ripulì la [SEP] spada [SEP] con un fendente nell' aria , facendo schizzare gocce di sangue attorno a sé come una pioggia di petali rossi , poi si piegò sulla sua vittima e lo spogliò delle armi e di tutti gli oggetti che potevano essere di qualche valore .
itwac	Ma la sua [SEP] spada [SEP] sta provocando ferite profonde in quel che molti ritengono un corpaccio informe e ottuso , dominato da un istinto di morte .
itwac	" Incroceremo le nostre [SEP] spade [SEP] in memoria di coloro che hanno dato la vita nella lotta contro il Male .
itwac	Nel '52 è in teatro , Il borghese gentiluomo di Molière , e nel '53 debutta in radio , nella trasmissione Il trampolino dove presenta le sue canzoni " Lu pisce [SEP] spada [SEP] " e " Ninna-Nanna " .
itwac	Saltino sui coperchi con fragore i due compari di [SEP] spada [SEP] compiuti uno sei anni e mezzo , l' altro cinque e io trentaquattro e la mamma trentadue e la nonna , se non sbaglio , sessantotto .
itwac	Così deciso in Roma , nella camera di consiglio tenutasi il giorno 28 maggio 2001 , presso la sede del Consiglio di Stato , Palazzo [SEP] Spada [SEP] , con l' intervento dei signori :
itwac	e a leggere i messaggi qua sopra mi sono veramente commosso !! Elencare i miei cartoni preferiti è difficile , viso che alcuni non sono proprio confrontabili : come posso scegliere se mettere prima Conan o La principessa Zaffiro , Babil Junior o La [SEP] spada [SEP] di King Arthur , Gundam o Il tulipano nero ...
itwac	scegli una [SEP] spada [SEP] per Me ...
itwac	Si tratta di uno dei rari gruppi flamenco di grande successo esistenti in Italia , specializzato in questo genere musicale , che si distingue per la vivacità del repertorio proposto e per l' abilità strumentale dei suoi componenti trascinati dal loro leader in fughe e duelli all' ultima [SEP] spada [SEP] .
itwac	Segue Dudon ne la vittoria ardente i fuggitivi , e ' l fer Tigrane opprime con l' urto del cavallo , e con la [SEP] spada [SEP] fa che scemo del capo a terra cada .
itwac	HARDWARE Una copia originale del gioco , una PS 2 , un GamePad , una Memory Card con almeno 502 KB liberi , una chiave inglese ed una [SEP] spada [SEP] .
itwac	[SEP] Spada [SEP] - Roma " Gianluca Rossi " nontelodico@bastardo.it ha scritto nel messaggio news:uVlqe.456$bc.225@tornado.fastwebnet.it ...
itwac	Forse la tribolazione , l' angoscia , la persecuzione , la fame , la nudità , il pericolo , la [SEP] spada [SEP] ?
itwac	« IDATEM » Una [SEP] Spada [SEP] nel Palamito ...
itwac	Il pirata sguaina la [SEP] spada [SEP] e cerca di colpirlo , ma Peter è troppo agile per lui : schiva facilmente i suoi colpi prendendolo in giro .
itwac	Progressivamente i Sa ' ûd " con la [SEP] spada [SEP] " , con successi ( Occupazione di Medina e della Mecca nel 1805 - 1806 ) e sconfitte ( riconquista di queste due città e decapitazione di Abd Allâh Ibn Sa ' ûd da parte degli Ottomani nel 1818 ) , finirono per imporsi su tutta la penisola arabica e per diventare padroni dei luoghi santi dell' Islam ( riconquista di Medina e della Mecca nel 1924 - 1925 ) e Abd al-Azîz al - Rahamân Ibn Sa ' ûd si fece proclamare re dell' Arabia nel 1932 .
itwac	nettuno Ciao Giorgio , di spada nei nostri mari ne hanno pescati anche di grossi , 180 Kg puliti , con palamiti da [SEP] spada [SEP] , mari un po' verso le baleari , ma anche in liguria .
itwac	CyBeRdAeMoN Io o meglio mio padre : D , ha la barca alla baia d' argento , ma noi in questo periodo non usciamo proprio in altura , almeno si dice che è inutile tanto non c' è nulla di nulla , dopo la metà di agosto si puo iniziare a cacciare per qualche [SEP] spada [SEP] ( spadino ) o aguglia , e si aspetta l' arrivo delle Ala .
itwac	Sono esattamente otto secoli che accettammo da lui ciò che Tu avevi rifiutato con sdegno , quell' ultimo dono ch ' egli Ti offriva , tutti i regni della terra : noi accettammo da lui Roma e la [SEP] spada [SEP] di Cesare e ci proclamammo re della terra , gli unici re , sebbene non abbiamo ancora avuto il tempo di compiere interamente l' opera nostra .
itwac	L' Ordine delle [SEP] Spade [SEP] Incrociate sono la maggiore gilda dell' Impero .
itwac	Ora è nostro e li in pozzetto con la [SEP] spada [SEP] che fuoriesce dalla barca , lo iniziamo da subito a fotografare dimenticandoci che quasi tutta la coffa era a mare , come dei bambini dopo aver ricevuto un gelato .
itwac	Un Cavaliere Ha la [SEP] spada [SEP] ...
itwac	Filippo [SEP] Spada [SEP] che accolse la proposta e concesse i necessari permessi per acquistare le case di un certo Domenico Pasqualini situate nella parte opposta del convento , verso la Porta del Ponte .
itwac	Un Drago che possiede la [SEP] spada [SEP] .
itwac	Il giudizio diffusamente negativo degli amministrati pesava come una [SEP] spada [SEP] di Damocle , minacciosamente tesa a colpire , una volta per tutte , quella classe politica che si fosse rivelata incapace di superare le vecchie logiche di potere , e conseguentemente , poco propensa a creare un sistema idoneo a produrre risultati soddisfacenti .
itwac	Rituale per i Lavori all' Aperto : Arredi richiesti : Postazioni dei cinque Dignitari Panche e sedie tra le Colonne Testimone e tre Candelieri collocati ritualmente ( Rito Simbolico ) Tre candele per il Maestro Venerabile , due per il 1 ° Sorvegliante ed una per il 2 ° Sorvegliante Quadro di Loggia [SEP] Spada [SEP] per il Copritore Interno Bastone cerimoniale per il M.d.C. Libro Sacro , Squadra e Compasso Colonnine per le postazioni dei Sorveglianti Tre Maglietti per i Dignitari di loggia .
itwac	Ha la funzione di una [SEP] spada [SEP] contro una piovra aggressiva e avvolgente , o dentro una giungla impenetrabile dove bisogna passare .
itwac	Gesù rinnegò forse colui che con la [SEP] spada [SEP] diede fine alla sua agonia sulla croce ?
itwac	Intanto ( terza scena del secondo atto ) nel castello di Enrico gli invitati festeggiano ancora le nozze di Lucia con Arturo , ma sopraggiunge Raimondo , sconvolto , e narra che Lucia ha ucciso il marito traffigendolo con una [SEP] spada [SEP] .
itwac	Anche se penetrano negli inferi , di là li strapperà la mia mano ; se salgono al cielo , di là li tirerò giù ; se si nascondono in vetta al Carmelo , di là li scoverò e li prenderò ; se si occultano al mio sguardo in fondo al mare , là comanderò al serpente di morderli ; se vanno in schiavitù davanti ai loro nemici , là comanderò alla [SEP] spada [SEP] di ucciderli .
itwac	( consultano la mappa ) ASSESSORE : All' incirca si può localizzare a poche decine di metri dalla piazza del pesce [SEP] spada [SEP] , onde , per cui , basterà aspettare il Sindaco e localizzare e circoscrivere il raggio d' azione in poche o in una sola casa .
itwac	*** Ha ' ira maita ' i roa ( Pesce spada al forno ) - Polinesia Ingredienti per 6 persone : 1 kg di pesce [SEP] spada [SEP] 600 g di patate dolci 300 g di carote a rondelle 300 g di pomodori 150 ml di vino bianco 2 cipolle tritate semi di finocchio alloro e timo 3 limoni sale pepe olio Lessate le carote , le cipolle e i pomodori nel vino insieme al timo , l' alloro e i semi di finocchio .
itwac	Accanto al lupo , era stato collocato un cartello con la scritta " Chi di [SEP] spada [SEP] ferisce , di spada perisce " .
itwac	soggetto : 6 SCENEGG : 6,5 DISEGNI : 8 " Io sono il foglio di carta sulla strada che a ogni soffio di macchina o di camion si erge e grida credendosi una [SEP] spada [SEP] : io sono quel foglio di carta e niente più " ( Tiziano Sclavi ) Reply author : genesis Replied on : 10/29/2004 12:54:48 Message : quote : soggetto : 6 SCENEGG : 6,5 DISEGNI : 8 Se questi sono i voti allora per me saranno da 4 , quindi confermo , nn lo compro , poi magari lo cerkerò usato in futuro Reply author : fumettioriginali Replied on : 10/29/2004 16:14:18 Message : Ma come fate !! Stamattina sono passato in edicola e ancora nulla ...
itwac	Le autorità accademiche presero un provvedimento nei confronti di tre dei loro iscritti che ritenevano fossero gli organizzatori di questa manifestazione e che erano Mario Capanna , [SEP] Spada [SEP] e Luciano Pero che di autorità furono trasferiti all' università statale .
itwac	Come dire chi di [SEP] spada [SEP] ferisce di spada perisce Segnala al moderatore Loggato fiumeverde Utente Esperto Offline Post : 465 Guarda il Profilo | | Re : Domanda « Risposta # 10 data : Mercoledì 12 Gennaio 2005 , 19:01 » | Rispondi citando All' altra " ...
itwac	Tutti cinsero la [SEP] spada [SEP] e Davide cinse la sua e partirono dietro Davide circa quattrocento uomini .
itwac	Fatto ciò , comandò a una di quelle dame che gli cingesse la [SEP] spada [SEP] , la qual cosa essa eseguì con molta disinvoltura e buon garbo , che veramente era difficile contenersi dal ridere a ogni passo della cerimonia : ma le prodezze che avevano veduto eseguire dal novello cavaliere mettevan freno agli scherzi .
itwac	Torino , corso Casale 137 / a Tel. 011 - 8193618 Per maggiori informazioni ACCADEMIA SCHERMA MARCHESA Centro storico torinese per quanto riguarda l' insegnamento della scherma sia a livello agonistico ( dai 10 anni ) che amatoriale , l' Accademia Scherma Marchesa propone corsi di sciabola , fioretto e [SEP] spada [SEP] per bambini e adolescenti a partire dai 6 anni di età .
itwac	È vero che con le idee si fa la storia ; ma è altrettanto vero che sovente sono stati di più gli uccisi dalle idee che quelli morti di [SEP] spada [SEP] .
itwac	LIMITAZIONI ALL' IMPORTAZIONE Armi da fuoco L' importazione di armi da fuoco e di esplosivi , di giubotti antiproiettili , di armi giocattolo , pistole e rivoltelle , armi militari , kriss , lance e [SEP] spade [SEP] è consentita solo se queste armi sono accompagnate da un permesso d' importazione o da altre autorizzazioni emessi dal servizio di polizia di Singapore ( Singapore Police Force ) al seguente indirizzo : Arms and Explosive Branch Block J , 3 Ladyhill Road Singapore 258672 Tel. 0065 838 1764/5 Fax : 0065 734 0531 Anche per l' esportazione di armi è necessaria l' autorizzazione della polizia .
itwac	Il primo è spoglio , il secondo ha smesso di cantare e infine il bambino non riesce a trovare una [SEP] spada [SEP] per difendere la adorata principessa .
itwac	Ha reso la mia bocca come [SEP] spada [SEP] affilata , mi ha nascosto all' ombra della sua mano ; mi ha reso come freccia appuntita , mi ha riposto nella sua faretra .
itwac	- VHS , Euro 21 Lupin III Special - [SEP] Spada [SEP] Zantetsu , infuocati !
itwac	Mi pare che difendere a [SEP] spada [SEP] tratta il sistema d 10 e dire che se Cyberpunk passasse al d 20 diventerebbe PP è un po' un luogo comune .
itwac	Il giudizio con il quale ogni cittadino potrebbe eventualmente richiamarsi alla propria situazione minaccerebbe , quale [SEP] spada [SEP] di Damocle , ogni certezza giuridica , e il vivere insieme diventerebbe poco meno che impossibile .
itwac	Il Medioevo pullula letteralmente di spade dai poteri straordinari ( si pensi alla Joyeuse di Carlo Magno , alla Durlindana di Orlando , alla Fusberta di Astolfo , a quella di Siegfried ( la spada spezzata per intervento i Odhinn : ricongiunta dal nano Minne , consente l' uccisione del drago Fafner come ci narra il ciclo wagneriano del Reingold ) : si può affermare che non esista cavaliere che non abbia una [SEP] spada [SEP] dai poteri straordinari : e il ciclo di Artù , nella sua caratterizzazione cavalleresca medievale non fa eccezione a questa regola .
itwac	il Pesce [SEP] Spada [SEP] !
itwac	: com' e' andata la traina allo [SEP] spada [SEP] ?
itwac	Un ampio dibattito moderato da Mario D' Ambrosio , Presidente di AIDP ( Associazione Italiana Direttori del Personale ) con il contributo di Giorgio Panizzi , Leonardo Piccinetti , Sandro [SEP] Spada [SEP] .
itwac	Visitiamo Zélve , Uchisar , la città sotterranea di Kaymakli , Avanos patria delle ceramiche , Cavusin con una spettacolare escursione sulle alture che la sovrastano , la Valle delle [SEP] Spade [SEP] , ecc. ecc. il tutto inframmezzato da alcune ottime cene dove abbiamo degustato il " Vadi Kebab " ( alla fiamma ) , o il " Canak " ( nella terracotta al forno ) sempre accompagnati dal " Lavas " ( pane sottile ) e la decina e più di antipasti gustati mentre i Dervisci Rotanti si esibivano nella loro tipica danza , a cui seguivano altri balli popolari e l' immancabile danza del ventre .
itwac	Ad una distanza di 1.500 anni luce e nello stesso braccio della spirale in cui si trova il Sistema Solare , la Nebulosa di Orione si trova nel mezzo della regione della [SEP] spada [SEP] di Orione , nella costellazione di Orione il Cacciatore , che domina il cielo invernale dell' emisfero settentrionale .
itwac	Vorrei che mi fosse cucito un abito da vero longobardo , con i pantaloni a quadri , la camicia a bottoni di corno , il mantello e la [SEP] spada [SEP] al fianco .
itwac	Il Palazzo nel 1632 è acquistato dal cardinale Bernardino [SEP] Spada [SEP] , e nonostante le parole con cui il fratello Virgilio si complimenta con lui per aver " trovato un palazzo così finito , che non ci potrà porre un mattone di vantaggio seppure lo volesse " , il cardinale inizia da subito diversi lavori che si protrarranno per ben trent' anni , fino alla sua morte .
itwac	Le altre nel 1306 s' erano ridotte a Leoni , Aquile , Grifoni , Branca ; [SEP] Spade [SEP] , Drappieri per l' armi , Leopardi , Vari ; Castelli , Quartieri , Traverse , Schise ; Chiavi , Dragoni , Balzani .
itwac	Diversamente opinando , secondo i giudici di Palazzo [SEP] Spada [SEP] , la preventiva audizione dell' interessato sarebbe , a rigore , necessaria soltanto se l' organo consultivo si orientasse in senso negativo , rispetto alle pretese dell' interessato , il che , come è evidente , non sarebbe in alcun modo determinabile in un momento antecedente a quello della concreta espressione del parere ( 26 ) .
itwac	Anzi , in passato la situazione è apparsa così critica agli occhi del procuratore capo al punto da definire i tutori dell' ordine « una [SEP] spada [SEP] di latta » .
itwac	I colpi di [SEP] spada [SEP] fanno da sottofondo man mano che ci si avvicina all' arena .
itwac	Attaccano usando le loro due [SEP] spade [SEP] di acciaio e hanno una ferocia nel farlo che ha dell' incredibile .
itwac	La volevo provare questa esperienza del palamito per lo [SEP] spada [SEP] , visto però che io sono nessuno l' ho abbandonata da subito , uno perchè un pò troppo laboriosa e impegnativa per il mio natante e secondo perchè come detto prima sono nessuno , quindi facile bersaglio di ogni autorità .
itwac	Ricordava lo schianto del ramo , il grido del suo terrore , la corsa ad occhi chiusi sotto il rombo radente delle ali , ma le [SEP] spade [SEP] non li avevano feriti ; e il ramo poté esser piantato nella terra di esilio .
itwac	" Viandante " No no uhuhuhuh rido troppo uhuhuh " Folle La situazione si era fatta comica , ma quella fottuta [SEP] spada [SEP] era una vera spina nel c ...
itwac	Poi InuYasha , con una sola oscillazione della sua [SEP] spada [SEP] , uccide l' esercito sopraggiunto degli youkai .
itwac	Quella legge , la 146 , partendo dal presupposto della tutela dei diritti del cittadino-utente , delinea un sistema di regole complesso che di fatto trasforma lo sciopero in una illegittimità latente , la proclamazione dello stesso in una via crucis procedurale e sempre minacciata dalla [SEP] spada [SEP] di Damocle della " Commissione di Garanzia " , organismo dalle competenze elastiche e dai poteri eccessivi .
itwac	Ø de Roberto , A. , ( Presidente del Consiglio di Stato ) , Santi Romano , ( Introduzione al convegno " Il Consiglio di Stato durante la presidenza di Santi Romano " - Roma , Palazzo [SEP] Spada [SEP] , 6 febbraio 2003 ) .
itwac	Lovte Regia di Simone [SEP] Spada [SEP] e Andrea Camuffo Con Duman Halmidoviç , Ulderico Daniele , Yasmin Hasanbasiç , Ekrem Budeci , Renato Segdic Italia , 2003
itwac	Era solo e indossava la sua consueta divisa invernale marrone : una giacca modello Ike con una semplice fascia dell' Usfa sulla manica ( una specie di [SEP] spada [SEP] azzurrina su uno scudo ad ampie strisce verticali rosse-bianche-rosse , i colori austriaci ) , ma nessun distintivo del suo grado .
itwac	Lydia Non vorrei che lanciasse una [SEP] spada [SEP] anche a me , ma dei civili ?
itwac	( tanto lo so già che risponderete la prima , okay ) Giusto per chiarezza : Tutto questo è cominciato perché , qualcuno , mentre si parlava di ricette di [SEP] spada [SEP] alla griglia o marinato , ha detto , non cito più , che non si poteva dimenticare un nero d' avola da berci sopra .
itwac	Già di mezzo sparito è il terreno ; già le spade rispingon le [SEP] spade [SEP] ; l' un dell' altro le immerge nel seno ; gronda il sangue ; raddoppia il ferir .
itwac	" Un Matrix dei poveri " , così lo definisce ridendo Giovanni [SEP] Spada [SEP] .
