corpus	sentence
itwac	Questi i punti salienti : 4 settimane ; siamo in due ( moglie ) ; amiamo soprattutto la natura , gli animali , gli spazi aperti , meno le citta' ; ci piacerebbe prendere un camper 4 WD per girare per i fatti nostri ( come gia' fatto nei parchi USA con auto + [SEP] tenda [SEP] ) ; vogliamo vedere il mare ; se capita vorremmo provare l' Indian Pacific ( ho letto Australian Cargo ) ; eventuali voli interni se e' il caso ; il budget non deve essere esagerato ma in generale non e' un problema .
itwac	Infine , quando ero ormai stanco , sono tornato piano piano verso la nostra [SEP] tenda [SEP] " .
itwac	La [SEP] tenda [SEP] bianca si mosse ancora , e una donna disse qualcosa .
itwac	Il vento ruba la [SEP] tenda [SEP] .
itwac	La grande [SEP] tenda [SEP] refettorio della Task Force " Alfa " ha accolto le rappresentanze di tutte le Armi e Specialità dell' Esercito ed in quella sede il Capo di Stato Maggiore ha pronunciato un breve discorso di saluto al personale presente spronandolo a continuare nell' opera che sta compiendo con l' entusiasmo e la professionalità che da sempre contraddistinguono i soldati italiani .
itwac	Apro la tenda e la trovo sommersa dalla neve ; il paesaggio intorno è completamente cambiato ed è per questo che Francesco non riesce a trovare la [SEP] tenda [SEP] e mi chiama a ripetizione .
itwac	Lâ  TMaltra [SEP] tenda [SEP] è dedicata ad attività ludiche organizzate dai volontari : uno spazio di aggregazione e di scambio indispensabile per evitare la chiusura e lâ  TMisolamento .
itwac	Si avvicinò alla finestra che si affacciava sull' accampamento , e alzò la pesante [SEP] tenda [SEP] marrone .
itwac	Il Sindaco con proprie ordinanze può individuare strade o zone di particolare interesse architettonico o ambientale nelle quali è vietata la collocazione di [SEP] tende [SEP] sulle facciate di cui al 1 ° comma ovvero essa è subordinata all' autorizzazione dell' Amministrazione Comunale o al rispetto di specifiche prescrizioni .
itwac	Ed ecco dietro di lui , tra le [SEP] tende [SEP] , veniva su una croce di legno molto semplice , ben visibile , e c' erano le bandiere tricolori .
itwac	Pieghe L' aria era ferma nel mattino d' ottobre neanche il suo sbadiglio scosse la [SEP] tenda [SEP] il sole faticava ad aprire l' o cchio di chi troppo aveva vissuto e poca voglia ne aveva di vivere ancora Anche il desiderio di scostare la tenda ormai era piccolo minore ad ogni forza del corpo e del pensiero Decise così di lasciarsi morire Ed il giorno dopo l' aria era immobile come prima nessuno sbadiglio la piegò nessuna lacrima fu versata Oggi ci sei per molti domani non ci sei per tutti .
itwac	Per rendere meno frustrante il tutto sono presenti nei vari dungeon delle [SEP] tende [SEP] che ci daranno la possibilità di salvare , combinare gli oggetti o di fare una pausa per conversare con gli altri membri della squadra , scoprendo così lati del proprio carattere o punti segreti del gioco , oltre che rendere più piacevole il prodotto con una pausa informale che riprende gli eroi del gioco staccati dagli eventi per qualche istante .
itwac	- Esatto , i gruppi dell' est hanno le [SEP] tende [SEP] a righe bianche , gialle e marroni ...
itwac	La [SEP] tenda [SEP] è stata donata dal Lions Club di Sesto Calende e Somma Lombardo ed è stata messa a disposizione di tutti gli operatori che vengono chiamati in caso di emergenze di protezione civile , oltre ai pompieri , quindi anche alla Croce Rossa e al 118 , per l' emergenza sanitaria .
itwac	Dato che Molly si è subito accorta che c' era un uomo nascosto dietro la [SEP] tenda [SEP] nell' appartamento di Ross , vuole dire che lei ha l' Unagi ?
itwac	2 ) - Cavo metallico teso lateralmente alla nave in senso longitudinale ( per chiglia ) per sostegno delle [SEP] tende [SEP] sui candelieri .
itwac	Colpa del camioncino promozionale del circo " La [SEP] tenda [SEP] rossa " , in città fino all' 11 , che stava portando a spasso la pantera per le vie del centro .
itwac	Alimentazione con prodotti locali e biologici Soggiorno in camere da 2 - 3 letti in Bed & Breakfast ( Possibilità di accamparsi con la propria tenda ) Quota di partecipazione : euro 90 ( corso + 2 pranzi ) , euro 150 ( corso + vitto + alloggio in B & B ) , euro 120 ( corso + vitto + posto [SEP] tenda [SEP] ) .
itwac	Quello che faceva anche un anno sotto terra in [SEP] tenda [SEP] nelle profondità delle viscere con equipaggiamenti della Nasa e faceva pure esperimenti vari .
itwac	Si dorme in [SEP] tenda [SEP] , su letti a castello .
itwac	Con una grande assemblea sotto la [SEP] tenda [SEP] principale di Punta Vagno - cioè la sede del Genoa Social Forum - il movimento ha concluso ieri sera la sua missione a Genova in un clima combattivo , serio , ma tristissimo .
itwac	Lui la amava e lei lo amava i suoi baci le suggevan via l' intero passato e futuro o così tentavano lui non aveva altro appetito lei lo mordeva lei lo morsicava lei suggeva lo voleva completamente dentro di sé sano e salvo per sempre e poi sempre le loro piccole urla svolazzavano nelle [SEP] tende [SEP] gli occhi di lei volevano che nulla si perdesse gli sguardi di lei gli inchiodavano polsi mani gomiti lui la avvinghiava stretta così che la vita non la trascinasse via da quel momento lui voleva che tutto il futuro cessasse lui voleva buttarsi con le sue braccia intorno a lei dall' orlo di quel momento e nel nulla o durevole o quel che ci fosse l' abbraccio di lei era un torchio immenso a stamparselo nelle sue ossa i sorrisi di lui erano soffitte d' un palazzo incantato ove non vi giungerebbe mai il mondo reale i sorrisi di lei erano morsi di ragno così lui giacerebbe immoto fino a che lei non si sentisse affamata le parole di lui erano eserciti d' occupazione le risate di lei erano tentativi d' assassino gli sguardi di lui erano proiettili pugnali di vendetta le occhiate di lei erano spettri nell' angolo con orribili segreti i sussurri di lui erano fruste e stivali i baci di lei erano avvocati che non smettevano di scrivere le carezze di lui erano gli ultimi ami di un naufrago i trucchi d' amore di lei erano frantumazione di legami e i loro gemiti profondi strisciavano sul pavimento un animale trascinante una grossa trappola le promesse di lui erano il bavaglio del chirurgo le promesse di lei gli scoperchiavano il teschio lei se ne farebbe fare una spilla i giuramenti di lui le estraevano tutti i tendini lui le mostrava come fare un nodo d' amore i giuramenti di lei gli mettevano gli occhi in formalina sul fondo del suo cassetto segreto le loro urla si appiccicavano alla parete le loro teste si staccavano nel sonno come le due metà d' un melone spaccato , ma è duro da smettere l' amore nel loro sonno intrecciato si scambiavano braccia e gambe nei loro sogni i loro cervelli prendevano l' un l' altro a ostaggio il mattino portavano uno il viso dell' altro .
itwac	[ 8 ] Quando Mosè usciva per recarsi alla tenda , tutto il popolo si alzava in piedi , stando ciascuno all' ingresso della sua tenda : guardavano passare Mosè , finché fosse entrato nella [SEP] tenda [SEP] .
itwac	Al funerale di un professore di sciita , il kamikaze si è mescolato alla folla raccolta in una [SEP] tenda [SEP] vicino alla moschea , in attesa del pasto serale e ha fatto scoppiare la cintura esplosiva .
itwac	stride il treno sul binario di partenza di te una mossa nell' aria Lei e il mare Lei , a piedi nudi controvento sugli scogli alti - era abituata - a sfidare le tempeste l' azzurra tela indiana avvolgeva il suo corpo - ancora giovane - di trasparenze esotiche , sembrava pietra di luna i lunghi capelli - da sempre obbedienti - seguivano ignari il rock del mare ritmato dal vento guardava fissa nel palmo socchiuso - come ostrica - la sua cara perla aveva le stesse trame dei suoi occhi la cullava piano tra le linee del futuro le rammentava memorie di giorni corallo , a lei che pure l' ombra aveva concesso alle onde il mare ingordo s' era saziato , ora nella mano - solo - il chiarore di una lacrima di pane , Fili d' erba Nubi inquiete stillano e rasentano rami in onda verde , il vento infrange risacche di memorie su scogli d' aria , s' intrufola curioso tra i capelli e titilla il cinguettìo dei miei pensieri , nel nido della stagione ritrosa come lumaca , s' accende e si spegne il faro sul cielo , cade un raggio sulle piccole gocce , illude il trifoglio con diamanti d' acqua , m' incanta questo prato specchio del tuo cuore - ampio di primavera - nella mano i fili d' erba spruzzati di polline sono carezze lievi - come il tuo bacio sulla punta delle dita - Solo un attimo Avrai solo un attimo - battito di ciglia - per raccogliere petali negli occhi zuccherini un attimo solo - goccia di miele - per bere sorso di rugiada sulle labbra ansiose un attimo ancora - scintilla di fuoco - per bruciarti nel torrente lavico , tra le colline Avrai solo un attimo - piuma di colibrì - per librarti in volo tra vapori d' amore ; mentre smozzico parole tu già mi sei accanto In un attimo Così ti svegli un mattino Così ti svegli un mattino scosti la [SEP] tenda [SEP] e t' avvolge pioggia sottile come seta d' oriente sulla pelle umida le rose sono calici d' acqua chine , sorreggono il pianto leggiadre come mani dove sarà l' anima del fiore ch ' attende la sua fine ?
itwac	Le prime pattuglie partite da S. Dalmazzo di [SEP] Tenda [SEP] il 10 gennaio e il 16 da Tolmino , giungevano con tempo inferiore al previsto a Domodossola e a Chiavenna il 1 ° febbraio .
itwac	Facciamo tre [SEP] tende [SEP] , una per te , una per Mosè e una per Elìa » .
itwac	Dovrei dormire con sevenstreet in [SEP] tenda [SEP] 5 ) partecipi alla cena di sabato ?
itwac	Per dormire sappi che ogni casa è praticamente un bed and breakfast , ma se hai la [SEP] tenda [SEP] vai all' unico campeggio , è vicino ai sentieri e la mattina ti sveglieranno gli scoiattoli .
itwac	COME SCEGLIERE LA VOSTRA [SEP] TENDA [SEP] PER L' ESTERNO LA SCELTA DELLA TELA : affinché resista all' usura del tempo , scegliete delle stoffe resistenti .
itwac	Nè poteva mancare il castello di Binasco [ 23 ] , dove nel 1418 Beatrice di [SEP] Tenda [SEP] , falsamente accusata d' adulterio dall' avido secondo marito Filippo Maria Visconti , fu decapitata assieme a un paggio , suo presunto amante .
itwac	ci sono circa zero gradi , c' e' vento e la cerniera della [SEP] tenda [SEP] non si chiude fino in fondo e quindi entra una bella arietta gelida !
itwac	cena notturna in [SEP] tenda [SEP] ...
itwac	per sè stessa è stata particolarmente munifica ( una foca di peluche , una maglia e una mega bandiera inglese che pretendeva di appendere in sala , tra una [SEP] tenda [SEP] e l' altra , con le mollette da bucato !
itwac	tidu La ditta di Milano mi ha appena scritto dandomi la conferma della sua disponibilità , praticamente in cambio della distribuzione della loro brochure ( organizzano viaggi alpinistici su tutte le montagne del mondo ) ci daranno arco gonfiabile con compressore , [SEP] tenda [SEP] , panche e tavoli per la direzione gara .
itwac	Il primo giorno al camping un forte temporale ha travolto la nostra grande [SEP] tenda [SEP] ...
itwac	Nel caso di installazione di una [SEP] tenda [SEP] e delle relative intelaiature metalliche su di uno spazio di proprieta' comune , da parte del condominio del piano terreno che lo abbia in uso esclusivo e destinato a ristorante , per la sussistenza della violazione dell' art. 1102 c.c. , con riguardo al mutamento della struttura e della funzione del detto bene comune ed in particolare al diritto di veduta in " a piombo " dei condomini dei piani superiori , deve accertarsi sia l' utilitas ( specifica o socialmente rilevante ) derivante da quel diritto che in concreto la sua menomazione , tenendo conto del distacco ( in altezza ) della tenda dalle vedute dei piani superiori , delle caratteristiche dei luoghi e dell' uso normale , nonche' , in relazione alla specifica destinazione dello spazio comune , delle consuetudini e del normale comportamento degli esercenti di attivita' consimili .
itwac	h ) Quando vai in campeggio , non hai bisogno del montante per la [SEP] tenda [SEP] .
itwac	Topic : Chi era oggi al colle di [SEP] Tenda [SEP] ?
itwac	La tigre doveva essergli piombata addosso a tradimento mentre vegliava presso i fuochi , o , più verosimilmente , mentre si era allontanato per fare un giro intorno alla [SEP] tenda [SEP] , e poi averlo portato via .
itwac	Alla iniziativa di Radio Tenda del 1984 - una vera e propria [SEP] tenda [SEP] attrezzata a studio radiofonico eretta a Roma in via dei Fori Imperiali per segnalare i problemi della categoria - fecero seguito manifestazioni di massa - le più imponenti che radio e televisioni locali riuscirono ad esprimere - nelle piazze San Giovanni in Laterano , S.S.Apostoli , nonché davanti al Ministero delle Poste e Telecomunicazioni in viale America all' Eur .
itwac	" La Donna Cannone " by Francesco DeGregori Buttero ` questo mio enorme cuore tra le stelle un giorno giuro che lo faro ` e oltre l' azzurro della [SEP] tenda [SEP] nell' azzurro io volero ` Quando la donna cannone d' oro e d' argento diventera ` senza passare per la stazione l' ultimo treno prendera ` .
itwac	L' Imperatore Costantino durante il suo regno dal 324 al 337 dopo Cristo , abbracciando il cristianesimo volle presso ciascuna Legione i sacerdoti ed una [SEP] tenda [SEP] per il culto religioso .
itwac	Avevo a disposizione un piano di 2 x 2,4 m quasi perfettamente orizzontale , che rivestii con moquette verde prato e munii di 4 attacchi in acciaio inox per i pali in fibra di vetro della [SEP] tenda [SEP] .
itwac	) ; sceglierei , per l' orrida e grottesca scena finale , Hamburgher Hill in cui un plotone si fa massacrare su quella dannata collina di " fondamentale importanza strategica " per farci poi scoprire che si era trattato di uno sbaglio dei superiori comodamente riparati nelle retrovie nelle loro [SEP] tende [SEP] con frigo-bar .
itwac	LEGGE DI SANTITA' Immolazioni e sacrifici [ 1 ] Il Signore disse ancora a Mosè : [ 2 ] « Parla ad Aronne , ai suoi figli e a tutti gli Israeliti e riferisci loro : Questo il Signore ha ordinato : [ 3 ] Qualunque Israelita scanna un bue o un agnello o una capra entro il campo o fuori del campo [ 4 ] e non lo conduce all' ingresso della [SEP] tenda [SEP] del convegno per presentarlo come offerta al Signore davanti alla Dimora del Signore , sarà considerato colpevole di delitto di sangue : ha sparso il sangue e questo uomo sarà eliminato dal suo popolo .
itwac	Furono allestite delle cucine provvisorie e per i militari furono costruite delle baracche ; gli internati furono sistemati invece in [SEP] tende [SEP] a gruppi di 15 - 20 , ognuno di essi ricevette una piccola coperta militare che sarebbe più esatto chiamare straccio più che coperta " Quando , all' inizio di novembre , si verificò il primo decesso , si pose il problema della sepoltura degli internati .
itwac	Continuai a pensare camminando e la cosa mi pareva chiara ; le scelta erano due : o continuare a marciare per raggiungere il camping a sera inoltrata , montare la [SEP] tenda [SEP] sotto una probabile pioggia per poi usufruire dei servizi ( io pensavo fondamentalmente ad una doccia ) o provare a fermarmi di lì a pochi minuti , piantare la tenda , cambiarmi d' abito ed attendere al caldo la ormai imminente scarica di pioggia .
itwac	Competenze specifiche : - aree di raccolta prima emergenza ( allestimento - attivazione ) - anagrafe sfollati ( totale - zone - nuclei familiari ) - allestimento logistico aree di primo ricovero ( in tenda ) - assegnazione ricoveri di prima emergenza ( [SEP] tenda [SEP] ) - alimenti e acqua ( distribuzione - magazzino - approvvigionamento ) - effetti letterecci e indumenti ( distribuzione - magazzino - approvvigionamento ) - assegnazione alloggi di emergenza ( moduli abitativi , ecc. ) - servizio postale 7 .
itwac	Non esisteva ancora una demarcazione precisa dei confini dell' impero , né un sistema fisso di difesa di tali confini ; le legioni non erano alloggiate in fortificazioni stabili costruite in pietra , ma in [SEP] tende [SEP] di pelle o in quartieri invernali in legno ( hiberna ) .
itwac	9 Cassonetti per rulli avvolgitori e guida in alluminio preverniciato , di colore verde , dello stesso RAL degli infissi ( 6005 ) , Colore delle [SEP] tende [SEP] beige , come per il terzo lotto ( RAL 1013 ) .
itwac	Il carrozzone ha messo le [SEP] tende [SEP] nella zona della via Caorsana e stasera inaugurerà i suoi spettacoli .
itwac	Gli occhi rivedono cose lontane ; posavo le labbra sui vetri e scioglievo i merletti di freddi cristalli 12/06/2002 indice TRANQUILLAMENTE ASCOLTAMI Nel tepore della nostra casa , dove mura amiche cullano i nostri SilenZi e addolciscono i toni della mia voce , dove il vento scivola tra le [SEP] tende [SEP] e ci ricorda il frusciar delle betulle .
itwac	Manfred apriva le [SEP] tende [SEP] , facendo entrare un sole smagliante , mentre Carlo , chino su di lui , gli sorrideva affettuoso con i suoi bei denti bianchi che risaltavano sulla carnagione bruna .
itwac	Alla iniziativa di Radio Tenda del 1984 - una vera e propria [SEP] tenda [SEP] attrezzata a studio radiofonico eretta a Roma in via dei Fori Imperiali per segnalare i problemi della categoria - fecero seguito manifestazioni di massa - le più imponenti che radio e televisioni locali riuscirono ad esprimere - nelle piazze San Giovanni in Laterano , S.S.Apostoli , nonché davanti al Ministero delle Poste e Telecomunicazioni in viale America all' Eur .
itwac	io la [SEP] tenda [SEP] canotto non l' ho portata ...
itwac	) , ma considerate che abbiamo sempre dormito in macchina o in [SEP] tenda [SEP] e siamo andati in ristoranti / osterie poche volte ( comunque economicissimi rispetto all' Italia ) , dato che ci eravamo già portati quasi tutto .
itwac	Il battesimo di mio figlio , a sei anni , è stata la Namibia ( 3 settimane di cui la metà in [SEP] tenda [SEP] ) : nessun problema .
itwac	La luce filtrava dalla finestra attraverso le [SEP] tende [SEP] bianco sporco e si rifletteva sul muro spoglio di quella camera d' albergo .
itwac	17 agosto 1998 Corsica , Corte Sgonfiamo i materassini , smontiamo la [SEP] tenda [SEP] e selliamo di nuovo la moto : queste procedure , quasi come un rito mattutino , ci accompagneranno tutti i giorni del viaggio .
itwac	Quindi il brahmana potè entrare con irrisoria facilità nella [SEP] tenda [SEP] dove dormiva Drishtadyumna , l' assassino di suo padre .
itwac	Arthen non si era più visto da quando era entrato in un' altra [SEP] tenda [SEP] che gli era stata indicata come quella abitata da un' anziana cartomante .
itwac	9 E dato che nella località non c' era nessun edificio , tranne la torre che Ercole aveva costruito , dovette vivere in una [SEP] tenda [SEP] finché non costruí una casa piccola per sua dimora .
itwac	( 2 ) Sull' Edizione 3 della tavoletta I.G.M. Foglio 91 III NE " [SEP] Tenda [SEP] " , stampata nel dopoguerra , il toponimo " Regione Forno " è stato corretto in " Torno " e il picco roccioso è stato chiamato " Castello di Torno " .
itwac	By Isotta 89 Inviato da : chat  20 Commenti : 1 Messaggio N ° 159 12 - 07 - 2005 - 20:09 AVVISO : L' UTENTE VENUSIA 2109 SARA' ASSENTE NEI PROSSIMI GIORNI CAUSA TRASLOCO DELLA [SEP] TENDA [SEP] IN CUI ALBERGA .
itwac	CREMONA Ecco tutte le iniziative promosse congiuntamente dall' Unità di strada dell' ASL di Cremona , dall' Associazione Famiglie Antidroga , dal Gruppo Propositivo Beta 2 , dalla [SEP] Tenda [SEP] di Cristo , dalla Cooperativa di Bessimo , dal Circolo Arcigay La Rocca di Cremona , dalla Cooperativa Fuxia e dall' Associazione V.I.V.A. SABATO 29 NOVEMBRE dalle 12.00 alle 13.30 Distribuzione materiale informativo all' uscita degli Istituti scolastici di grado superiore dalle 22.00 alle 24.00 Concerto di musica punk e oì dedicato alla Giornata Mondiale contro l' Aids ( e contro qualsiasi forma di emarginazione e negazione dei diritti ) al Kavarna , presso Cascinetto di Via Maffi 2 .
itwac	Un' altra dimensione audiovisiva del lavoro è quella della memoria dei suoi protagonisti : lavoratori che rievocano gli scioperi durante l' occupazione nazista con una parola d' ordine di grande intensità : Pane , pace e libertà ( è anche il titolo di un film di testimonianze diretto da M. Calopresti nel 1994 ) ; metalmeccanici che raccontano il lavoro e le condizioni di vita e gli incidenti e le malattie nelle fonderie e nei laminatoi della Terni , all' Alfasud di Pomigliano d' Arco , all' Italsider di Taranto , al Petrolchimico di Porto Marghera ; lavoratori minacciati di licenziamento che richiamano l' attenzione collettiva sulla loro prospettiva drammatica con iniziative simboliche , proprio durante le " feste " natalizie , magari erigendo una tenda nella celebre piazza di Spagna a Roma ( che G. M. Volonté documentò nel 1971 con La [SEP] tenda [SEP] in piazza ) ; dirigenti sindacali che descrivono con sapienza operaia ( come Emilio Pugno , intervistato da A. Ceste ) processi produttivi , modalità padronali di sfruttamento , misure disciplinari per i " sovversivi " , o che rievocano ( come Bruno Trentin , seguito da F. Giraldi in una lunga testimonianza autobiografica ) la propria militanza nel sindacato , iniziata accanto alla forte personalità di Giuseppe Di Vittorio .
itwac	Due colpi di pistola esplosero nella notte verde fosforescente di Newtown , e sotto gli occhi terrorizzati di Michael , nascosto dietro una [SEP] tenda [SEP] , le stragi dei Green cessarono del tutto .
itwac	In [SEP] tenda [SEP] no ?
itwac	I giovani vanno , per necessità , a vivere nelle [SEP] tende [SEP] nomadi dei contratti temporanei , dei freelance , delle collaborazioni e consulenze , delle società .
itwac	Oltrepassate la stanza dove avete rinvenuto il computer utilizzando l' apertura nascosta dalla [SEP] tenda [SEP] .
itwac	Orario di ricevimento dei membri della giunta Sindaco Mario Mazzotti : sabato , 10.30 - 12.30 Vice sindaco Pier Luigi Ravagli ( assessore alle politiche territoriali ed economiche ) : sabato , 10.30 - 12.30 Lucia Betti ( assessore alle politiche culturali , pari opportunità , turismo ) : giovedì , 11 - 13 Giuseppe Cortesi ( assessore alle politiche finanziarie , decentramento e informatizzazione ) : lunedì 12 - 13 , sabato 10 - 11 ( fissare appuntamento telefonando al numero 0545 280836 ) Claudio Conti ( assessore alle politiche formative , scolastiche , sportive e giovanili , rapporti internazionali ) : venerdì , 8.30 - 10.30 Carla Golfieri ( assessore alle politiche sociali e sanitarie ) : giovedì , 9 - 11 Paolo Graziani ( assessore ai lavori pubblici e alle politiche ambientali ) : sabato , 10 - 12 Mario Pasquali ( assessore all' organizzazione e affari generali , trasporti , mobilità , polizia municipale e protezione civile ) : sabato , 10 - 12 Associazione Intercomunale della Bassa Romagna Ancora aiuti alle popolazioni colpite dal terremoto Subito dopo il terremoto che colpì il Molise , la Protezione Civile della Bassa Romagna inviò , su richiesta delle autorità nazionali , un convoglio di tipo assistenziale a favore degli sfollati in [SEP] tenda [SEP] .
itwac	La sera , guarda sotto il letto , dietro gli usci , dietro la [SEP] tenda [SEP] della finestra , per vedere se non c' è nessuno in camera , e non spengerebbe mai il lume .
itwac	Dopo tutto , questo era l' oracolo da dove Dio parlava , " Quando Mosè entrava nella [SEP] tenda [SEP] del convegno per parlare con il Signore , udiva la voce che gli parlava dall' alto del coperchio che è sull' arca della testimonianza fra i due cherubini ; il Signore gli parlava " ( Num 7,89 ) .
itwac	Poiché molti pazienti soffrono di diarrea sono state aperte una unità di reidratazione , un' area di isolamento per i pazienti e una [SEP] tenda [SEP] per la convalescenza .
itwac	Chariza sorseggiò il the fumante e guardò fisso di fronte a sé , ma senza vedere né l' arredamento familiare della [SEP] tenda [SEP] né lei due ragazze che erano con lei , si perse invece in un miscuglio intricato di ricordi e di immagini .
itwac	Al primo piano s' accese una luce , e qualcuno scostò una [SEP] tenda [SEP] , poi la luce si spense .
itwac	" Dopo altri due giorni passati con questo ritmo , smontiamo per l' ennesima volta la [SEP] tenda [SEP] e ripartiamo .
itwac	Dopo una discesa quasi altrettanto emozionante , non ci resta che portarci verso Sospel , dove montiamo la [SEP] tenda [SEP] nel campeggio municipale , per unirci ai festeggiamenti della vigilia di ferragosto , data di liberazione della Provenza dai nazisti .
itwac	Stessa cosa quando presentò " Everyone I have ever slept with 1963 - 95 " , una [SEP] tenda [SEP] usata per molti viaggi e al cui interno aveva ricamato il nome di tutti gli uomini con cui aveva fatto l' amore .
itwac	Di notte ( e qui lo schermo è completamente buio , gli studenti non avendo a disposizione per un documentario artigianale strumenti di illuminazione adeguati ) qualcuno tira pietre contro le loro [SEP] tende [SEP] , si odono grida lontane e uno dei tre , Joshua , sparisce .
itwac	Su 6.500 metri quadri sono allestite 5 tensostrutture comunicanti adibite ad ambulatori e degenza ; una [SEP] tenda [SEP] pneumatica per la radiologia ; 14 tende modello P.I. 88 , della capacità di 8 persone ciascuna , adibite a magazzino , direzione sanitaria , segreteria , laboratorio analisi e dispensario ; una cucina da campo con relativo magazzino alimentare ; servizi igienici per i degenti e per il personale sanitario ; un potabilizzatore da 12.000 lt / giorno ; un gruppo elettrogeno .
itwac	Era costume delle popolazioni mongole , durante le campagne militari , di trasportare direttamente le tende su carri trainati da yak , evitando così nei lunghi trasferimenti di dover continuamente montare e smontare la [SEP] tenda [SEP] .
itwac	" tu dovresti vedere quello che hanno quei bulgari dondolando dappertutto nelle loro [SEP] tende [SEP] " .
