corpus	sentence
itwac	Piantare sempre la [SEP] tenda [SEP] solidamente : puo' succedere che da un cielo meravigliosamente stellato si scateni un vento o un acquazzone improvviso mentre dormite .
itwac	Era solito Mosè ritornare alla sua [SEP] tenda [SEP] , per dubbi e quesiti da risolvere ; era solito rifugiarsi nella preghiera , per alleviare i pericoli e le perversità degli uomini .
itwac	va n. 1 " Centro - Crocetta " : - 1 ) il Sindaco , entro 30 giorni dall' approvazione della modifica , individui le aree in cui è vietata l' installazione delle tende verso gli spazi pubblici ; - 2 ) l' installazione delle [SEP] tende [SEP] sia subordinata , oltre che alle decisioni dell' Assemblea condominiale , al parere dell' Ufficio Colore della Città di Torino per preservare l' omogeneità delle facciate nel contesto generale di via ; - 3 ) che gli interni corte , anche quando non visibili da spazi pubblici siano assimilati alle facciate principali ; - 4 ) che le eventuali contravvenzioni vengano elevate non al condominio ma ai condomini trasgressori ; - 5 ) che entro anni cinque dall' entrata in vigore della modifica del Regolamento tutti i fabbricati si adeguino alla medesima .
itwac	Ore 9.30 : partecipazione dei giovani alle messe nelle comunità limitrofe a Limone per un " annuncio di pace " Ore 15:00 : attività di animazione con la realizzazione di murales sul lungolago , volantinaggio e la presenza di alcune associazioni di volontariato e della [SEP] tenda [SEP] della pace .
itwac	[ 14 ] Fece poi teli di peli di capra per costituire la [SEP] tenda [SEP] al di sopra della Dimora .
itwac	72 E fanciulle dai grandi occhi neri ritirate nelle loro [SEP] tende [SEP] .
itwac	Uno dei criminali vola oltre la [SEP] tenda [SEP] schiantandosi su un tavolo all' esterno .
itwac	Il campeggio è proprio sul mare , ed è attrezzato con casette mobili , roulottes e piazzole per [SEP] tende [SEP] .
itwac	Avevamo deciso di visitare solo la città , dovendo proseguire il nostro viaggio , ma i treni al completo per i successivi due giorni e l' impossibilità conseguente ad acquistare i biglietti , ci ha fatto prendere la decisione giusta : avremo usato queste giornate in più per andare nel Parco Naturale di Terelj in [SEP] tenda [SEP] .
itwac	Amy era in mutandine nel chiarore arancio della [SEP] tenda [SEP] , china in avanti , che tentava di infilarsi nei jeans .
itwac	Lei rimase a bocca aperta , col naso all' insù , a fissare quelle lame bellissime e letali brillare alla debole luce che penetrava dallo spiraglio della [SEP] tenda [SEP] .
itwac	6 Disposte in tal modo le cose , nella prima [SEP] Tenda [SEP] entrano sempre i sacerdoti per celebrarvi il culto ; 7 nella seconda invece solamente il sommo sacerdote , una volta all' anno , e non senza portarvi del sangue , che egli offre per se stesso e per i peccati involontari del popolo .
itwac	21 Ai figli di Levi io dò in possesso tutte le decime in Israele per il servizio che fanno , il servizio della [SEP] tenda [SEP] del convegno .
itwac	Pietro prese allora la parola e disse a Gesù : " Signore , è bello per noi restare qui ; se vuoi , farò qui tre [SEP] tende [SEP] , una per Te , una per Mosè , e una per Elia " .
itwac	Hernando sostiene di aver udito le ultime parole di Honorato , perché stava origliando vicino alla [SEP] tenda [SEP] .
itwac	5 simile alla Q , rovesciata , o dalla figura di una mano aperta , o da quella ( " r ) dei Fenici e degli Ebrei , voce che significa porta , la porta triangolare della [SEP] tenda [SEP] .
itwac	( foto ) Arriviamo a destinazione stremati , ma è valsa la pena fare tanta strada : siamo in mezzo ai campi da golf e il prato dove dobbiamo mettere la [SEP] tenda [SEP] non è da meno di un green , FANTASTICO ...
itwac	Ospite di trasmissioni radiotelevisive di rilievo nazionale e internazionale , RADIO UNO così la descrive : " una voce dalle rare capacità poetiche e interpretative , poliedrica per estensione ed espressione " , partecipa a prestigiose rassegne : Palermodiscena , Kalsart , Selinunte , Segesta , Sanremo [SEP] Tenda [SEP] della Pace , Genova , Roma e Bologna , in Francia a Cluny e Londra .
itwac	da qui si raggiunge in breve il colle di [SEP] tenda [SEP] .
itwac	Un forte vento agita le [SEP] tende [SEP] strappate alle finestre .
itwac	La nostra destinazione il giorno dopo è Merzouga , da cui raggiungeremo l' oasi Oubira nel deserto di sabbia , il mitico Erg Chebbi , dove passeremo la notte in [SEP] tenda [SEP] .
itwac	drer & crc posse all stars in concerto Next by Date : sotto la [SEP] tenda [SEP] Prev by thread : 18/10 Cagliari : Serata per il Kurdistan : Koma Azad e dr .
itwac	                 " O stranieri , nel proprio retaggio Torna Italia e il suo suolo riprende ; O stranieri , strappate le [SEP] tende [SEP] Da una terra che madre non v' è .
itwac	Facciamo tre [SEP] tende [SEP] , una per te , una per Mosè e una per Elia " .
itwac	L' immagine è coperta da linee calligrafiche in arabo ( brani di lettere della madre ) che fanno da [SEP] tenda [SEP] .
itwac	Il colle di [SEP] tenda [SEP] non e' poi cosi' male ...
itwac	di Horace Campbell Dalel colline giamaicane alle strade di Brixton , i rasta rappresentano da decenni un riferimento costante nel panorama controculturale globale Intervengono collettivo shake e Africa Unite venerdì 27 PALCO PRINCIPALE ore 20.45 visioni di un nuovo medioevo ore 21.30 concerto Owen Gerrard biografia foto MODENA CITY RAMBLERS biografia foto [SEP] TENDA [SEP] MIGRANTI Ore 23.30 Bossa project ( Bosanova / jazz latino ) sabato 28 PALCO PRINCIPALE ore 20.45 visioni di un nuovo medioevo ore 21.30 concerto Los Fastidios biografia foto The Slackers biografia foto 1 foto 2 TENDA MIGRANTI Ore 23.30 Gigi callura band project ( Italian folkrock ) tutte le sere musica in tendablu e PatchankaBar --------------------------------------------------------------------------------
itwac	L' uomo fino dai primi tempi nei quali cominciò a sentire il bisogno di viver in società , cercò di stabilire la sua capanna , la sua [SEP] tenda [SEP] , la sua casa vicina a quella d' altri uomini ai quali comuni fossero ed i bisogni della vita ed i dolori e piaceri di questa .
itwac	Consegna a Mosè delle opere eseguite [ 33 ] Portarono dunque a Mosè la Dimora , la [SEP] tenda [SEP] e tutti i suoi accessori : le sue fibbie , le sue assi , le sue traverse , le sue colonne e le sue basi , [ 34 ] la copertura di pelli di montone tinte di rosso , la copertura di pelli di tasso e il velo per far da cortina , [ 35 ] l' arca della Testimonianza con le sue stanghe e il coperchio , [ 36 ] la tavola con tutti i suoi accessori e i pani dell' offerta , [ 37 ] il candelabro d' oro puro con le sue lampade , le lampade cioè che dovevano essere collocate sopra di esso , con tutti i suoi accessori , e l' olio per l' illuminazione , [ 38 ] l' altare d' oro , l' olio dell' unzione , il profumo aromatico da bruciare e la cortina per l' ingresso della tenda .
itwac	Nel frattempo , i generali dei Pandava si erano riuniti nella [SEP] tenda [SEP] di Yudhisthira per discutere dei piani della giornata .
itwac	" Lady Elophel si volse e , scostando una pesante [SEP] tenda [SEP] , uscì dalla porta incantata seguita da un atterrito Radyster .
itwac	Però per arrivare alla [SEP] tenda [SEP] in mezzo a piazza Freud c' è un sacco di fango stasera , dopo che hai schivato le macchine che fanno quella grande curva e accelerano nella seconda parte e quasi ti stirano .
itwac	La canzone più rappresentativa del primo filone è " La donna cannone " : " Butterò questo mio enorme cuore tra le stelle un giorno giuro che lo farò e oltre l' azzurro della [SEP] tenda [SEP] nell' azzurro io volerò quando la donna cannone d' oro e d' argento diventerà senza passare per la stazione l' ultimo treno prenderà E in faccia ai maligni e ai superbi il mio nome scintillerà [ ...
itwac	Dal piazzale del « Gemelli » i fedeli hanno visto innanzitutto aprirsi la [SEP] tenda [SEP] della finestra al decimo piano .
itwac	" 64 Cosí parlavan questi ; e ' l capitano , poi ch ' intorno ha mirato , a i suoi discende ; e perché crede che la terra in vano s' oppugneria dov' il piú erto ascende , contra lo porta Aquilonar , nel piano che con lei si congiunge , alza le [SEP] tende [SEP] ; e quinci procedendo infra la torre che chiamano Angolar gli altri fa porre .
itwac	Applausi , la [SEP] tenda [SEP] stazzonata si apre e parte il delirio di " Me cago en el amor " , non / filastrocca lanciata da un video assai diventente e da uno spot televisivo di ampia diffusione .
itwac	Dagan Torna in cima Amedeo Membro NGI Registrato : Jun 19 , 2004 Messaggi : 678 Località : Lonigo ( VI ) Inviato : Ven Nov 05 , 2004 4:19 pm Oggetto : Citazione : l' unica super-potenza occidentale E QUI CI STA LA NOSTRA ( DI EUROPEI ) COLPA                  " O stranieri , nel proprio retaggio Torna Italia e il suo suolo riprende ; O stranieri , strappate le [SEP] tende [SEP] Da una terra che madre non v' è .
itwac	I primi di Luglio 2004 si parlò di un acquisto di brandine , presumibilmente per le [SEP] tende [SEP] , e in Ottobre 2004 di uno di 80 scope di saggina per la partita di Quidditch , girata in studio su bluescreen .
itwac	" Da te è buio , in cameretta no è buio , io no ho la [SEP] tenda [SEP] ...
itwac	I mezzi della politica viscontea I mezzi impiegati furono i più vari , compresa la fortuna che fece morire al momento giusto Facino Cane , il più importante dei capitani di ventura a capo di Alessandria , Tortona e Novara , giusto in tempo perché Filippo Maria ne sposasse la vedova Beatrice di [SEP] Tenda [SEP] .
itwac	L' alpinista stava dormendo nella sua [SEP] tenda [SEP] quando è stato spazzato via da una valanga " , osserva Tarcisio Bellò , 42 anni , vicentino , uomo di punta della spedizione " K 2 - 2004 , 50 anni dopo " .
itwac	Entrate nella stanza alle vostre spalle , messa sotto sequestro dalla Polizia , e prendete la scaglia sulla [SEP] tenda [SEP] della vasca da bagno e il distintivo di Holden nell' armadietto .
itwac	Il beduino ( dall' arabo " badawi " , abitante del deserto ) non riconosce i confini convenzionali degli Stati , per casa ha la [SEP] tenda [SEP] e per patria il deserto infinito , senza barriere , coi suoi segreti e suoi tormenti .
itwac	Alle 10.30 ritrovo intorno a una [SEP] tenda [SEP] Tepee per ascoltare le poesie degli indiani d' America .
itwac	Lidl propone prodotti " da combattimento " che spesso compro , ma sai , una [SEP] tenda [SEP] non è come un paio di scarpe da ginnastica .
itwac	CULTURE - Flamenco , polenta e piatti africani : a Brescia c' è la Festa dei Popoli di Maryna Kashpar Una danzatrice di flamenco BRESCIA - Per conoscere meglio le culture del mondo , sabato 25 e domenica il 26 giugno a Brescia , la sede dell' associazione " La [SEP] tenda [SEP] di Abramo " ospitetà la " Festa dei popoli " : evento multiculturale , luogo di incontro e solidarietà .
itwac	Le figlie di Zelofcad , figlio di Efer , figlio di Gàlaad , figlio di Machir , figlio di Manàsse , delle famiglie di Manàsse , figlio di Giuseppe , che si chiamavano Macla , Noa , Ogla , Milca e Tirza , 2 si accostarono e si presentarono davanti a Mosè , davanti al sacerdote Eleazaro , davanti ai capi e a tutta la comunità all ` ingresso della [SEP] tenda [SEP] del convegno , e dissero : 3 " Nostro padre è morto nel deserto .
itwac	21 Poi quanti erano di cuore generoso ed erano mossi dal loro spirito , vennero a portare l ` offerta per il Signore , per la costruzione della [SEP] tenda [SEP] del convegno , per tutti i suoi oggetti di culto e per le vesti sacre .
itwac	E : ( dietro , a mezza distanza , un dito di lei ferma la [SEP] tenda [SEP] , come se il corpo fosse arretrato ) non è questo , è che mi sembra di sentire  cosa Euridice ?
itwac	Forse il profilo di una pianta dietro la [SEP] tenda [SEP] : la sua ombra ora netta .
itwac	Infatti gli incantesimi , che si ottengono nella [SEP] tenda [SEP] di Aladino , sono piuttosto vari e permettono simpatiche azioni ai danni degli avversari come l' annullamento del valore di alcuni gettoni oppure il loro spostamento in altre stanze e molto altro .
itwac	Per informazioni sul reale valore della [SEP] tenda [SEP] , l' ho = acquistata = 20 da " BERTONI Campeggio Sport " di Cinisello Balsamo .
itwac	22 Gli Israeliti non si accosteranno più alla [SEP] tenda [SEP] del convegno per non caricarsi di un peccato che li farebbe morire .
itwac	La norma , infatti , limita i poteri dell' organo assembleare a decisioni compatibili con la procedura di liquidazione , e non v' è dubbio che questa [SEP] tenda [SEP] inevitabilmente all' estinzione e non alla riattivazione della società .
itwac	" L' avvenire comincia da noi : voci di madri immigrate " il titolo di questo incontro che avrà luogo a partire dalle ore 9.00 , presso il Teatro Eden di Treviso , e che è promosso in collaborazione con Associazione La [SEP] Tenda [SEP] , Cooperativa Servire , Associazione Madamadorè , Coordinamento Fratelli d' Italia , Centro donna , Coordinamento provinciale associazioni handicappati .
itwac	Percorse rapidamente il breve tratto di [SEP] tenda [SEP] , sbuffando come un rinoceronte .
itwac	E forse , nel cuore , la voglia di urlare almeno una volta prima di andare in pensione , nel caos dell' ennesima rissa condominiale , la minaccia del Dio dell' Antico Testamento ( Osea 12 , 10 ) : « E ti farò ancora abitare sotto le [SEP] tende [SEP] , come ai tempi antichi » .
itwac	Nello stesso senso dice anche il beato Davide : Signore , chi abiterà nella tua [SEP] tenda [SEP] ?
itwac	UN FRUTTO : -- Licys UN GELATO : -- Cioccolato UNA FESTA : -- Oktober Fest UNA NAZIONE : -- Utopia UNA LINGUA : -- Tedesco UN FIORE : -- Tulipano nero UNA CAPITALE : -- Berlino UN ARREDO : -- Una [SEP] tenda [SEP] da salotto UN PERSONAGGIO DELLE FIABE : -- Il pesciolino d' oro .
itwac	Il piccolo accampamento si era svegliato da poco , quando Faarner uscì dalla sua [SEP] tenda [SEP] ; uno dei suoi uomini aveva acceso il fuoco sotto il paiolo della colazione , ed altri si stavano lavando nelle gelida acqua dell' Anduin .
itwac	Ino Andre , ma quella volta che all' Abetina abbiamo dormito in [SEP] tenda [SEP] con le due bulg ...
itwac	Io a Bo arriverò in treno alle 21.37 e poi andiamo a piantare una [SEP] tenda [SEP] nel campeggio vicino alla festa così il giorno dopo approfitto per visitare Bologna e salutare un' amica !
itwac	In [SEP] tenda [SEP] , in roulotte , in caratteristici bungalows , nelle camere con bagno o nelle case mobili dotate di aria condizionata ed ampia veranda , al Ville degli Ulivi si vive immersi in un giardino fiorito .
itwac	sabato prossimo parto per la croazia in [SEP] tenda [SEP] con un amico in sella alla mia fedele 535 XV , equipaggiata di borse laterali e portapacchi .
itwac	ecchila io sono l' ultima ruota del carro ( non e' falsa modestia ma consapevolezza dei miei limiti ) , ma vorrei dire che l' imago di Caxio mi e' piaciuto moltissimo e credo che sia proprio un esempio calzante per far conoscere questa nuova idea ho sempre avuto l' impressione che il verbis [SEP] tenda [SEP] a scivolare nella ampollosita ' , proprio per le troppe regole e limitazioni a cui deve sottostare l' esposto che rischia di diventare farraginoso e a volte anche dispersivo , o al contrario troppo lapidario e criptico in questo imago , secondo me , Caxio e' riuscito senza l' aiuto di grafemi aggiuntivi a descrivere brillantemente e con pochi tratti di matita l' esposto                  bacio meglio di quanto cucino Torna in cima alois Registrato : 12 Set 2003 Messaggi : 8459 Località : Roma Inviato : Ven Feb 11 , 2005 10:37 am Soggetto : thinker ha scritto : In effetti , autonomamente , era da un po' che riflettevo sulla necessità di sganciare in qualche modo il Verbis ...
itwac	Divertenti sono poi le schede del tipo Sognando crinoline : film con vestiti da urlo , in cui le autrici ricordano " vestiti talmente incredibili da ispirare persino chi non si interessa di moda " , come " il bel vestito bianco luccicante " di Winona Ryder nell' Età dell' innocenza , o il " famigerato vestito di velluto verde ricavato da una [SEP] tenda [SEP] " di Rossella O ' Hara .
itwac	7 , 43 " Anzi , vi portaste appresso la [SEP] tenda [SEP] di Moloc e la stella del dio Refàn ; immagini che voi faceste per adorarle " .
itwac	Va' dallo zar , e chiedigli una [SEP] tenda [SEP] dalla cupola d' oro , e cibi e bevande per il viaggio .
itwac	Il tetto " GranLuce " : camera con vista Lancia Musa è un' auto solare : oltre a impiegare superfici vetrate di grande dimensione , adotta il tetto apribile panoramico " GranLuce " , composto da due pannelli vetrati ( di cui uno apribile ) e da due [SEP] tende [SEP] parasole che scorrono indipendenti verso la parte posteriore della vettura .
itwac	Montiamo la [SEP] tenda [SEP] sul tetto , ci concediamo l' enorme lusso di una doccia ( fredda ) e siamo pronti per la cena a base di pasta con sugo di pomodoro e pezzi di pollo , annaffiando il tutto con un inaspettatto goccio di vero bordeaux francese portato da Evenich !! Sabato 27 Dicembre Dopo colazione ci portiamo in alto sulle pendici della falesia , nel cuore di Ireli .
itwac	E oltre l' azzurro della [SEP] tenda [SEP] , nell' azzurro , io volerò .
itwac	Così stretta è questa comunione tra Dio e i suoi eletti che Egli per così dire , abita , quasi come accampato in una tenda , in mezzo ad esso : e questa " [SEP] tenda [SEP] " è la gloria dei suoi attributi divini ( 7 , 15 ) .
itwac	La dacia è tiepida , accogliente con i suoi solidi mobili di legno scuro , i centrini bianchi irrigiditi dall' amido sugli schienali delle poltrone , le [SEP] tende [SEP] ricamate alle finestre doppie oltre le quali non si vedono che neve e abeti .
itwac	Heinrik afferrò un cannocchiale ed esplorò con lo sguardo la superficie : apparentemente non un fuoco , non una [SEP] tenda [SEP] , non un segno di vita , se non delle buffe scimmie e dei colorati uccelli che si intravedevano nel fitto di palme e mangrovie .
itwac	17 Introdussero dunque l ` arca del Signore e la collocarono al suo posto , in mezzo alla [SEP] tenda [SEP] che Davide aveva piantata per essa ; Davide offrì olocausti e sacrifici di comunione davanti al Signore .
itwac	Agli effetti della presente legge si in [SEP] tende [SEP] per laboratorio di analisi mediche ogni struttura aperta al pubblico nella quale vengano eseguiti prelievi e / o somministrazioni per prove funzionali ovvero indagini su materiale proveniente dal corpo umano dirette a fornire informazioni utilizzabili per la diagnosi , la prevenzione e il trattamento delle malattie o per la formulazione di giudizi diagnostici .
itwac	Scosto la [SEP] tenda [SEP] e cerco fuori il cielo .
itwac	10 Tutto il popolo vedeva la colonna di nuvola ferma all' ingresso della tenda ; tutto il popolo si alzava e ciascuno adorava all' ingresso della propria [SEP] tenda [SEP] .
itwac	Io son qui che aspetto in gloria che i miei pur amatissimi figlioli levino le [SEP] tende [SEP] ( ahimè , mi manca ancora parecchio ) e questi qui delineano il quadretto spaventevole della mammina bionda e agghindata che prepara salsine appetitose purché l' amato fanciullone ( naturalmente maschio , perché si sa , i maschietti son tutti cocchi di mamma ) un po' beota resti gioiosamente a rompere le palle fino ai quarant' anni e oltre .
itwac	Si è venuta a creare infatti una situazione che vede in una posizione avvantaggiata i sostenitori politici dei parlamentari del partito di governo AKP , mentre il resto della popolazione , come noto kurda e consapevole della propria condizione , non riesce ad ottenere aiuti sufficienti , soprattutto non ha potuto beneficiare delle [SEP] tende [SEP] , consegnate dal Governatore in maniera parziale .
itwac	Lo ha detto Leonardo Indiveri , presidente dell' associazione , durante il « Katedromos » ( un vero e proprio catechismo itinerante ) a Conversano nell' ambito della manifestazione « Natale sotto la [SEP] Tenda [SEP] » , organizzata dalla parrocchia Maris Stella con la collaborazione di Polizia Stradale sezione di Castellana , carabinieri , polizia municipale di Conversano e Corpo dei vigili del fuoco di Putignano .
