corpus	sentence
itwac	Di tanto in tanto si poteva assistere ad uno spet ­ tacolo che in altro momento avrebbe divertito chiunque ; una tenda o una coperta o una gavetta rotolava velocemente al suolo e il proprietario la rincorreva gridando per la paura di non riuscire a ricuperarla , per diversi minuti ; poi finiva coll ' urtare un' altra [SEP] tenda [SEP] liberandola involontariamente dai puntelli , co ­ sicchè il numero degli inseguitori aumentava sempre di più .
itwac	Se invece ci trovavamo ancora per strada o la situazione non era delle migliori per poter piantare abusivamente una [SEP] tenda [SEP] , decidevamo di dormire direttamente nella Snoopy Mobile , un po' rannicchiati , con un occhio chiuso e l' altro aperto perché non si sa mai ; e comunque di spazio , li dentro , ce n' era .
itwac	Tutto attorno pezzi di [SEP] tenda [SEP] e altri oggetti .
itwac	[ Significa ] che faranno da giudici [ anche ] coloro , di cui fu detto che occorre farseli amici mediante l' iniquo mammona , affinché essi a loro volta - dice - vi accolgano nelle [SEP] tende [SEP] eterne 38 .
itwac	In un passato nemmeno troppo lontano però , ho avuto nel mio team , per una decina di mesi , un' atleta americana ( amica di Lance , tra l' altro ) , che usava le famose [SEP] tende [SEP] .
itwac	Per informazioni : gdonati at iperbole.bologna.it oppure tutti i giorni sotto le 2 torri presso la [SEP] Tenda [SEP] della Solidarieta' .
itwac	Ma c' e' un ma : davanti alla [SEP] tenda [SEP] una " donna " vende " articoli da bagno " e " fa capire che non togliera' la tenda " .
itwac	Quando ogni mattina Alessio , apriva la [SEP] tenda [SEP] per andare a lavarsi lo spettacolo che gli appariva davanti agli occhi era unico , silenzioso , tenero .
itwac	VIKIN ( respingendolo infuriato )  Ma cosa fai qui ?! ANNALISA ( uscendo dalla [SEP] tenda [SEP] )  La stagione è terminata ieri sera , amico mio : devo sapermi rassegnare .
itwac	Illuminata per l' occasione da candele e strane luci soffuse , sembra di entrare in un salotto con [SEP] tende [SEP] di velluto rosso alla Anne Rice , anzi in un " giardino selvaggio " in attesa non di un dono oscuro ma di una musica seducente .
itwac	Saliamo a Cervinia giovedi sera ( 23/8 ) e piazziamo la [SEP] tenda [SEP] in un prato nei pressi degli impianti di salita .
itwac	43 Aronne e i suoi figli li indosseranno quando entreranno nella [SEP] tenda [SEP] del convegno o quando si avvicineranno all ` altare per officiare nel santuario , perché non incorrano in una colpa che li farebbe morire .
itwac	La mattina mettono fuori la testa dalla [SEP] tenda [SEP] e vedono un leone evidentemente affamato avvicinarsi a grandi falcate .
itwac	Ore 05.55 - In una bellissima area dotata di [SEP] tenda [SEP] da conferenza di metri 4 per 6 , posta nella piazzola di parcheggio , tutti i partecipanti alla gita , avranno la fortuna di assistere ad una simpaticissima dimostrazione di prodotti casalinghi e medicali Geriat & Clism .
itwac	e fra la [SEP] tenda [SEP] e il muro una luce !
itwac	Insomma , quando i giornalisti levano le [SEP] tende [SEP] non è mai una buona notizia per chi resta troppo solo , senza difesa , sia pure la difesa di un lampo Tv o due parole sul giornale .
itwac	Entreremo nelle sue [SEP] tende [SEP] .
itwac	É ridotta ad una [SEP] tenda [SEP] piena di mosche , ma è restaurabilissima " .
itwac	» Tuttavia , onde non potessero scorgere ciò che avveniva sulla pinassa , ordinò a sei marinai di coprire il ponte colla [SEP] tenda [SEP] , facendola tirare da prora a poppa .
itwac	Si potrà dormire in [SEP] tenda [SEP] al costo di 7  al giorno in un' area adibita per l' occasione con tanto di bagni , doccia , fornello a bombola , frigo , locale cambusa , il tutto immerso nella natura della Valle Argentina !!!
itwac	In mezzo a sette od otto [SEP] tende [SEP] raggiava un grande fuoco , su cui rosolava un animale che assomigliava ad un cervo , forse un axis .
itwac	Alcuni di questi bambini che abbiamo accolto erano alimentati con sondino e necessitavano della [SEP] tenda [SEP] ad ossigeno : l' ambiente ospedaliero sembrava indispensabile alla loro sopravvivenza .
itwac	Cinque grandi finestre , tre da una parte e due dall' altra ; quelle , più larghe , ad arco ; queste , a usciale , sul lago di sole d' un magnifico terrazzo a mezzogiorno ; e a tutt ' e cinque , un palpito continuo di [SEP] tende [SEP] azzurre di seta .
itwac	Giovedì 16 sono previsti un incontro con il Presidente della Provincia e 4 veglie di preghiera nelle parrocchie roma ne che ospiteranno i giovani , il 17 presso il Gran Teatro permanenza della [SEP] Tenda [SEP] della Pace ed incontro conclusivo alla presenza di testimoni impegnati , a vario titolo e in diversi ambiti , nella costruzione di percorsi di pace con la presenza tra gli altri di P .
itwac	Dopo l' incontro ravvicinato di Joshua , prendi il suo casco telepatico dal centro del cratere e la torcia e la corda dalla sua [SEP] tenda [SEP] .
itwac	Ma anche questa [SEP] tenda [SEP] , a volte , per abuso di analogia , è detta casa , e la casa talvolta , alla stessa maniera , è detta tenda ; in senso proprio però quella è la casa , questa la tenda .
itwac	[ 42 ] Quelli delle famiglie dei figli di Merari dei quali si fece il censimento secondo le loro famiglie e i loro casati paterni , [ 43 ] dall' età di trent' anni fino all' età di cinquant' anni , quanti potevano far parte di una schiera e prestar servizio nella [SEP] tenda [SEP] del convegno , [ 44 ] quelli di cui si fece il censimento , secondo le loro famiglie , furono tremiladuecento .
itwac	la scenografia c' è si , però , le useranno , faranno vedere i ragazzi dentro le [SEP] tende [SEP] oppure , appunto per risparmiare tempo , le useranno come sfondo e basta .
itwac	Ho un solo dubbio , legato alla strategia del ricovero in [SEP] tenda [SEP] : nei mesi caldi , sotto le tende , ci saranno 50 ° , con le prevedibili conseguenze per la vivibilità e l' igiene ; non era meglio investire nel recupero di grandi strutture , che pur esistono , da lasciare in dotazione all' Albania dopo l' auspicabile rientro in patria dei profughi ?
itwac	Il Camping Ticino é aperto da marzo ad ottobre , é accessibile ai disabili ed oltre a piazzole per [SEP] tende [SEP] , camper e roulotte offre alloggio in comodi bungalow da 2 a 4 posti completi di camera da letto , zona giorno con cucina e servizi .
itwac	Nel pomeriggio i VV.F. hanno iniziato le operazioni di assistenza alla popolazione ed il montaggio delle [SEP] tende [SEP] in prossimità dell' aeroporto .
itwac	Noi dormivamo in una [SEP] tenda [SEP] dietro il Circo .
itwac	22 Giuda fu sconfitto di fronte a Israele e ognuno fuggì nella sua [SEP] tenda [SEP] .
itwac	Progetto ' Una [SEP] tenda [SEP] a Pikine ' La scheda informativa del Campo internazionale di promozione sociale , aggregazione e animazione giovanile in Senegal promosso dall' Associazione ' Pl@netnoprofit' ( vedi la sezione ' Bacheca ' ) " Apri Famiglie Assieme 2005 Il file ( in formato pdf ) del pieghevole informativo sul percorso di formazione al volontariato familiare promosso da Provincia di Ferrara e CSV " Apri Articoli relativi Famiglie Assieme - Primavera 2005 .
itwac	La direzione non fornisce la [SEP] tenda [SEP] e il sacco a pelo , se non in casi straordinari .
itwac	Non possiamo lottare per i diritti delle persone umane senza lottare anche per quella che è stata " la [SEP] tenda [SEP] del Verbo " ( Cf .
itwac	Al riguardo , si può osservare come il portafoglio premi r.c. obbligatoria [SEP] tenda [SEP] ad assumere un' importanza proporzionalmente maggiore laddove il livello della produzione assicurativa danni risulta più contenuto .
itwac	Dovrete portarvi il sacco a pelo , scorte alimentari e di acqua , mentre la [SEP] tenda [SEP] non dovrebbe essere necessaria in quanto è molto raro che piova .
itwac	Si possono specificare i livelli su cui si vuole compiere la ricerca , utilizzando anche la finestra a [SEP] tenda [SEP] " Livello di descrizione " .
itwac	[SEP] tenda [SEP] , altrimenti vada pure in camper .
itwac	                 " O stranieri , nel proprio retaggio Torna Italia e il suo suolo riprende ; O stranieri , strappate le [SEP] tende [SEP] Da una terra che madre non v' è .
itwac	« Quando la notte la temperatura scendeva a meno due o meno tre gradi abbiamo patito un bel freddo , ma per fortuna sono state solo due le notti che abbiamo passato all' aperto e una , per fortuna , l' ho trascorsa in [SEP] tenda [SEP] , mentre l' altra con il solo sacco a pelo , perché non c' erano alberi ai quali appoggiarsi per montare la tenda .
itwac	" uno addirittura ci chiede se andiamo in campeggio ( scambiando le sacche da surf per [SEP] tende [SEP] ) .
itwac	Il tracciato di accesso più breve partendo da Torino è via Cuneo , Colle di [SEP] Tenda [SEP] , scendendo in Valle Roya sino a San Dalmazzo di Tenda .
itwac	In condominio in genere si cerca di unificare la scelta delle [SEP] tende [SEP] sia per forma che per colore .
itwac	Esse sono sparite davanti alla voracità dell' uomo bianco , come la neve al sole d' estate Tecumseh Gli uomini venivano chiamati a far parte del consiglio della tribù per i loro meriti , e uno , pur di avervi posto , preferiva essere povero , possedere pochi cavalli e vivere in una [SEP] tenda [SEP] piccola .
itwac	Bene , mi sembra tutto ; io mi posizionerò vicino alla [SEP] tenda [SEP] , e aspetterò lì la sera .
itwac	Ieri mattina si è svegliato alle sei , è uscito dalla [SEP] tenda [SEP] nel campo base di Santa Croce che condivide con altri uomini accorsi da Bologna venerdì scorso , dopo che si è compiuto il dramma della scuola di San Giuliano , e si è immerso nella quotidiana routine ( « sempre diversa , le cose cambiano ogni minuto » spiega ) .
itwac	Super sayan danilo no probabilmente sono spostato dall' altro lato completamente , perchè la capitaneria ci ha fatto paranoie per le [SEP] tende [SEP] ...
itwac	" ( Giobbe , Prologo , 1,10 ) " Saprai che la tua [SEP] tenda [SEP] è in pace e , visitando i tuoi ovili , non sarai deluso .
itwac	La [SEP] tenda [SEP] viene nuovamente chiusa e i testimoni lasciano la stanza .
itwac	tramonto dalla [SEP] tenda [SEP] ...
itwac	La sua lettera non mi fornisce molti dati per ipotizzare i motivi che spingono Mario e Piero a lasciare un segno del loro passaggio sulle [SEP] tende [SEP] e sui divani , ma non è da escludere che tale comportamento si possa attribuire : in uno ad una frustrazione dei diritti sociali e nell' altro ad una rivendicazione di un ruolo che può detenere solo grazie al sostegno degli umani .
itwac	Eliane non aprì apparentemente bocca , non pronunciò parole in nessuna lingua , si limitò a fissare con insistenza gli occhi scuri dell' Omori , che dopo pochi secondi non poté più sostenere lo sguardo di lei e la lasciò passare oltre la [SEP] tenda [SEP] , seguita dall' inseparabile Alexander .
itwac	Alcuni studi sull' uso degli apparecchi hanno anche sottolineato come l' utente medio americano [SEP] tenda [SEP] a preferire sempre di più il telefonino alla linea fissa , anche se in molti casi ciò comporta una spesa maggiore .
itwac	I servizi sono minimi e gli spazi per le [SEP] tende [SEP] liberi .
itwac	Piantare una [SEP] tenda [SEP] , superare una collina , risolvere il più banale dei problemi può poi diventare complicato se si abbraccia un' avventura come questa .
itwac	D : Una notte comunque riuscii ad appostarmi vicino alla sua [SEP] tenda [SEP] .
itwac	I fuochi davanti alle [SEP] tende [SEP] , i fumi , gli odori , le strane moto , i personaggi , gli spiedi e le cucine improvvisate ...
itwac	Marion Zimmer Bradley L' erede " Leslie non aveva più alcuna voglia di prendere le misure per le [SEP] tende [SEP] .
itwac	Il contatto diretto con la natura e la maestosità del deserto , i pernottamenti in [SEP] tenda [SEP] sotto il cielo stellato , i falò dove ci si ritrova tutti insieme alla sera e la purezza del silenzio aiutano sicuramente a ritrovare se stessi .
itwac	Le persone ai piani alti dei palazzi attorno avrebbero potuto benissimo vedere che ero nuda , appena coperta dalla [SEP] tenda [SEP] semitrasparente .
itwac	03/03/2005 19:49 * A Ferrara l' 8 marzo 03/03/2005 19:38 * Unicoop Tirreno per Baghdad e per Giuliana 03/03/2005 16:58 * Appello congiunto Veltroni-Delanoe 03/03/2005 16:13 * I " digiunanti " : " Andiamo avanti " 03/03/2005 16:11 * Mantica incontra i sauditi 03/03/2005 16:07 * Oggi a Palazzo Chigi 03/03/2005 16:00 * L' appello del Parlamento europeo 03/03/2005 15:55 * Una mostra a Firenze 03/03/2005 15:54 * L' Atomium di Bruxelles illuminato l' 8 marzo 03/03/2005 15:52 * Il convegno del Cidi dedicato a Giuliana 03/03/2005 15:48 * La sedia vuota di Giuliana 02/03/2005 22:41 * La " Non violenza attiva " dedicata a Giuliana 02/03/2005 22:31 * L' Università di Torino si interroga " contro la guerra " 02/03/2005 19:45 * Agnese Ginocchio canta per Giuliana alla [SEP] Tenda [SEP] della Pace di Sanremo 02/03/2005 19:07 * La mozione del Consiglio comunale di Nonantola ( Mo ) 02/03/2005 18:51 * Il Tribunale mondiale sull' Iraq a Genova 02/03/2005 18:34 * Una fiaccolata di solidarietà sulla frontiera italo-francese 02/03/2005 18:28 * L' appello di Alain Goussot sul quotidiano marocchino Al Bayane 02/03/2005 18:18 * I messaggi di Juri su Capodistria 02/03/2005 16:49 * Un miracolo in Iraq : appello del comico bolognese Vito per Giuliana 02/03/2005 16:32 * Digiuno per Giuliana .
itwac	L' idea di piantare delle [SEP] Tende [SEP] di pace è nata dalla volontà dei palestinesi e degli attivisti italiani che hanno partecipato alla missione di dicembre di dare visibilità e tangibilità alla loro presenza in quell' area , adottando uno strumento concreto di interposizione per proteggere la popolazione , le abitazioni , la terra e le infrastrutture .
itwac	Musica eseguita dal vivo , per " commuovere " il cammello , nell' affettuosa , gioiosa , serena intimità familiare raccolta sotto l' umile ma accogliente [SEP] tenda [SEP] aperta all' intenso e terso cielo notturno , in modo che la musica  canto profondo di voce umana e di strumento - possa lievitare , elevarsi , fino a sfogare con le stelle .
itwac	- ad un tratto , alle mani e ai piedi di Maximilian , Solomon , Nikolaj , Zamira e dello stesso William comparirono delle solidissime catene , legate l' una all' altra , infrangibili ; una risata di scherno si udì dall' esterno della [SEP] tenda [SEP] , poi vi fece ingresso lo zingaro che Dévìn aveva visto vicino alla tenda , con il suo strano ciondolo .
itwac	si fa quel che si può ;) obliquo : ah ma te sei quello tutto " sport , aria sana , viaggi , vela , [SEP] tenda [SEP] , windsurf , tennis e chi più ne ha più ne ometta ?
itwac	cmq fatemi solo sapere , se devo caricare la moto con [SEP] tenda [SEP] e tutto il resto .
itwac	Mentre prepariamo le [SEP] tende [SEP] , qualcuno fa alzare gli sguardi di tutti , indicando laggiu' nella valle una minuscola vettura che procede abbastanza veloce su una pista dritta e piatta : il suo rumore non arriva fin qui per via del vento e la sua visione pare piu' simile ad un' allucinazione che alla realta' ...
itwac	12 Se la sua offerta è una capra , la offrirà davanti al Signore ; 13 poserà la mano sulla sua testa e la immolerà davanti alla [SEP] tenda [SEP] del convegno ; i figli di Aronne ne spargeranno il sangue attorno all' altare .
itwac	A - Ma no , mi riferivo alle [SEP] tende [SEP] , alle imbottiture , ai muri .
itwac	altrimenti le guardie ci fanno una bella ramanzina con annessa e connessa una multa di qualche centinaio di dollari , così controvoglia siamo costretti a dirigersi verso la rampa di uscita per risalire dalla parte opposta da quella da cui siamo scesi ( essendoci all' interno due uniche vie d' accesso , una in entrata e una in uscita ) e ci dirigiamo così verso il nostro " camp-site " come lo chiama Paul , un ultimo pit-stop sul bordo per un ultimo sguardo di questo paradiso al tramonto e poi raggiungiamo il nostro caro amico Ibra che nel frattempo aveva montato le [SEP] tende [SEP] e preparato la cena .
itwac	La sua [SEP] tenda [SEP] ov ' egli tiene sua corte è sí grande , che bene vi stae sotto mille cavalieri ; e questa tenda àe la porta di verso mezzodie , e in questa sala dimorano li baroni e altra gente .
itwac	Perciò , rimasero per un certo periodo nei pressi della città , devastando i campi dei Remi e incendiando tutti i villaggi e gli edifici che avevano potuto raggiungere , poi , al gran completo , puntarono sul campo di Cesare e posero le [SEP] tende [SEP] a meno di due miglia di distanza .
itwac	I « sobborghi » invece sono sul pattume , le casupole sono composte da cumuli di spazzatura che diventano una specie di igloo , tenuti da [SEP] tende [SEP] da campeggio slabbrate e forate .
itwac	Spero sia permesso postare qualche foto , perchè vorrei mostrare il capolavoro d' ingegneria architettonica che è stata la [SEP] tenda [SEP] in cui abbiamo dimorato per 2 giorni col terrore che ci crollasse in testa da un momento all' altro .
itwac	1.3 O FFERTA T ECNICA ( B USTA N. 2 ) La Busta n. 2 " Pubblico Incanto per l' appalto della fornitura e posa in opera di [SEP] tende [SEP] oscuranti retrattili nelle scuole dell' infanzia del Comune di Reggio Calabria  Offerta Tecnica " dovrà contenere , a pena di esclusione dalla gara la seguente documentazione : Progetto esecutivo Relazione recante l' articolata descrizione del progetto esecutivo della fornitura - composto da elaborati descrittivi , grafici e contabili nel numero e nella consistenza ritenuti idonei dall' offerente - contenente la specificazion e completa , univoca e dettagliata delle attività operative e delle relative modalità a mezzo delle quali l' appaltatore intende eseguire le prestazioni dedotte nel Capitolato Speciale d' Appalto .
itwac	Il vecchio re fu scortato segretamente alla [SEP] tenda [SEP] di Achille da Ermes .
itwac	( dai , [SEP] tenda [SEP] , moto e via !
itwac	ci stà il prato con la [SEP] tenda [SEP] e il sacco a pelo ...
itwac	Se sopravviverete all' imboscata , prima di lasciare il locale , entrate nella stanza dietro la [SEP] tenda [SEP] , e prendete la borsa del medico sotto lo specchio .
itwac	però si potrei mettere una [SEP] tenda [SEP] su una zattera in mezzo al serio ...
itwac	Altroconsumo offre il profilo del camping sicuro per aiutare i turisti a scegliere : · Le auto devono essere parcheggiate in apposite aree separate da [SEP] tende [SEP] e roulotte , in modo da evitare che in caso di emergenza o fuga a piedi diventino un ostacolo e creino caos ; · Allâ  TMingresso del camping deve essere consegnata agli ospiti una mappa sulla quale sia evidenziata la localizzazione delle uscite di sicurezza e che comprenda consigli utili per evitare incendi ; · I cancelli e le uscite di sicurezza devono poter essere aperti rapidamente , meglio se dotati di maniglie antipanico ; in caso di chiusura a chiave , questa deve essere posta in una scatola chiaramente segnalata nelle vicinanze dellâ  TMuscita ; · La distanza minima tra una tenda e lâ  TMaltra deve essere di 2 metri .
itwac	Poi lascia la [SEP] tenda [SEP] trattenendo le lacrime .
itwac	Nel Mulino di Culmolle in Emilia Romagna Trasformato in agriturismo , l' antico mulino ad acqua di Culmolle , a Bagno di Romagna tra Forlì e Cesena , mette a disposizione dei visitatori alcune stanze , qualche piazzola per le [SEP] tende [SEP] e un servizio ristorante che utilizza prodotti coltivati biologicamente all' interno dell' azienda stessa .
itwac	Perché entrerò nel luogo della mirabile [SEP] tenda [SEP] fino alla dimora di Dio .
itwac	Il governo di Riad ha speso negli ultimi mesi circa un miliardo di dollari Usa per migliorare le attrezzature per la ricezione dei fedeli , soprattutto installando migliaia di [SEP] tende [SEP] realizzate con tessuti ignifughi e aumentando le riserve di acqua per combattere eventuali incendi .
itwac	lingua : it http://www.bussettisunrain.it C e T Tende da Sole Azienda specializzata nella produzione e riparazione di [SEP] tende [SEP] da sole .
itwac	Le autorizzazioni per installare una [SEP] tenda [SEP] nel territorio del Comune di Petrella Salto possono essere rilasciate solo a persone che abbiano compiuto il 18 ° anno di età .
itwac	Tanti altri abiti in mostra : la veste di un pellegrino buddista , un kimono con uccelli che nascono dalla spuma , una [SEP] tenda [SEP] con germogli di bambù .
itwac	3 ) I dialoghi vanno riscritti , o anche non scritti del tutto ( per esempio , OcchiBlu può accorgersi di quel che sta succedendo adocchiando qualche particolare oggetto magico nella [SEP] tenda [SEP] del maestro e dedurre il resto ) .
itwac	Ora fino a qualche mese fa , c' era sempre una coppia di militari , armati di tutto punto , che sfoggiavano una [SEP] tenda [SEP] militare con trincea fatta di sacchetti di sabbia a dimostrare lo stato di attenzione .
itwac	Compresi nella quota : area giochi interna per bambini Little Sheriff 's Corner con animazioni ( solo in alcuni giorni ) , area giochi esterna Fort Apache con [SEP] tende [SEP] indiane .
itwac	Così andavo da [SEP] tenda [SEP] in tenda a visitare le donne del campo .
itwac	Ci portiamo anche [SEP] tenda [SEP] e sacchi a pelo , ma da usare solo in caso di difficoltà .
itwac	r ) Tende ( installazione ) Nel caso di installazione di una tenda e delle relative intelaiature metalliche su di uno spazio di proprietà comune , da parte del condominio del piano terreno che lo abbia in uso esclusivo e destinato a ristorante , per la sussistenza della violazione dell' art. 1102 c.c. , con riguardo al mutamento della struttura e della funzione del detto bene comune ed in particolare al diritto di veduta in " a piombo " dei condomini dei piani superiori , deve accertarsi sia l' utilitas ( specifica o socialmente rilevante ) derivante da quel diritto che in concreto la sua menomazione , tenendo conto in ispecie del distacco ( in altezza ) della [SEP] tenda [SEP] dalle vedute dei piani superiori , delle caratteristiche dei luoghi e dell' uso normale , nonché , in relazione alla specifica destinazione dello spazio comune , delle consuetudini e del normale comportamento degli esercenti di attività consimili .
itwac	Nel frattempo le altre due squadre di protezione civile lavoravano al montaggio delle [SEP] tende [SEP] in altri punti della città .
itwac	03/03/2005 19:49 * A Ferrara l' 8 marzo 03/03/2005 19:38 * Unicoop Tirreno per Baghdad e per Giuliana 03/03/2005 16:58 * Appello congiunto Veltroni-Delanoe 03/03/2005 16:13 * I " digiunanti " : " Andiamo avanti " 03/03/2005 16:11 * Mantica incontra i sauditi 03/03/2005 16:07 * Oggi a Palazzo Chigi 03/03/2005 16:00 * L' appello del Parlamento europeo 03/03/2005 15:55 * Una mostra a Firenze 03/03/2005 15:54 * L' Atomium di Bruxelles illuminato l' 8 marzo 03/03/2005 15:52 * Il convegno del Cidi dedicato a Giuliana 03/03/2005 15:48 * La sedia vuota di Giuliana 02/03/2005 22:41 * La " Non violenza attiva " dedicata a Giuliana 02/03/2005 22:31 * L' Università di Torino si interroga " contro la guerra " 02/03/2005 19:45 * Agnese Ginocchio canta per Giuliana alla [SEP] Tenda [SEP] della Pace di Sanremo 02/03/2005 19:07 * La mozione del Consiglio comunale di Nonantola ( Mo ) 02/03/2005 18:51 * Il Tribunale mondiale sull' Iraq a Genova 02/03/2005 18:34 * Una fiaccolata di solidarietà sulla frontiera italo-francese 02/03/2005 18:28 * L' appello di Alain Goussot sul quotidiano marocchino Al Bayane 02/03/2005 18:18 * I messaggi di Juri su Capodistria 02/03/2005 16:49 * Un miracolo in Iraq : appello del comico bolognese Vito per Giuliana 02/03/2005 16:32 * Digiuno per Giuliana .
itwac	Infinite donne contro tutte le guerre , come ogni mercoledì , organizzano con interventi e performances l' intera giornata alla [SEP] tenda [SEP] tra cui : ore 18 intervista in collegamento telefonico con Luisa Morgantini europarlamentare a cura del Forum Donne PRC di Bologna .
itwac	All' inizio del suo esilio , nei mesi di incertezza vissuti sotto una [SEP] tenda [SEP] asfissiante nei giardini dell' Orange Bowl di Miami , senza sapere ancora se avrebbe ottenuto il permesso di soggiorno negli Stati Uniti , Fernando aveva cominciato a pensare a un ritorno breve ma necessario , che lo avrebbe aiutato a rimarginare le ferite ancora sanguinanti provocate da un tradimento distruttore e , forse , anche a guarire dalla vertiginosa sensazione di ritrovarsi spaesato , fuori dal tempo e in un altro spazio .
itwac	Sto aspettando anche la risposta di un mio amico che viene da catania che ha la [SEP] tenda [SEP] .
itwac	Gruppi elettrogeni fanno puzza qua e la , fornelli a benzina brontolano nelle [SEP] tende [SEP] mensa per scaldare vivande , principalmente in scatola , ed acqua raccolta rompendo la superficie di ghiaccio dei numerosi laghetti sparsi fra le tende .
itwac	Rientrammo colmi di gioia alla nostra [SEP] tenda [SEP] ed accendemmo finalmente una sigaretta ciascuno per gustarla come non mai .
itwac	Le [SEP] tende [SEP] sono costituite da pannelli modulari in polivinile armato , ad alto peso molecolare , abbinato a strati di fibre di cotone o di vetro alternate con materiali viscoelastici .
itwac	A questo [SEP] tende [SEP] .
itwac	E il tuo week-end con zaino e [SEP] tenda [SEP] ?
itwac	- 4 ° giorno : VALLOIRE - BARCELONETTE Cosa c' è di meglio , dopo alcune notti in campeggio , di una bella dormita in un letto vero e della comodità di non dover smontare la [SEP] tenda [SEP] ?
itwac	" 39 Quinci s' invia verso le [SEP] tende [SEP] , e intanto colà gridava il solitario Piero : " Già vinto è de la selva il fero incanto , già se ' n ritorna il vincitor guerriero : vedilo .
