corpus	sentence
itwac	" Male , ieri sono andato alla stazione e per non farci vedere ci siamo nascosti persino dietro una [SEP] tenda [SEP] , ma sono riusciti lo stesso a farci 4 foto ...
itwac	Sono stati invece un centinaio gli interventi del 118 di Bologna , presente con 31 operatori , quattro ambulanze e una [SEP] tenda [SEP] nel parco di Villa Angeletti .
itwac	Tutto il popolo vedeva la colonna di nube , che stava all' ingresso della [SEP] tenda [SEP] e tutti si alzavano e si prostravano ciascuno all' ingresso della propria tenda .
itwac	) ci ha presentato vari personaggi del suo repertorio : Iniziando con una performance da mago che ha coinvolto parte degli spettatori , Raul Cremona ci ha poi presentato l' attore in erba che insegna recitazione tra i boschi , pardon , tra le [SEP] tende [SEP] del teatro , ad alcuni volenterosi apprendisti attori , per passare a Silvano , il mago di Milano e all' amatissimo Omen , applaudito persino dalle femministe tra di noi ...
itwac	Non è neppure indispensabile che l' abitazione stia in un luogo fisso , per cui ci sono popolazioni che si chiamano " nomadi " che si spostano continuamente da un territorio all' altro , quando arrivano in un luogo accogliente piantano le loro [SEP] tende [SEP] , e queste sono per un certo periodo le loro abitazioni .
itwac	Ci sono molti camper dall' altra parte , ma una [SEP] tenda [SEP] sola qui , montata alla perfezione , Scenic francese , due gonzi che giocano a freesbee .
itwac	Peter è imbarazzatissimo , ma sa del pescatore che incontreremo tra circa una settimana , si attacca al telefono satellitare ed organizza il trasporto della [SEP] tenda [SEP] mancante ; frattanto lui ed Aage , salvo pioggia , dormiranno all' aperto , dove , cacciato via dal mio russare , li seguirà a ruota anche Rainer .
itwac	- fino al 60 % della spesa riconosciuta ammissibile con un limite di contribuzione di L. 3.000.000 per l' allestimento di aree per la sosta ed il soggiorno presso le aziende agricole di turisti provvisti di [SEP] tende [SEP] o caravans .
itwac	DomoPad è uno strumento portatile e dalle dimensioni abbastanza contenute che , attraverso uno schermo sensibile simile a quello di un palmare , consente di gestire i vari dispositivi messi in rete all' interno di un' abitazione , dall' impianto di irrigazione a quello di illuminazione , dagli apparecchi audio-video alle [SEP] tende [SEP] e tapparelle , dai sistemi di sicurezza alla climatizzazione .
itwac	Guarda le [SEP] tende [SEP] , odora il profumo d' incenso .
itwac	Mercoledì 1 settembre : Isole Whitsundays  Airlie Beach  Townsville Alle quattro del mattino siamo svegliati dalla pioggia che riprende intensa ma la nostra [SEP] tenda [SEP] regge perfettamente l' urto , rimanendo asciutta internamente ( anche perché l' abbiamo sistemata sotto un albero ) .
itwac	[ 41 ] Questi appartengono alle famiglie dei figli di Gherson , di cui si fece il censimento : quanti prestavano servizio nella [SEP] tenda [SEP] del convegno ; Mosè e Aronne ne fecero il censimento secondo l' ordine del Signore .
itwac	Si alzò dalla sedia della cucina e corse verso la finestra del soggiorno , scostò appena la [SEP] tenda [SEP] per non essere visto .
itwac	                 " O stranieri , nel proprio retaggio Torna Italia e il suo suolo riprende ; O stranieri , strappate le [SEP] tende [SEP] Da una terra che madre non v' è .
itwac	Nella seconda settimana si aggiunge la residenzialità presso la cascina con il pernottamento in [SEP] tenda [SEP] , ( agricampeggio ) , da lunedì a venerdì .
itwac	Tutto sommato è andata bene  disse Amalia voltandosi verso Valeria e Lucio , guardandoli con un sorriso soddisfatto  Ed è ora che io mi occupi delle esequie di mio fratello , scusatemi  scivolò dentro la [SEP] tenda [SEP] e nell' ombra che là regnava .
itwac	[ 9 ] Per fede soggiornò nella terra promessa come in una regione straniera , abitando sotto le [SEP] tende [SEP] , come anche Isacco e Giacobbe , coeredi della medesima promessa .
itwac	" Durante quell' estate del 1944 , dovetti limitare la mia scoperta a ciò che potei intravedere fra le [SEP] tende [SEP] dell' accampamento alleato e cioè l' ingresso la cui volta circolare sovrasta l' atrio al centro del fabbricato , ove sostavano le carrozze dei principi , dopo aver percorso un breve tratto del viale che parte dal maestoso cancello posto nel muro di cinta e sostenuto da due manufatti semicircolari sovrastati dai simboli dello stemma dei Chigi : le montagne e la stella a otto punte .
itwac	Lui , che si è sempre considerato più girondino che giacobino ( " io non apparterrei alla razza dei giacobini che tagliavano le teste , ma a quella di coloro a cui la testa veniva tagliata " ) e su questo ha amabilmente polemizzato con Jemolo , ci scherza sopra con uno stornello autorironico , l' " Autosfottò del mite giacobino " : Gli antifascisti levano le [SEP] tende [SEP] , ma il mite giacobino non si arrende .
itwac	2/0016 - 412 ] NELLE VERDI COLLINE DI FIRENZE SUD A SOLI 10 KM DAL TEATRO [SEP] TENDA [SEP] DISPONIAMO DI NUOVA COSTRUZIONE DI PICCOLA EDIFICIO RESIDENZIALE PER TRE UNITÀ ABITATIVE DI 150 MQ L' UNA CORREDATA DI PARCHEGGIO E LASTRICO SOLARE CON VISTA SULLA VALLATA SAN CASCIANO IN VAL DI PESA - LA ROMOLA [ BC - 00 - 39 - RIF .
itwac	[ 8 ] Avranno in custodia tutti gli arredi della [SEP] tenda [SEP] del convegno e di quanto è affidato agli Israeliti e presteranno servizio alla Dimora .
itwac	I TIPI , le famose [SEP] tende [SEP] indiane possono ospitare gruppi di persone o singoli per attivita ` comuni o piu ` semplicemente per una vita immersa nella natura La magia dei luoghi consente di respirare l ` aria del passato e durante le passeggiate , tra vigneti e ginestrai , lungo una fitta rete di sentieri ( antiche dogane ) che si inerpicano fino alla cima delle colline , possibile incontare animali selvatici come cinghiali , istrici e tassi e godere della compagnia del falco biancone .
itwac	Con [SEP] tenda [SEP] , sacco a pelo e zaino ben rifornito ci sono andato dappertutto senza ostacoli ; e trent' anni fa ho visto tedeschi e nordici in generale con bauli di metallo montati perfino su monocilindriche Suzuki e Yamaha 250 che , viste oggi , appaiono veramente minuscole .
itwac	Al crepuscolo , accalcati attorno alla finestra di una [SEP] tenda [SEP] , un numeroso gruppo di locali si contende a spintoni un posto da cui poter intravedere due infermiere tedesche che drenano il pus dall' orecchio infetto di un giovane .
itwac	Io credo giusto , finché sono in questa [SEP] tenda [SEP] del corpo , di tenervi desti con le mie esortazioni , sapendo che presto dovrò lasciare questa mia tenda , come mi ha fatto intendere anche il Signore nostro Gesù Cristo .
itwac	Ma la [SEP] tenda [SEP] si aprì ; lasciando cadere lo zaino , egli varcò la soglia ; esangue , fluente , mi venne vicino , mentre io indietreggiando venni trovarmi vicino al lettuccio .
itwac	Io dormivo in una [SEP] tenda [SEP] della protezione civile con altre tre volontarie ( due albanesi e una spagnola , quindi c' era anche il problema della comunicazione tra di noi ) e cinque ospiti .
itwac	Il Signore parlò a Mosè e gli disse : " Il primo giorno del primo mese erigerai la Dimora , la [SEP] tenda [SEP] del convegno .
itwac	L' intelligenza era di scegliere un posto riparato , tra ombra e luce , vicino a vegetazione da usare per ammorbidire il suolo sotto il fondo della [SEP] tenda [SEP] , non distante da una sorgente dove approvvigionarsi per bere e cucinare , lavare i panni e le stoviglie ( che strofinavamo con cenere e terra ) .
itwac	- A questo punto la [SEP] tenda [SEP] del privè si scosta ed entra una ragazza intabarrata con tanto di cappello e impermeabile sgualcito .
itwac	A seguito dei contatti con i rappresentanti degli Stati membri presenti al Military garden di Bam , alle ore 17.00 il Co-ordination Head convoca la prima riunione EU nella [SEP] tenda [SEP] di coordinamento a cui partecipano : Austria , Francia , Germania , Grecia , Polonia , Rep .
itwac	Mentre Scalesi si affanna per ottenere dalla vita dignità e ascolto , Cucca vive immerso in questa Tunisia dove è arrivato per caso , per lavoro , e dove è rimasto per ' mordere alla vita a pieni denti ' , respirando il mondo dei nomadi , tra le [SEP] tende [SEP] e i gorbini piegati dal vento del ghibli , ascoltando le leggende dei narratori raminghi , trascorrendo le notti africane nei caffè moreschi , tra il dolce suono dei bendir e il trillo ammiccante dei khal khal a ornare le caviglie delle giovani danzatrici .
itwac	Varese  Si gonfia in quaranta secondi la nuova tenda pneumatica della Protezione Civile Una [SEP] tenda [SEP] per le emergenze sul territorio Varese  Telelaser e autovelox per combattere l' eccesso di velocità nelle strade cittadine Giro di vite dei vigili sul codice della strada Angera  L' uomo , 47 di Ispra , si era incontrato con tre persone all' interno di un' automobile .
itwac	ke skifo Cascata del Toce Livello Raymond Poulidor Posts : 449 Registrato : Nov 2004 postato il 13/01/2005 alle 11:14 Sul Colle di [SEP] Tenda [SEP] sarò più preciso in giornata ...
itwac	Per il Consiglio  le ricordò Mei-lao  Nostro padre ci vuole tutte nella [SEP] tenda [SEP] principale .
itwac	Tutto sommato è andata bene  disse Amalia voltandosi verso Valeria e Lucio , guardandoli con un sorriso soddisfatto  Ed è ora che io mi occupi delle esequie di mio fratello , scusatemi  scivolò dentro la [SEP] tenda [SEP] e nell' ombra che là regnava .
itwac	Non si accorse che la sua [SEP] tenda [SEP] , avviluppata , si stava muovendo lentamente , come mossa da una vita propria .
itwac	Il nostro intento era quello di condividere con altri , giovani ed adulti , il nostro impegno e capire perché la storia dell' uomo , cominciata secondo la Bibbia con l' uccisione di Abele da parte di Caino , continuasse a produrre inutili morti , perché il più forte [SEP] tenda [SEP] ad escludere il più debole , perché la dichiarazione dei diritti venga accantonata .
itwac	X INFO ISORADIO 103.3 -------- - per raggiungere Roma si consiglia l' utilizzo dei mezzi di trasporto collettivo ( treni ) ; - munirsi del necessario per affrontare percorsi a piedi e possibili lunghe file ( acqua , viveri , radio , indumenti idonei a proteggersi dalle escursioni termiche , ombrello , ecc. ) ; - per avere informazioni aggiornate sintonizzarsi su ISORADIO frequenza FM 103.3  103.45 ; - per i giovani muniti di sacco a pelo e [SEP] tenda [SEP] e per i camperisti utilizzare l' area di Tor Vergata , appositamente attrezzata con i necessari servizi ( l' area è raggiungibile dall' autostrada Roma - Napoli uscita Torrenova ) ; - non raggiungere il centro di Roma con auto private .
itwac	A tutti i partecipanti alla camminata che partiranno da S. Lucia saranno offerti gratuitamente cena , posto [SEP] tenda [SEP] per pernottamento e colazione .
itwac	La bellezza di Claudia Torrelli é tutta sua , ed é la stessa , ed é diversa da quella degli altri oratori e da quella del pubblico , in questa mattina di sole e cielo aperto e in questa sala lussureggiante di [SEP] tende [SEP] rosse e colonne tortili , arredata a mo' di ironico circo orientale , invasa stamane da questa squadra di franchi minatori , che scavano le malefatte dei potenti e ne minano le detestabili artiglierie .
itwac	29 Fu riferito al re Salomone come Ioab si fosse rifugiato nella [SEP] tenda [SEP] del Signore e si fosse posto al fianco dell ` altare .
itwac	L' evento come da tradizione è interamente gratutito , c' è anche posto per qualche [SEP] tenda [SEP] , ma per lo più all' hackmeeting o non si dorme o si dorme dove capita !
itwac	Fermo automatico di sicurezza che blocca automaticamente la [SEP] tenda [SEP] all' incontro di un qualsiasi ostacolo .
itwac	References : La tenda di Abramo : in digiuno per la pace From : Davide Caforio d.caforio@po-net.prato.it Prev by Date : Cortometraggio Next by Date : Chiese cristiane Usa : cessazione bombardamenti , strategie nonviolente , ruolo Onu Previous by thread : La [SEP] tenda [SEP] di Abramo : in digiuno per la pace Next by thread : La tenda di Abramo : in digiuno per la pace
itwac	10 chains il 2005 - 06 - 23 10:22 , scrive : la mia [SEP] tenda [SEP] è già pronta , incomincerà con un bel rodaggio ad Arezzo Wave e continuare con il Festival di Benicassim sarebbe il massimo !!!
itwac	Perché la vita , se è vita , deve essere liberazione , vittoria , popolo , incontro , zolla , pane , sospiro , notizia , [SEP] tenda [SEP] , abbraccio .
itwac	Per essere precisi , sulle [SEP] tende [SEP] da doccia , dove si forma una " biopellicola " mista di sapone , polveri e batteri , l' 80 % dei quali appartiene a specie pericolose per chi ha un sistema immunitario indebolito .
itwac	Ci saranno la [SEP] tenda [SEP] del circo nel bel mezzo della piazza centrale della città , il Calciobalilla Umano in viale Trento e Trieste trasformate , per l' occasione , in villaggio dello sport , un' area gioco attrezzata con gonfiabili in viale Mazzini , due spettacoli teatrali per i ragazzini più grandi in piazza dei Contrari , una serie di laboratori creativiz nel centro storico che sfoceranno nel grande gioco dei cuochi pasticcioni tra montagne di farina e ingredienti di tutti i tipi , il Microcirco di Acquarone Ferrarsi e le Asinelle di Gombola nel quartiere di via Resistenza ...
itwac	Per resistere all' esercito di Sharon , i coloni più estremisti hanno rioccupato l' insediamento vicino a Jenin , trasformandolo nel loro avamposto MICHELE GIORGIO GERUSALEMME Cantieri aperti , un campo di [SEP] tende [SEP] affollato di donne e bambini e un teatro improvvisato nel cortile della vecchia stazione di polizia britannica .
itwac	Titolo : La [SEP] tenda [SEP] rossa Cast : Sean Connery , Massimo Girotti , Claudia Cardinale Regia : Mikhail Konstantinovic Kalatozov Durante la trasvolata del Polo nord un dirigibile comandato da Umberto Nobile , si schianta sui ghiacci .
itwac	a. Si parla dell' angoscia naturale di fronte alla morte : « noi che siamo in questa [SEP] tenda [SEP] gemiamo essendo aggravati , e perciò non desideriamo già di essere spogliati , ma rivestiti , affinché ciò che è mortale sia assorbito dalla vita » ( v. 4 ) b. la morte , quindi , pur avendo subito la sconfitta decisiva , non è ancora scomparsa .
itwac	Giosuè mandò allora messaggeri che corsero alla [SEP] tenda [SEP] , ed ecco tutto era nascosto nella tenda e l' argento era sotto .
itwac	Sta di fatto che per quattro giorni di viaggio in due persone con [SEP] tenda [SEP] al seguito , ne abbiamo fatto tranquillamente a meno , sfruttando l' ampio tunnel centrale e bilanciando i pesi .
itwac	Esco dalla [SEP] tenda [SEP] e mi piglia un colpo : c' è un condominio che occupa mezzo campeggio .
itwac	Egli fece suonare la tromba ; tutti si dispersero lontano dalla città e ognuno andò alla propria [SEP] tenda [SEP] .
itwac	] La casa del futuro è una [SEP] tenda [SEP] di forma ovoidale , delimitata da veli trasparenti .
itwac	31 Lo potrete mangiare in qualunque luogo , voi e le vostre famiglie , perché è il vostro salario in cambio del vostro servizio nella [SEP] tenda [SEP] del convegno .
itwac	Esternalizzare AZ non è la cura 250 lavoratori solidarizzano e si autodenunciano La repressione aziendale non fermerà le lotte Dichiarato lo stato di agitazione AdF : si svende Annunciata un' ASSEMBLEA CITTADINA Manifestazione davanti a Montecitorio CED / NCD : continua la mobilitazioine Una [SEP] tenda [SEP] permanente anche a Fiumicino Una PROPOSTA INUTILE , Una PERDITA di TEMPO L' Alitalia vuole intimidire la Cub-trasporti SEA e SEA Handling sciopero il 19 gennaio SCIOPERO Alitalia e Trasporto aereo il 19 genn .
itwac	La mattina alle sei chiese il piccolo crocifisso che la mamma gli aveva regalato per la Prima Messa e volle che fosse appeso sulla [SEP] tenda [SEP] per vederlo sempre .
itwac	Il Pakistan è uno dei maggiori produttori di [SEP] tende [SEP] e coperte per le operazioni dell' UNHCR in tutto il mondo .
itwac	Alla stessa maniera asperse con il sangue anche la [SEP] Tenda [SEP] e tutti gli arredi del culto .
itwac	/ /  di [SEP] Tenda [SEP] , vedova di Facino Cane ; sposò Filippo Maria Visconti , duca di Milano , il quale , disgustatosene , col pretesto di adulterio la fece decapitare ; 1370 + 1418 .
itwac	Si consiglia di stivarli in una ghiacciaia in una soluzione di acqua di mare e ghiaccio in proporzione 1:1 PROGRAMMA : Venerdì arrivo in giornata riunione presso il " punto destinato " nei Cantieri di Porto Cervo sotto l' apposita [SEP] tenda [SEP] in cui avverrà l' assegnazione dei numeri di gara e la regolarizzazione dell' Iscrizione ( assegnazione i numeri di gara .
itwac	Quando impetuosi torrenti attraversano la [SEP] tenda [SEP] indisturbati io e Beppe ci troviamo al centro della tenda , fortunosamente in corrispondena di una elevazione del terreno , un po' perplessi ed un po' assonnati a riflettere sulla caducita' della vita .
itwac	Sulla sinistra , invece , è posizionata una finestra oscurata da [SEP] tende [SEP] nere .
itwac	È che non possiamo lamentarci finora del caldo , perché sotto la nostra [SEP] tenda [SEP] non oltrepassa i gradi 32 ora che è inverno ; e nel deserto vicino che siam per passare , non oltrepassa ora i 43 ¡ , ma gli altri disagi concomitanti all' attual nostra posizione dovrebbero farci un po' risentire : quindi non abbiamo che ringraziare Iddio che ci presta speciale assistenza .
itwac	Chi può indovinare le cose che avvenivano nelle grandi stanze , nei saloni deserti della reggia di Alessandria , quali segreti desideri e potenti piaceri trovarono soddisfazione fra le [SEP] tende [SEP] dorate e sotto le immense statue delle divinità del Nilo ?
itwac	Momenti di panico per uscire dal sacco a pelo chiuso a mummia e dalla [SEP] tenda [SEP] , nella fretta mi trovavo incastrato all' uscita con Yuri , che sgomitando ( bastardo !
itwac	Questi son giorni di preparativi , lenti preparativi : comperare la [SEP] tenda [SEP] , il fornello da campo , i peperoncini piccanti , le scatole di tonno e di fagioli ( da vecchio west ) , portare la macchina dal meccanico per darle una controllatina generale , ricaricare la bombola di gas per cucinare ...
itwac	In alternativa o in aggiunta a Merzouga : da Zagora a Mahmid dove potremo noleggiare 4 x 4 per raggiungere dune alte fino a 70 m e dormire in [SEP] tende [SEP] berbere .
itwac	Il commendator Zegretti guardò le [SEP] tende [SEP] , guardò il tappeto , si buttò indietro su la spalliera del seggiolone e , accarezzandosi ora l' interminabile pizzo : - Mah !
itwac	Ma in un' altra [SEP] tenda [SEP] di Croce Rossa , quattro pazienti , inclusa una ragazzina , sono distesi sui letti .
itwac	Era una stanza confortevole , arredata con un gusto insolito e intensamente personale , inondata dal sole del Sud durante il giorno , ma in quel momento raccolta nell' ombra , con le [SEP] tende [SEP] tirate e illuminata da un' unica lampada .
itwac	» « E ripieghiamoci subito verso la [SEP] tenda [SEP] , signore , - disse il pescatore di perle .
itwac	Tali iscrizioni dovranno essere apposte o sulla mantovana o sul primo spicchio frontale ed eventualmente sui corrispondenti spicchi laterali per le tende a carrozza ; sulla mantovana frontale , quando si tratta di [SEP] tende [SEP] di tipo tradizionale od a pantografo ; nella parte inferiore del telo quando tali tende risultino sprovviste della mantovana .
itwac	E l' economia da sola [SEP] tende [SEP] alla disuguaglianza .
itwac	Lei si alza , attraversa la [SEP] tenda [SEP] , la richiude alle spalle .
itwac	Peccato che il signore delle tende da sole non abbia ancora consegnato i telecomandi delle [SEP] tende [SEP] per cui sul balcone si va in autocombustione dopo pochi minuti .
itwac	La notizia , divulgata da fonti del governo provinciale , non era stata confermata dalle autorità americane che oggi hanno smentito l' uccisione dei civili , che sembra si trovassero invece in un' altra [SEP] tenda [SEP] .
itwac	 Chariza aggrottò le sopracciglia e seguì con lo sguardo il perimetro della [SEP] tenda [SEP] .
itwac	Il fronte anti-ritiro sarebbe composto da 8 mila manifestanti mentre gli organizzatori delle proteste , che hanno scelto l' arancione come colore della resistenza , parlano di 40 mila persone disposte a rimanere sotto le [SEP] tende [SEP] e nel caldo soffocante pur di impedire quello che loro definiscono " il grande tradimento di Sharon " .
itwac	Numero minimo partecipanti 6 , max 8 ( possono accedere più persone se già pratici di canoa ) E 90.00 ( a persona , compresa attrezzatura , pasti e [SEP] tenda [SEP] ) Escursioni in notturna con la luna piena : Masua - Faraglioni - Laveria Lamarmora Masua - Porto Flavia - Canal Grande E 30.00 ( a persona )
itwac	ubicare le tende nel margine del bosco , mai nella radura o nel prato , evitando di realizzare i canaletti di scolo delle acque intorno alle [SEP] tende [SEP] .
itwac	L' ospitalità in spazi aperti è stagionale ed è svolta in aziende con estensione non inferiore a due ettari contigui di superficie agricola totale ( SAT ) e nel rispetto del limite massimo di ventiquattro ospiti e otto [SEP] tende [SEP] o altri mezzi di soggiorno autonomo , e di una densità massima di sei ospiti e due tende o altri mezzi di soggiorno autonomo , per ettaro di superficie agricola aziendale .
itwac	Cena e pernottamento in [SEP] tenda [SEP] nella baia di Canal Grande .
itwac	Si è ritenuto , pertanto , che il metodo della " fabbricazione di [SEP] tende [SEP] " fosse il più conveniente , specialmente in Iraq , dove gli uomini della resistenza sono sparsi in tutto il paese .
itwac	la [SEP] tenda [SEP] in territorio valdostano è addirittura vietata , quindi non resta altro che dormire in simili posti e sperare che un topo non ti entri in gola mentre stai dormendo ...
itwac	Circa alla 20.30 sbarchiamo sull' isola e , visto che non ci sono altre possibilità , montiamo la [SEP] tenda [SEP] in un posto che di campeggio ha solo l' insegna .
itwac	Ma si pensi a quanto è semplice ed ovvio tutto ciò per gli spazi privati : per le nostre case o gli spazi alberghieri è del tutto ovvio che chi progetta gli ambienti arrivi con la sua prestazione fino all' opera finita , agli arredi , ai fregi , alle [SEP] tende [SEP] , fino alle scritte dei cartelli indicatori .
itwac	Producevamo fiocchi per [SEP] tende [SEP] e smaltavamo gioielli in argento .
itwac	23 Ma non si potrà mangiare alcuna vittima espiatoria , il cui sangue va portato nella [SEP] tenda [SEP] del convegno , per il rito espiatorio nel santuario .
itwac	Tirati su e salta di [SEP] tenda [SEP] in tenda fino alla porta ( immagine ) .
itwac	Nella sola giornata di oggi , a Nahrin , MSF ha ricevuto 350 persone nelle tre [SEP] tende [SEP] allestite fin da ieri per assistere le vittime del terremoto di lunedì .
itwac	Cristiano Lucchi 05/03/2005 16:13 * Sospeso l' appuntamento di domani all' Auditorium 05/03/2005 10:35 * L' appello di Mani Tese 04/03/2005 18:29 * Un appello dalla comunità islamica di Francia 04/03/2005 18:19 * L' adesione allo sciopero della fame dei detenuti arabi musulmani del carcere di Terni 04/03/2005 18:07 * La gigantografia di Giuliana alla stazione di Milano Centrale 04/03/2005 17:24 * L' appello di Clara Magazine , giornale delle donne " resistenti " 04/03/2005 17:04 * A Genova Donne di corsa per Giuliana 04/03/2005 14:33 * AUDITORIUM : Una serata per Giuliana 04/03/2005 14:11 * Alla [SEP] tenda [SEP] della pace di Sanremo ...
itwac	Allora issammo una piccola [SEP] tenda [SEP] per metterlo al riparo .
itwac	- Alcune ore dopo , la signora Tizia , avviandosi verso il mercato , mentre butta un occhio sulle [SEP] tende [SEP] del salotto della vicina e getta l' altro in direzione dell' aiuola di fiori che cresce vicino agli argini del Raboso , si accorge che .
itwac	Ysabeau uscì dopo pochi minuti , avvolta in un mantello blu notte con cappuccio e , non certo a sorpresa , si diresse verso la [SEP] tenda [SEP] dell' Arcimago .
itwac	Alcuni di " loro " ti insultano , distruggono nuovamente la tua [SEP] tenda [SEP] , tagliano anche gli ulivi dai quali ricavavi il tuo sostentamento e ti chiudono l' acqua .
itwac	Si udì frusciare la [SEP] tenda [SEP] di perline e un' esclamazione soffocata .
itwac	I gestori di esercizi alberghieri e di altre strutture ricettive , comprese quelle che forniscono alloggio in [SEP] tende [SEP] , roulotte , nonché i proprietari o gestori di case e di appartamenti per vacanze e gli affittacamere , ivi compresi i gestori di strutture di accoglienza non convenzionali , ad eccezione dei rifugi alpini inclusi in apposito elenco istituito dalla regione o dalla provincia autonoma , possono dare alloggio esclusivamente a persone munite della carta d' identità o di altro documento idoneo ad attestarne l' identità secondo le norme vigenti .
itwac	PARIGI , 26 AGO - Una casa con le ruote per andare in vacanza nei fine settimana in un ambiente familiare , senza dover sottostare ai costi di un albergo ne' ai disagi di una [SEP] tenda [SEP] .
itwac	3 Al suono di esse tutta la comunità si radunerà presso di te all' ingresso della [SEP] tenda [SEP] del convegno .
itwac	e poi , vivere sotto lo stesso tetto è difficile , persino stare in [SEP] tenda [SEP] con gli amici per quindici giorni crea problemi " .
itwac	In conseguenza ecco ciò che accadrà : Mi rallegrerò e dividerò Sichima , e misurerò la valle delle [SEP] tende [SEP] .
itwac	Epilogo : Candido dono " La fresca aria del mattino fece breccia attraverso le pieghe della magica [SEP] tenda [SEP] , ridestando violentemente dal sonno il Principe dei Draghi .
itwac	Uno dei medici si affannò a passare una boccetta contenete un liquido verdastro sotto alle narici dell' imperatore , altri si affollavano sul suo ventre tamponando e pulendo , gettando le bende macchiate di bruno in un angolo scuro della [SEP] tenda [SEP] .
